id,cast,release_year,duration_int,duration_type
ds1,"chris diamantopoulos, tony anselmo, tress macneille, bill farmer, russi taylor, corey burton",2016,23.0,min
ds2,"jim varney, noelle parker, douglas seale",1988,91.0,min
ds3,"raymond albert romano, john leguizamo, denis leary, queen latifah",2011,23.0,min
ds4,"darren criss, adam lambert, derek hough, alexander jean, fall out boy, jimmie allen",2021,41.0,min
ds5,"john lennon, paul mccartney, george harrison, ringo starr",2021,1.0,season
ds6,"jacques yves cousteau, vincent cassel",2021,94.0,min
ds7,"jeremy renner, hailee steinfeld, vera farmiga, fra fee, tony dalton, zahn mcclarnon",2021,1.0,season
ds8,"gary muehlberger, mary miller, curly leach, sam carlson, stuart andrews, david squibb",2015,2.0,season
ds9,"dr. ray ball, dr. lauren smith, chris massaro, tiffany burns, mike burns, melinda mendolusky",2019,2.0,season
ds10,"steve whitmire, dave goelz, bill barretta, eric jacobson",2008,45.0,min
ds11,"don hahn, kathryn beaumont, pete docter, kevin feige, mark hamill, bob iger",2020,59.0,min
ds12,,2020,4.0,min
ds13,"stacy keach, john lasseter, brad bird, john musker, ron clements, frank thomas",2007,91.0,min
ds14,"dr. michelle oakley, zachary fine",2013,10.0,season
ds15,michael b. jordan,2021,2.0,min
ds16,,2021,1.0,min
ds17,"jack dylan grazer, marco barricelli",2021,8.0,min
ds18,"mia jenness, alyson hannigan, rob riggle, spencer moss, dana heath",2018,3.0,season
ds19,"carolina domenech, josé jiménez zapiola, kevsho, elena roger, clara alonso, emilia mernes",2021,1.0,season
ds20,"amy adams, patrick dempsey, james marsden, timothy spall, idina menzel, susan sarandon",2007,110.0,min
ds21,"stephen apostolina, kirk baily, ben bledsoe, david cowgill, terri douglas, fuschia!",2014,8.0,min
ds22,"kristen bell, idina menzel, jonathan groff, josh gad, santino fontana, chris williams",2015,11.0,min
ds23,"walt disney, marcellite garner, russi taylor, billy bletcher, will ryan, bob bergen",2013,7.0,min
ds24,"ellie kemper, rob delaney, archie yates, aisling bea, kenan thompson, tim simons",2021,95.0,min
ds25,"dwayne johnson, emily blunt, edgar ramirez, jack whitehall, jesse plemons, paul giamatti",2021,129.0,min
ds26,chris hemsworth,2021,2.0,min
ds27,,2021,14.0,min
ds28,,2021,1.0,min
ds29,josh gad,2021,1.0,season
ds30,"john kahrs, kari wahlgren",2012,7.0,min
ds31,"pete docter, larry the cable guy, jack dylan grazer, domee shi, angus maclane",2021,5.0,min
ds32,"simu liu, awkwafina, tony leung, michelle yeoh, meng'er zhang, ben kingsley",2021,134.0,min
ds33,"avantika, michael bishop, anna cathcart, jahbril cook, kerri medders, aryan simhadri",2021,94.0,min
ds34,"mandy moore, zachary levi, alan dale, paul f. tompkins, kari wahlgren, mark allen stewart",2012,9.0,min
ds35,billy connolly,2011,8.0,min
ds36,,2006,7.0,min
ds37,"billie eilish, finneas, gustavo dudamel, patrick osborne, robert rodriguez",2021,30.0,min
ds38,"kyla pratt, tommy davidson, paula jai parker, jomarie payton, cedric the entertainer",2021,1.0,min
ds39,"dan castellaneta, nancy cartwright, yeardley smith, tress macneille, hank azaria",2021,6.0,min
ds40,,2010,6.0,min
ds41,,2021,22.0,min
ds42,,2021,3.0,min
ds43,"jason lee, david cross, jenny slate, justin long, matthew gray gubler, jesse mccartney",2011,87.0,min
ds44,"arnold schwarzenegger, sinbad, phil hartman, rita wilson, robert conrad, martin mull",1996,90.0,min
ds45,"larry the cable guy, brian stepanek, santino marella, kennedi clements, kirsten robek, rachel hayward",2014,91.0,min
ds46,"betty white, dave foley, derek richardson, sarah chalke, w. morgan sheppard",2010,8.0,min
ds47,"christopher lloyd, danny woodburn, craig anton, michael teigen, ben giroux, paul rae",2009,93.0,min
ds48,"dominic scott kay, john kapelos, lise simms, mike dopud, charles c. stevenson jr., dylan minnette",2008,91.0,min
ds49,"f.t. anderson, diedrich bader, field cate, kendall cross, mike dopud, mark downey",2009,87.0,min
ds50,"resse alexander, diedrich bader, sahar biniaz, jan boss, ameko eks mass carroll, melody choi",2010,101.0,min
ds51,"james mcavoy, michael fassbender, rose byrne, jennifer lawrence, january jones, nicholas hoult",2011,132.0,min
ds52,"justin felbinger, amanda leighton, bill farmer, brenda song",2018,3.0,season
ds53,joel sartore,2017,1.0,season
ds54,,2021,1.0,season
ds55,,2021,44.0,min
ds56,"kevin costner, maria bello, morgan saylor, martha higareda, michael aguero, sergio avelar",2015,131.0,min
ds57,"thomas ian nicholas, gary busey, albert hall, amy morton, dan hedaya, eddie bracken",1993,104.0,min
ds58,"gino conforti, barbara cook, jodi benson, will ryan, june foray, kenneth mars",1994,87.0,min
ds59,"kyle breitkopf, jacob ursomarzo, addison holley",2015,5.0,season
ds60,,2021,1.0,season
ds61,dr. albert yu-min lin,2021,44.0,min
ds62,albert lin,2021,44.0,min
ds63,"bill anders, jack clemons, fred haise, glynn lunney, jay barbree, brad vinikow",2019,1.0,season
ds64,"mckenna grace, lexi underwood, cedric joe, tim heidecker, riki lindhome, nasim pedrad",2021,1.0,season
ds65,naomi watts,2020,2.0,season
ds66,,2020,1.0,season
ds67,,2021,1.0,season
ds68,,2020,1.0,season
ds69,"tobie windham, suzi barrett, ramon reed, kaylin hayman, jc currais, raven-symoné",2019,52.0,min
ds70,"bret iwan, kaitlyn robrock, bill farmer, daniel ross, tress macneille, jim cummings",2021,47.0,min
ds71,"dave goelz, bill barretta, will arnett, taraji p. henson, yvette nicole brown, darren criss",2021,53.0,min
ds72,"whoopi goldberg, christina aguilera, halle bailey, orlando philharmonic orchestra, anthony anderson, tom brady",2021,85.0,min
ds73,"malachi barton, christian j. simon, sophia hammons, melanie brook, brent stait, jordana largy",2021,92.0,min
ds74,chris cassidy,2021,1.0,season
ds75,"scarlett johansson, florence pugh, david harbour, o-t fagbenle, rachel weisz, ray winstone",2021,135.0,min
ds76,russell boulter,2017,4.0,season
ds77,kerry shale,2021,1.0,season
ds78,"dr. anthony fauci, bono, george w. bush, peter staley",2021,105.0,min
ds79,gal gadot,2021,1.0,season
ds80,"ashly burch, dana snyder",2021,1.0,season
ds81,"jason lee, david cross, cameron richardson, jane lynch, justin long, matthew gray gubler",2007,91.0,min
ds82,"jason lee, tony hale, kimberly williams-paisley, josh green, bella thorne, uzo aduba",2015,92.0,min
ds83,"jake green, raphael alejandro, dana snyder, tony hale, christian slater, trevor devall",2021,47.0,min
ds84,"angelina jolie, sharlto copley, elle fanning, sam riley, imelda staunton, juno temple",2014,99.0,min
ds85,"chris diamantopoulos, tony anselmo, tress macneille, bill farmer, russi taylor",2017,22.0,min
ds86,"isabella crovetti, lauren graham, james van der beek, jordan davis, wanda sykes, mitchell whitfield",2017,3.0,season
ds87,"issac ryan brown, dara reneé, graciela gomez",2021,1.0,season
ds88,don halbert,2020,1.0,season
ds89,,2019,2.0,season
ds90,"cole caplan, kristen bone, robert smith, catherine disher, adrian truss, len carlson",1998,5.0,season
ds91,,2021,1.0,season
ds92,,2021,1.0,season
ds93,"dan castellaneta, julie kavner, nancy cartwright, yeardley smith, hank azaria, pamela hayden",1989,32.0,season
ds94,"apthon corbin, louis gonzales",2021,88.0,min
ds95,"tucker albrizzi, diedrich bader, ameko eks mass carroll, max charles, tim conway, jennifer elise cox",2011,93.0,min
ds96,"shailene woodley, ansel elgort, laura dern, sam trammell, nat wolff, willem dafoe",2014,127.0,min
ds97,matt beisner,2019,2.0,season
ds98,"benjamin valic, lily sanfelippo, jakari fraser, dee bradley baker, melanie minichino",2021,1.0,season
ds99,,2021,1.0,season
ds100,"isla fisher, hugh dancy, joan cusack, john goodman, john lithgow, kristin scott thomas",2009,106.0,min
ds101,"dove cameron, sofia carson, booboo stewart, mitchell hope, sarah jeffery, melanie paxson",2021,22.0,min
ds102,"john barrowman, ashley brown, merle dandridge, trevor dion nicholas, jade ewen, alton fitzgerald white",2016,116.0,min
ds103,devin e. haqq,2021,44.0,min
ds104,jeremy irons,2020,44.0,min
ds105,,2021,9.0,min
ds106,peter jessop,2021,42.0,min
ds107,"chip hailstone, agnes hailstone, sue aikens, andy bassich",2012,16.0,season
ds108,"cristina vee, bryce papenbrook, keith silverstein, mela lee, max mittelman, carrie keranen",2015,1.0,season
ds109,jeremy wade,2021,1.0,season
ds110,"raven-symoné, issac ryan brown, navia robinson, jason maybaum, sky katz, anneliese van der pol",2021,11.0,min
ds111,"johnny depp, penélope cruz, ian mcshane, geoffrey rush, kevin r. mcnally, sam claflin",2011,140.0,min
ds112,"kaylin price, ariana brown, aliyah taylor, janelle lasalle, napoleon highbrou",2021,11.0,min
ds113,"peyton elizabeth lee, emma meisel, matthew sato, wes tian, jeffrey bowyer-chapman, mapuana makia",2021,1.0,season
ds114,"leela ladnier, utkarsh ambudkar, roshni edwards, kal penn, kamran lucas",2020,2.0,season
ds115,"kathleen wilhoite, clea lewis, danny cooksey, pamela segall, april winchell, don adams",1997,3.0,season
ds116,"rick robles, dr. pol",2011,19.0,season
ds117,"billie eilish, finneas",2021,66.0,min
ds118,"james mcavoy, michael fassbender, jennifer lawrence, nicholas hoult, sophie turner, tye sheridan",2019,115.0,min
ds119,victoria vosburg,2019,2.0,season
ds120,"bob peterson, ed asner, jordan nagai",2021,1.0,season
ds121,"emma stone, emma thompson, joel fry, paul walter hauser, emily beecham, kirby howell-baptiste",2021,137.0,min
ds122,"steve carell, juliette binoche, dane cook, john mahoney, emily blunt, alison pill",2007,99.0,min
ds123,"txunamy oriz, natalie peyser, dara reneé, frankie rodriguez, julia lester, ruth righi",2021,22.0,min
ds124,"ben kingsley, scoot mcnairy, lester speight, sam rockwell, matt gerald, allen maldonado",2014,14.0,min
ds125,"jason lee, amy adams, jim belushi, peter dinklage, patrick warburton, alex neuberger",2007,85.0,min
ds126,"dr. susan kelleher, art edmonds",2014,9.0,season
ds127,"dylan schombing, áine sunderland, nahanni mitchell, nicholas holmes",2018,2.0,season
ds128,mocean melvin,2020,2.0,season
ds129,"ed speleers, jeremy irons, sienna guillory, robert carlyle, john malkovich, garrett hedlund",2006,104.0,min
ds130,tracee ellis ross,2021,1.0,season
ds131,"ioan gruffudd, jessica alba, chris evans, michael chiklis, julian mcmahon, kerry washington",2005,106.0,min
ds132,"patrick stewart, hugh jackman, ian mckellen, halle berry, famke janssen, james marsden",2000,105.0,min
ds133,alfonso ribeiro,2021,1.0,season
ds134,"ramone hamilton, gabriella graves, maxwell simkins, yvette nicole brown",2021,1.0,season
ds135,"bill farmer, corey burton",2021,1.0,season
ds136,"kylie cantrall, maxwell donovan, callan farris, coco christo, valery ortiz, nathan lovejoy",2018,2.0,season
ds137,,2021,1.0,season
ds138,"george lopez, odette yustman, miguel ferrer, ernie hudson, loretta devine, jon huertas",2011,88.0,min
ds139,"george lopez, odette annable, ernie hudson, miguel ferrer, kay panabaker, tom kenny",2012,92.0,min
ds140,edward marcoux,2021,44.0,min
ds141,"robin williams, sally field, pierce brosnan, harvey fierstein, polly holliday, lisa jakub",1993,126.0,min
ds142,dustin rubin,2021,1.0,season
ds143,,2020,2.0,season
ds144,steven french,2021,88.0,min
ds145,"breckin meyer, jennifer love hewitt, stephen tobolowsky, bill murray, evan arnold, mark lawrence",2004,82.0,min
ds146,"matthew géczy, kaycie chase, bill farmer, sylvain caruso",2021,1.0,season
ds147,sullivan jones,2020,2.0,season
ds148,"vanessa williams, megan hilty, jet jurgensmeyer, christian simon",2018,2.0,season
ds149,"bret iwan, kaitlyn robrock, bill farmer, tony anselmo, tress macneille, harvey guillén",2021,1.0,season
ds150,"tress macneille, nika futterman, kaitlyn robrock",2021,1.0,season
ds151,robin roberts,2021,1.0,season
ds152,"ray romano, john leguizamo, denis leary, seann william scott, josh peck, queen latifah",2006,94.0,min
ds153,"valerie taylor, dr. sylvia earle, jeremiah sullivan, wendy benchley, jean michel cousteau, michele hall",2021,91.0,min
ds154,billy lloyd,2020,44.0,min
ds155,ted stewart,2020,44.0,min
ds156,eddie braun,2021,87.0,min
ds157,"john leguizamo, justin long, tiya sircar, skyler stone, angourie rice, charlie rowe",2013,88.0,min
ds158,robert davi,2020,44.0,min
ds159,paget brewster,2021,1.0,season
ds160,"sarah-nicole robles, wendie malick, alex hirsch, tati gabrielle, issac brown, mae whitman",2020,2.0,season
ds161,"ben valic, melanie minichino",2021,1.0,season
ds162,"justin felbinger, fiona bishop, ivy bishop, issac ryan brown, sam lavagnino, dee bradley baker",2017,1.0,season
ds163,"josh peck, carra patterson, lyndsy fonseca, vanessa lengies, brandon jay mclaren, anthony ruivivar",2021,1.0,season
ds164,,2020,44.0,min
ds165,keston john,2020,44.0,min
ds166,,2021,1.0,season
ds167,,2021,44.0,min
ds168,dan nachtrab,2020,44.0,min
ds169,"matt damon, scarlett johansson, thomas haden church, patrick fugit, colin ford, elle fanning",2011,125.0,min
ds170,jason hildebrandt,2021,44.0,min
ds171,brain cade,2021,44.0,min
ds172,"tiffany thornton, sterling knight, brandon mychal smith, doug brochu, allisyn ashley arm",2011,1.0,season
ds173,"alison lohman, tim mcgraw, maria bello, ryan kwanten, danny pino, dallas roberts",2006,95.0,min
ds174,"cristina 'vee"" valenzuela, bryce papenbrook, keith silverstein, carrie keranen, todd haberkorn, max mittelman",2021,54.0,min
ds175,"kina scollay, ingrid visser, ray robertson",2021,44.0,min
ds176,mocean melvin,2021,44.0,min
ds177,chris hemsworth,2021,44.0,min
ds178,,2021,44.0,min
ds179,dan nachtrab,2021,44.0,min
ds180,eric meyers,2013,7.0,season
ds181,bobby bones,2021,1.0,season
ds182,"bret iwan, russi taylor, bill farmer, daniel ross, tress macneile",2019,1.0,season
ds183,"billy crystal, john goodman, ben feldman, mindy kaling, henry winkler, lucas neff",2021,1.0,season
ds184,"dan castellaneta, nancy cartwright, yeardley smith",2021,6.0,min
ds185,"raven-symoné , issac brown, navia robinson, jason maybaum, sky katz, anneliese van der pol",2016,4.0,season
ds186,"art la fleur, tom guiry, mike vitar, patrick renna, chauncey leopardi, marty york",1993,101.0,min
ds187,"max lloyd-jones, james willson, samantha burton, brett kelly, james earl jones, cole evan weiss",2005,98.0,min
ds188,"elisabeth shue, maia brewton, keith coogan, anthony rapp, calvin levels, vincent phillip d'onofrio",1987,102.0,min
ds189,bear grylls,2019,2.0,season
ds190,"tony hale, kristen schaal, mystic inscho, seth carr, marta kessler, emmy deoliveira",2021,1.0,season
ds191,wolfgang puck,2021,80.0,min
ds192,"tyler nathan, jacob mazeral, ava ro, scott gorman, athena karkanis",2021,1.0,season
ds193,"ramon reed, kaylin hayman, suzi barrett, tobie windham",2018,2.0,season
ds194,"dr. erin schroeder, dr. ben schroeder",2019,3.0,season
ds195,"jacob tremblay, jack dylan grazer, emma berman, maya rudolph, marco barricelli, jim gaffigan",2021,101.0,min
ds196,"anthony daniels, r2-d2, lesleh donaldson, andrew sabiston, don francks, dan hennessey",1985,2.0,season
ds197,"harland williams, isaac brown, jessica dicicco, sam lavagnino, leslie baker, tara strong",2016,4.0,season
ds198,"alan cumming, evan rachel wood, elijah kelley, meredith anne bull, sam palladio, kristin chenoweth",2015,101.0,min
ds199,"fred macmurray, tommy steele, greer garson, geraldine page, gladys cooper, hermione baddeley",1967,170.0,min
ds200,"vin diesel, lauren graham, faith ford, brittany snow, max thieriot, chris potter",2005,97.0,min
ds201,,2020,2.0,season
ds202,tom hiddleston,2021,1.0,season
ds203,gordon ramsay,2018,3.0,season
ds204,"matt danner, melanie harrison, ben diskin, eric bauza, dee baker, jessica dicicco",2017,3.0,season
ds205,"kelly marie tran, awkwafina , izaac wang, gemma chan, daniel dae kim, benedict wong",2021,112.0,min
ds206,"terrence howard, cuba gooding jr., nate parker, david oyelowo, tristan wilds, ne-yo",2012,126.0,min
ds207,,2021,7.0,min
ds208,"shanessa khawaja, jenna qureshi, cash herrera, fazeelat aslam, maya bednarek, iris starlett perry",2021,21.0,min
ds209,"dave mccormack, melanie zanetti, brad elliot, hsiao-ling tang",2019,2.0,season
ds210,"qi sun, briana liu, ben wang, harry jarvis, ray wise, dejean brown",2021,21.0,min
ds211,"ruth righi, ava kolker, jackson dollinger, christian simon, ian kesler, caroline rhea",2018,3.0,season
ds212,"keyla monterroso mejia, cristela alonzo, grace song, olivia sullivent, gilberto ortiz, sean burgos",2021,20.0,min
ds213,dennis compayre,2021,1.0,season
ds214,"otmara marrero, dash mccloud, greg worswick, mike millan",2021,15.0,min
ds215,"melba martinez ph.d, cici lau, seven true-divine purnell, william knight, amanda maddock, ronald binion",2021,14.0,min
ds216,"kalo moss, ching yin ryan hu, evan lai, brian yang, lynn chen, danni wang",2021,19.0,min
ds217,mike rowe,2016,10.0,season
ds218,"chris houghton, marieve herington, bob joles, artemis pebdani",2017,2.0,season
ds219,chi mcbride,2013,1.0,season
ds220,"david wartnaby, bjørn lægreid, thord paulsen",2015,5.0,season
ds221,"ginnifer goodwin, mae whitman, rosario dawson, lucy liu, raven-symoné , megan hilty",2014,79.0,min
ds222,"bob dorough, jack sheldon, lynn ahrens, grady tate, blossom dearie, essra mohawk",1973,6.0,season
ds223,"sean astin, meghan strange, phill lewis, amber hood, brad garrett",2011,1.0,season
ds224,chris payne gilbert,2021,1.0,season
ds225,"sean astin, meghan strange, gary anthony williams, amber hood, cam clarke, phill lewis",2009,2.0,season
ds226,"hugh jackman, halle berry, ian mckellen, famke janssen, anna paquin, kelsey grammer",2006,105.0,min
ds227,"neal mcdonough, john vernon, luke perry, lou ferrigno, genie francis",1996,2.0,season
ds228,"ioan gruffudd, jessica alba, chris evans, michael chiklis, julian mcmahon, kerry washington",2007,93.0,min
ds229,"jack mcbrayer, april winchell, keith ferguson, tom kenny",2013,2.0,season
ds230,"gabrielle anwar, michael schoeffling, kathleen york, dylan kussman, cliff robertson, frank renzulli",1991,89.0,min
ds231,,2021,4.0,min
ds232,,2021,18.0,min
ds233,,2021,1.0,season
ds234,dee bradley baker,2021,1.0,season
ds235,"christopher daniel barnes, edward asner, linda gray, rodney saulsberry, liz georges, saratoga ballantine",1994,5.0,season
ds236,"tina fey, richard ayoade, alice braga",2021,9.0,min
ds237,"patrick richwood, reece holland, john robert hoffman, wesley mann, harry waters jr., john lovelady",1996,1.0,season
ds238,"takuya ohashi, shintaro tokita",2020,81.0,min
ds239,"david tennant, danny pudi, ben schwartz, bobby moynihan, kate micucci, tony anselmo",2017,3.0,season
ds240,"gordon macrae, gloria grahame, gene nelson",1956,148.0,min
ds241,"joe mantegna, lara flynn boyle, joe pantoliano, brian haley, cynthia nixon, fred dalton thompson",1994,99.0,min
ds242,,2020,44.0,min
ds243,"dove cameron, joey bragg, tenzing norgay trainor, kali rocha, benjamin king",2013,4.0,season
ds244,"sigourney weaver, james cameron, brian skerry",2021,1.0,season
ds245,"john stamos, jessalyn gilsig, yvette nicole brown, richard robichaux, sophia mitri schloss, nell verlaque",2021,1.0,season
ds246,,2021,1.0,season
ds247,hazen audel,2014,5.0,season
ds248,"anne hathaway, jesse eisenberg, will.i.am , jamie foxx, george lopez, tracy morgan",2011,99.0,min
ds249,"louis ashbourne serkis, tom taylor, rebecca ferguson, patrick stewart, denise gough, dean chaumoo",2019,121.0,min
ds250,"richard riehle, mason cook, adam alexi-malle, lochlyn munro, mo gallini, christopher maleki",2012,96.0,min
ds251,"scott bairstow, charmaine craig, alfred molina, geoffrey lewis, al harrington, anthony michael ruivivar",1994,106.0,min
ds252,cesar millan,2012,45.0,min
ds253,"andy milonakis, james adomian, corey burton, melanie lynskey, ryan quincy, neil degrasse tyson",2016,1.0,season
ds254,"charlie schlatter, matt jones, danny cooksey",2010,2.0,season
ds255,"chevy chase, farrah fawcett, jonathan taylor thomas, george wendt",1995,97.0,min
ds256,"jason robards, talia shire, r.h. thomson, fiona reid, chris wiggins, amy stewart",1991,93.0,min
ds257,"adam beach, eric schweig, michael gambon, nathaniel parker, alex norton, sheldon peters wolfchild",1994,102.0,min
ds258,"eric walker, warwick davis, fionnula flanagan, guy boyd, aubree miller, daniel frishman",1984,97.0,min
ds259,"wilford brimley, warwick davis, aubree miller, siân phillips, carel struycken, niki botelho",1985,97.0,min
ds260,"frankie ryan manriquez, taylor masamitsu, liliana mumy, rory thost, edie mcclurg",2004,2.0,season
ds261,"david hartman, donald sinden, jacques marin, mako , david gwillim, agneta eckemyr",1974,94.0,min
ds262,craig whitney,2020,1.0,season
ds263,"ben stiller, carla gugino, dick van dyke, mickey rooney, bill cobbs, jake cherry",2006,109.0,min
ds264,mocean melvin,2017,4.0,season
ds265,mike new,2020,45.0,min
ds266,"mat lucas, james arnold taylor, tom kane, grey delisle, corey burton, andré sogliuzzo",2021,1.0,season
ds267,,2021,9.0,min
ds268,"jim henshaw, cree summer francks, jackie burroughs, george buza, doug chamberlain, paul chato",1985,2.0,season
ds269,"steve martin, jack black, owen wilson, brian dennehy, anjelica huston, rashida jones",2011,101.0,min
ds270,,2020,82.0,min
ds271,"michael rennie, james macarthur, janet munro, james donald, herbert lom, laurence naismith",1959,107.0,min
ds272,"cody veith, bryce gheisar, brandon severs, jillian shea spaeder, tobie windham",2016,3.0,season
ds273,"james mcavoy, emily blunt, matt lucas, ashley jensen, michael caine, jim cummings",2011,86.0,min
ds274,"johnny pemberton, jon heder, dana snyder, joel trussell",2015,2.0,season
ds275,,2021,1.0,season
ds276,"scott adsit, ryan potter, brooks wheelan, jamie chung, khary payton, genesis rodriguez",2017,3.0,season
ds277,"a-chan , kashiyuka , nocchi",2019,53.0,min
ds278,juan monsalvez,2018,1.0,season
ds279,"anthony mackie, sebastian stan, daniel brühl, emily vancamp, wyatt russell",2021,1.0,season
ds280,"laya deleon hayes, loretta devine, lara jill miller, robbie rist, anthony anderson, dr myiesha taylor,  md",2020,24.0,min
ds281,,2021,1.0,season
ds282,"eva green, asa butterfield, samuel l. jackson, judi dench, rupert everett, allison janney",2016,127.0,min
ds283,"alondra toledo, daniela blanco, henry onyango, jason hadzikostas, santosh pandey",2021,91.0,min
ds284,"breckin meyer, jennifer love hewitt, billy connolly, bill murray",2006,79.0,min
ds285,"dante basco, jeff bennett, amy bruckner, john dimaggio, charlie finn, kittie",2004,2.0,season
ds286,,2012,8.0,season
ds287,,2008,1.0,season
ds288,"ramon reed, kaylin hayman, suzi barrett, tobie windham, jc currais",2019,1.0,season
ds289,"g hannelius, blake michael, francesca capaldi, stephen full, regan burns, beth littleford",2012,3.0,season
ds290,"azran bin ahmad, rozita binti mohamed hussain, shamsir bin mohd shahar, suzana binti ahmad",2019,1.0,season
ds291,evan rachel wood,2021,12.0,min
ds292,dereck joubert,2020,95.0,min
ds293,"mitchel musso, doc shaw, kelsey chow, ryan ochoa, geno segers",2010,3.0,season
ds294,"preston oliver, kyliegh curran, elle graham, madeleine mcgraw, landon gordon, kelly frye",2021,1.0,season
ds295,,2016,24.0,min
ds296,"steve martin, bonnie hunt, hilary duff, tom welling, piper perabo",2003,99.0,min
ds297,"steve martin, eugene levy, bonnie hunt, tom welling, piper perabo, carmen electra",2005,95.0,min
ds298,"matilda lawler, alyson hannigan, ben schwartz, anna deavere smith, danny pudi, benjamin evan ainsworth",2021,95.0,min
ds299,"diego luna, zoe saldana, channing tatum, ron perlman, christina applegate, ice cube",2014,101.0,min
ds300,"jim henson, frank oz, dave goelz, richard hunt, eren ozker, john lovelady",1976,5.0,season
ds301,"giles panton, rebecca shoichet, jesse inocalla, brad swaile, deven mack, ian hanlin",2020,1.0,season
ds302,,2021,65.0,min
ds303,"brandy norwood, whitney houston, bernadette peters, paolo montalbán, whoopi goldberg, victor garber",1997,86.0,min
ds304,"kristen bell, sigourney weaver, jamie lee curtis, odette yustman, kristin chenoweth, victor garber",2010,106.0,min
ds305,yoshiki,2019,48.0,min
ds306,tate donovan,2020,45.0,min
ds307,"izabela rose, siena agudong, kyle howard, elie samouhi, alison fernandez, max torina",2020,97.0,min
ds308,bill ratner,2013,7.0,season
ds309,,1991,4.0,season
ds310,sam douglas,2020,44.0,min
ds311,"ellen degeneres, craig t. nelson, holly hunter, keegan-michael key, jordan peele",2021,1.0,season
ds312,russell boulter,2018,45.0,min
ds313,"aimee carrero, jenna ortega, keith ferguson, jillian reed, carlos alazraqui, mikey kelley",2015,3.0,season
ds314,"bryan cranston, koyu rankin, edward norton, bob balaban, jeff goldblum, bill murray",2018,102.0,min
ds315,"emily blunt, lin-manuel miranda, ben whishaw, emily mortimer, julie walters, pixie davies",2018,140.0,min
ds316,"elizabeth olsen, paul bettany, teyonah parris, kathryn hahn, randall park, kat dennings",2021,1.0,season
ds317,"phil wright, ariel martin, trevor tordjman",2020,1.0,season
ds318,"jack gore, jet jurgensmeyer, nile diaz, colin h. murphy, carlos saldanha, jeremy sisto",2017,111.0,min
ds319,,2021,1.0,season
ds320,"tom hanks, tim allen, kristen schaal, kevin mckidd, emily hahn, wallace shawn",2014,22.0,min
ds321,paul bandey,2018,45.0,min
ds322,lance lewman,2018,45.0,min
ds323,"jim carrey, steve carell, will arnett, seth rogen, isla fisher, amy poehler",2008,88.0,min
ds324,dan nachtrab,2019,45.0,min
ds325,neil hammerschlag,2016,43.0,min
ds326,,2020,6.0,min
ds327,neil degrasse tyson,2020,1.0,season
ds328,"jon favreau, dave filoni, pedro pascal, bryce howard, taika waititi, carl weathers",2020,2.0,season
ds329,"alex d. linz, larry miller, jamie kennedy, zena grey, josh peck, nora dunn",2001,88.0,min
ds330,"jamie foxx, tina fey, angela bassett, ahmir-khalib ""questlove"" thompson, phylicia rashad, daveed diggs",2020,107.0,min
ds331,,2020,180.0,min
ds332,josh bernstein,2020,48.0,min
ds333,,2021,1.0,season
ds334,,2020,182.0,min
ds335,"meryl streep, emily blunt, james corden, anna kendrick, chris pine, tracey ullman",2014,126.0,min
ds336,"cristina vee, bryce papenbrook, keith silverstein, carrie keranen, selah victor, sabrina weisz",2020,60.0,min
ds337,,2020,1.0,season
ds338,dan nachtrab,2019,1.0,season
ds339,,2020,50.0,min
ds340,,2020,46.0,min
ds341,katie couric,2017,93.0,min
