id,title,cast,release_year,duration_int,duration_type
ds525,marvel's future avengers,"英司 花輪, 一博 中谷, 康之 加瀬, 健一郎 松田, かおり 水橋, 史絵 水沢",2017,2.0,season
ds526,out,"bernadette sullivan, kyle mcdaniel, caleb cabrera, matthew martin",2020,12.0,min
ds527,the big fib,,2019,1.0,season
ds528,the boys: the sherman brothers' story,,2009,102.0,min
ds529,it's a dog's life with bill farmer,bill farmer,2020,1.0,season
ds530,maleficent: mistress of evil,"angelina jolie, elle fanning, chiwetel ejiofor, sam riley, harris dickinson, ed skrein",2019,121.0,min
ds531,star wars: the rise of skywalker (episode ix),"carrie fisher, mark hamill, adam driver, daisy ridley, john boyega, oscar isaac",2019,142.0,min
ds532,john carter,"taylor kitsch, lynn collins, samantha morton, mark strong, ciarán hinds, dominic west",2012,134.0,min
ds533,awesome animals,,2017,1.0,season
ds534,birth of europe,mark halliley,2014,1.0,season
ds535,bride of boogedy,"richard masur, mimi kennedy, tammy lauren, david faustino, joshua rudoy, leonard frey",1987,93.0,min
ds536,buried secrets of the bible with albert lin,albert lin,2019,1.0,season
ds537,disney prop culture,daniel lanigan,2020,1.0,season
ds538,george of the jungle,"brendan fraser, leslie mann, thomas church, richard roundtree, greg cruttwell, abraham benrubi",1997,93.0,min
ds539,homeward bound ii: lost in san francisco,"robert hays, kim greist, veronica lauren, kevin chevalia, benj thall, max perlich",1996,90.0,min
ds540,homeward bound: the incredible journey,"robert hays, kim greist, jean smart, veronica lauren, kevin chevalia, benj thall",1993,85.0,min
ds541,how to play baseball,,1942,8.0,min
ds542,in beaver valley,winston hibler,1950,32.0,min
ds543,lost treasures of egypt,rick robles,2018,1.0,season
ds544,love & vets,mallory kasdan,2017,1.0,season
ds545,nature's half acre,winston hibler,1951,33.0,min
ds546,prairie dog manor,kevin conway,2019,1.0,season
ds547,prowlers of the everglades,,1953,32.0,min
ds548,the princess bride,"cary elwes, mandy patinkin, chris sarandon, christopher guest, wallace shawn, andre the giant",1987,99.0,min
ds549,united states of animals,quincy dunn-baker,2015,1.0,season
ds550,unlikely animal friends,mark keller,2012,3.0,season
ds551,water birds,winston hibler,1952,31.0,min
ds552,national treasure,"nicolas cage, jon voight, harvey keitel, diane kruger, sean bean, justin bartha",2004,132.0,min
ds553,born wild: the next generation,robin roberts,2020,44.0,min
ds554,america's funniest home videos,tom bergeron,1989,9.0,season
ds555,the olympic elk,winston hibler,1952,27.0,min
ds556,tangled: the series,"zachary levi, mandy moore, eden espinosa, clancy brown",2016,3.0,season
ds557,jane goodall: the hope,jane goodall,2020,89.0,min
ds558,brain games,neil harris,2011,8.0,season
ds559,disney mickey and the roadster racers - chip 'n' dale's nutty tales (shorts),"tress macneille, corey burton, bret iwan, russi taylor, bill farmer, daniel ross",2017,2.0,season
ds560,let's stick together,,1952,7.0,min
ds561,pluto's purchase,"pinto colvig, james macdonald",1948,7.0,min
ds562,tron uprising,"elijah wood, bruce boxleitner, emmanuelle chriqui, mandy moore, nate corddry, lance henriksen",2011,1.0,season
ds563,a celebration of the music from coco,"benjamin bratt, eva longoria, carlos rivera, natalia jiménez, alanna ubach, jaime camil",2020,48.0,min
ds564,disney playtime with puppy dog pals (shorts),,2017,2.0,season
ds565,"maggie simpson in ""playdate with destiny""",,2020,5.0,min
ds566,paradise islands,michael izqueirdo,2017,1.0,season
ds567,tut's treasures: hidden secrets,mark bazeley,2018,1.0,season
ds568,a tale of two critters,mayf nutter,1977,48.0,min
ds569,all in a nutshell,,1949,7.0,min
ds570,disneynature penguins,ed helms,2019,77.0,min
ds571,diving with dolphins,celine cousteau,2020,79.0,min
ds572,dolphin reef,natalie portman,2018,78.0,min
ds573,don's fountain of youth,,1953,6.0,min
ds574,donald's dog laundry,,1940,9.0,min
ds575,double dribble,,1946,8.0,min
ds576,dragon around,,1954,7.0,min
ds577,elephant,"meghan,  the duchess of sussex",2020,89.0,min
ds578,elmer elephant,"jeanie roberts, pinto colvig, hal rees, leone ledoux, carlisle tupper, gay seabrook",1936,8.0,min
ds579,fish hooks,"chelsea kane, kyle massey, justin roiland",2010,3.0,season
ds580,how to play football,pinto colvig,1944,9.0,min
ds581,in the footsteps of elephant,jeremy sisto,2020,88.0,min
ds582,"lambert, the sheepish lion",sterling holloway,1952,8.0,min
ds583,on ice,"pinto colvig, walt disney, marcellite garner",1935,9.0,min
ds584,onward,"tom holland, chris pratt, julia louis-dreyfus, octavia spencer, mel rodriguez, kyle bornheimer",2020,103.0,min
ds585,out of scale,,1951,8.0,min
ds586,penguins: life on the edge,blair underwood,2020,78.0,min
ds587,pluto's party,"jimmy macdonald, pinto colvig",1952,8.0,min
ds588,sea scouts,,1939,8.0,min
ds589,sonny with a chance,"demi lovato, tiffany thornton, sterling knight, brandon smith, doug brochu, allisyn arm",2008,2.0,season
ds590,the boy who talked to badgers,"carl betz, salome jens, christian juttner, robert donner, denver pyle, stuart lee",1975,90.0,min
ds591,the new neighbor,,1953,7.0,min
ds592,the small one,"sean marshall, william woodson, olan soulé, joe higgins, gordon jump, hal smith",1978,25.0,min
ds593,the straight story,"richard farnsworth, sissy spacek, harry stanton, everett mcgill, john farley, kevin farley",1999,112.0,min
ds594,frankenweenie,"catherine o'hara, martin short, martin landau, charlie tahan, atticus shaffer, winona ryder",2012,88.0,min
ds595,mars needs moms,"seth green, dan fogler, elizabeth harnois, mindy sterling, kevin cahoon, joan cusack",2011,91.0,min
ds596,prom,"aimee teegarden, thomas mcdonell, de'vaughn nixon, danielle campbell, yin chang, jared kusnitz",2011,105.0,min
ds597,the last song,"miley cyrus, liam hemsworth, bobby coleman, nick searcy, kelly preston, greg kinnear",2010,109.0,min
ds598,the odd life of timothy green,"jennifer garner, joel edgerton, dianne wiest, cj adams, rosemarie dewitt, ron livingston",2012,106.0,min
ds599,be our chef,angela kinsey,2020,1.0,season
ds600,a wrinkle in time,"oprah winfrey, reese witherspoon, mindy kaling, storm reid, levi miller, deric mccabe",2018,112.0,min
ds601,disney i didn't do it,"olivia holt, austin north, piper curda, peyton clark, sarah gilman",2013,2.0,season
ds602,disney insider,,2020,1.0,season
ds603,disney vampirina ghoul girls rock! (shorts),"isabella crovetti, jordan davis, viviann yee, mitchell whitfield, wanda sykes, ian corlett",2017,2.0,season
ds604,g-force,"bill nighy, will arnett, zach galifianakis, kelli garner, tyler jones, jack conley",2009,92.0,min
ds605,frozen 2,"kristen bell, idina menzel, josh gad, jonathan groff, sterling brown, evan wood",2019,107.0,min
ds606,stargirl,"grace vanderwaal, graham verchere, giancarlo esposito, karan brar, darby stanchfield, maximiliano hernandez",2020,107.0,min
ds607,the finest hours,"chris pine, casey affleck, ben foster, holliday grainger, john ortiz, kyle gallner",2016,119.0,min
ds608,the sandlot: heading home,"danny nucci, luke perry, keanu pires, sarah deakins, chauncey leopardi, brandon olds",2007,97.0,min
ds609,bedtime stories,"adam sandler, keri russell, guy pearce, russell brand, richard griffiths, jonathan pryce",2008,101.0,min
ds610,marvel studios' black panther,"chadwick boseman, michael jordan, lupita nyong'o, danai gurira, martin freeman, daniel kaluuya",2018,137.0,min
ds611,101 dalmatian street,"josh brener, michaela dietz, ella kenion, rhashan stone",2018,1.0,season
ds612,disney phineas and ferb: phineas and ferb star wars,"vincent martella, ashley tisdale, thomas brodie-sangster, caroline rhea, richard o'brien, dan povenmire",2014,53.0,min
ds613,shop class,,2020,1.0,season
ds614,viking warrior women,ella al-shamahi,2019,44.0,min
ds615,star wars resistance,"christopher sean, josh brener, scott lawrence, suzie mcgrath, as himself",2018,2.0,season
ds616,lost cities with albert lin,dr. albert len,2019,1.0,season
ds617,marvel rising: operation shuri,"dee baker, dove cameron, jessica dicicco, skai jackson, kathreen khavari, daisy lightfoot",2019,23.0,min
ds618,marvel rising: playing with fire,"dee baker, dove cameron, gary cole, kathreen khavari, meera kumbhani, tony mirrcandani",2019,45.0,min
ds619,star wars: the clone wars,"tom kane, matt lanter, ashley eckstein, james arnold taylor, dee baker, corey burton",2008,7.0,season
ds620,marvel's iron man & hulk: heroes united,"adrian pasdar, fred tatasciore, david kaye, dee baker, robin downes",2013,74.0,min
ds621,because of winn-dixie,"jeff daniels, cicely tyson, dave matthews, eva saint, annasophia robb",2005,107.0,min
ds622,fairy tale weddings,"stephen boss, allison holker",2017,2.0,season
ds623,"my dog, the thief","dwayne hickman, mary mobley, elsa lanchester, joe flynn, roger carmel, mickey shaughnessy",1969,89.0,min
ds624,splash,"tom hanks, daryl hannah, eugene levy, john candy, dody goodman, shecky greene",1984,110.0,min
ds625,that's so raven,"raven , orlando brown, kyle massey, anneliese van der pol, t’keyah keymáh, rondell sheridan",2002,4.0,season
ds626,timmy failure: mistakes were made,"winslow fegley, ophelia lovibond, craig robinson, wallace shawn, kyle bornheimer, chloe coleman",2020,103.0,min
ds627,toy story 4,"tom hanks, tim allen, annie potts, tony hale, keegan-michael key, madeleine mcgraw",2019,101.0,min
ds628,descendants 3,"dove cameron, cameron boyce, sofia carson, booboo stewart, mitchell hope, sarah jefferey",2019,109.0,min
ds629,around the world in 80 days,"jackie chan, steve coogan, cécile de france, jim broadbent, ewan bremner, ian mcneice",2004,121.0,min
ds630,big business,"bette midler, lily tomlin, fred ward, edward herrmann, michele placido, daniel gerroll",1988,98.0,min
ds631,lamp life,"annie potts, jim hanks, ally maki, emily davis",2020,11.0,min
ds632,the lion king,"donald glover, seth rogen, chiwetel ejiofor, alfre woodard, billy eichner, john kani",2019,125.0,min
ds633,diary of a future president,"tess romero, selenis leyva, charlie bushnell, michael weaver",2020,2.0,season
ds634,high school musical: the musical: the series: the sing-along,"olivia rodrigo, joshua bassett, matt cornett, sofia wylie, larry saperstein",2019,1.0,season
ds635,america's national parks,c.t. taylor,2015,1.0,season
ds636,continent 7: antarctica,chris browning,2016,1.0,season
ds637,disney randy cunningham: 9th grade ninja,"ben schwartz, andrew caldwell, tim curry, john dimaggio, kevin richardson, dave wittenberg",2011,2.0,season
ds638,muppet babies show and tell (shorts),"matt danner, melanie harrison, ben diskin, eric bauza, dee baker, jessica dicicco",2017,1.0,season
ds639,the lodge,"sophie simnett, luke newton, thomas doherty, bethan wright, jayden revri, jade alleyne",2016,2.0,season
ds640,wild russia,liam teeling,2018,1.0,season
ds641,destino,dora luz,2003,6.0,min
ds642,forky asks a question: what is reading?,"tony hale, addison andrews, mila crespo, imani prior, jeff pidgeon, bob peterson",2020,7.0,min
ds643,loop,"madison bandy, christiano delgado, louis gonzales, asher brodkey, erica milsom",2020,12.0,min
ds644,marvel's runaways,"rhenzy feliz, lyrica okano, virginia gardner, ariela barer, gregg sulkin, allegra acosta",2017,3.0,season
ds645,aladdin (2019),"will smith, mena massoud, naomi scott, marwan kenzari, navid negahban, nasim pedrad",2019,135.0,min
ds646,forky asks a question: what is cheese?,"tony hale, jeff garlin, bob peterson",2020,6.0,min
ds647,austin & ally,"ross lynch, laura marano, raini rodriguez, calum worthy",2011,4.0,season
ds648,billy dilley's super-duper subterranean summer,"aaron springer, catherine wayne, tom kenny",2016,1.0,season
ds649,cars toon: el materdor,"larry the cable guy , keith ferguson",2008,4.0,min
ds650,cars toon: moon mater,"larry the cable guy , keith ferguson, josh cooley",2010,4.0,min
ds651,cars toon: rescue squad mater,"larry the cable guy , keith ferguson, bret parker, peter sohn, bob peterson, bob scott",2010,3.0,min
ds652,cars toon: spinning,"keith ferguson, paul dooley, tony shalhoub, lloyd sherr, michael wallis, guido quaroni",2013,2.0,min
ds653,cars toon: time travel mater,"larry the cable guy , keith ferguson, john higgins, katherine helmond",2012,7.0,min
ds654,cars toon: tokyo mater,"larry the cable guy , keith ferguson, michael wallis, mach kobayashi, robert ito",2008,8.0,min
ds655,cars toon: unidentified flying mater,"larry the cable guy , keith ferguson",2010,4.0,min
ds656,cars toons: bugged,"jerome ranft, josh cooley",2013,2.0,min
ds657,cool runnings,"leon , doug doug, rawle lewis, malik yoba, raymond barry, larry gilman",1993,99.0,min
ds658,drain alcatraz,"craig sechler, russell boulter",2017,47.0,min
ds659,drain the bermuda triangle,russell boulter,2014,45.0,min
ds660,drain the great lakes,cham giobbi,2011,45.0,min
ds661,drain the ocean: wwii,russell boulter,2016,44.0,min
ds662,drain the sunken pirate city,russell boulter,2017,48.0,min
ds663,drain the titanic,russell boulter,2015,45.0,min
ds664,first class chefs: family style,"gia ré, matt tebbutt",2015,1.0,season
ds665,hacksaw,"tab hunter, victor millan, ray teal, russ mccubbin, george barrows, christine austin",1971,89.0,min
ds666,holes,"sigourney weaver, jon voight, patricia arquette, tim nelson, dulé hill, shia labeouf",2003,119.0,min
ds667,marvel 75 years: from pulp to pop!,"laura shields, stan lee, alan fine, nicole perlman, jimmy kimmel, gerry conway",2014,42.0,min
ds668,marvel rising: battle of the bands,"dee baker, dove cameron, skai jackson, kathreen khavari, kamil mcfadden, tyler posey",2019,23.0,min
ds669,one strange rock,will smith,2017,1.0,season
ds670,out there with jack randall,jack randall,2019,1.0,season
ds671,super rhino,"miley cyrus, mark walton, susie essman, malcolm mcdowell, randy savage",2009,4.0,min
ds672,the proud family,"tommy davidson, paula parker, jo payton, kyla pratt, tara strong, karen white",2001,2.0,season
ds673,the super hero squad,"grey delisle, steve blum, mikey kelly, charlie adler, mark hamill, tom kenny",2009,2.0,season
ds674,year million,laurence fishburne,2016,1.0,season
ds675,forky asks a question: what is a pet?,"tony hale, aloma wright, bob peterson",2019,7.0,min
ds676,star wars: the last jedi (episode viii),"mark hamill, carrie fisher, adam driver, daisy ridley, john boyega, oscar isaac",2017,152.0,min
ds677,forky asks a question: what is a leader?,"tony hale, bonnie hunt, bob peterson",2019,6.0,min
ds678,george of the jungle 2,"thomas church, julie benz, christina pickles, angus jones, kelly miller, john kassir",2003,89.0,min
ds679,high school musical: the musical: the series: the special,"joshua bassett, olivia rodrigo, sofia wylie, matt cornett, dara renee",2019,23.0,min
ds680,pick of the litter,,2019,1.0,season
ds681,togo,"willem dafoe, julianne nicholson, christopher heyerdahl, richard dormer, michael greyeyes, michael mcelhatton",2019,117.0,min
ds682,forky asks a question: what is a computer?,"tony hale, kristen schaal, james brinkley, bob peterson",2019,6.0,min
ds683,wind,"emilio fuentes, sonoko konishi",2019,9.0,min
ds684,forky asks a question: what is love?,"tony hale, carl reiner, mel brooks, carol burnett, betty white, kristen schaal",2019,7.0,min
ds685,one day at disney (shorts),,2019,1.0,season
ds686,marvel studios' thor: ragnarok,"chris hemsworth, tom hiddleston, cate blanchett, idris elba, jeff goldblum, tessa thompson",2017,132.0,min
ds687,disney the lion guard,"max charles, diamond white, dusan brown, atticus shaffer, joshua rush",2015,3.0,season
ds688,one day at disney,,2019,62.0,min
ds689,disney star vs. the forces of evil,"eden sher, adam mcarthur",2014,4.0,season
ds690,expedition amelia,"allison janney, bob ballard, fredrik hiebert",2019,94.0,min
ds691,glory road,"josh lucas, derek luke, jon voight, austin nichols, evan jones, schin kerr",2006,119.0,min
ds692,henry hugglemonster,"lara miller, tom kenny, chiara zanni, lori alan, hynden walch, kari wahlgren",2012,2.0,season
ds693,incredible! the story of dr. pol,"ari rubin, dr. pol",2015,44.0,min
ds694,marvel rising: chasing ghosts,"dee baker, chloe bennet, dove cameron, skai jackson, kathreen khavari, kamil mcfadden",2019,24.0,min
ds695,marvel rising: heart of iron,"dee baker, chloe bennet, dove cameron, robbie daymond, kathreen khavari, daisy lightfoot",2019,46.0,min
ds696,miles from tomorrowland,"olivia munn, cullen mccarthy, fiona bishop, dee baker, tom kenny",2014,2.0,season
ds697,sheriff callie's wild west,"mandy moore, lucas grabeel",2011,2.0,season
ds698,supercar megabuild,dom joly,2016,2.0,season
ds699,the incredible dr. pol: blue ribbon kids,"ari rubin, dr. pol",2016,42.0,min
ds700,coco,"anthony gonzalez, gael bernal, benjamin bratt, alanna ubach, renée victor, jaime camil",2017,105.0,min
ds701,coco (in spanish),"anthony gonzalez, gael garcía bernal, benjamin bratt, alanna ubach, renée victor, jaime camil",2017,105.0,min
ds702,forky asks a question: what is time?,"tony hale, wallace shawn, alan oppenheimer, bob peterson",2019,6.0,min
ds703,the wonderful world of disney presents the little mermaid live!,"auli'i cravalho, queen latifah, shaggy , john stamos, graham phillips, amber riley",2019,84.0,min
ds704,forky asks a question: what is art?,"tony hale, robin downes, bob peterson",2019,7.0,min
ds705,mickey mouse roadster racers,"bret iwan, russi taylor, bill farmer, daniel ross, tress macneille",2017,2.0,season
ds706,"happy birthday, mickey!",,2019,2.0,min
ds707,forky asks a question: what is a friend?,"tony hale, john ratzenberger, bob peterson",2019,6.0,min
ds708,10 things i hate about you,"heath ledger, julia stiles, joseph gordon-levitt, larisa oleynik, david krumholtz, andrew keegan",1999,98.0,min
ds709,101 dalmatians,"rod taylor, j. pat o'malley, betty gerson, cate bauer, ben wright, fred worlock",1961,81.0,min
ds710,101 dalmatians ii: patch's london adventure,"barry bostwick, jason alexander, martin short, bobby lockwood, susanne blakeslee, samuel west",2003,77.0,min
ds711,102 dalmatians,"glenn close, ioan gruffudd, alice evans, tim mcinnerny, ian richardson, gérard depardieu",2000,104.0,min
ds712,12 dates of christmas,"amy smart, mark-paul gosselaar, peter macneil, mary long, jayne eastwood, laura miyata",2011,88.0,min
ds713,"20,000 leagues under the sea","kirk douglas, james mason, paul lukas, peter lorre, robert wilke, ted de corsia",1954,127.0,min
ds714,a bug's life,"dave foley, kevin spacey, julia louis-dreyfus, hayden panettiere, phyllis diller, richard kind",1998,98.0,min
ds715,a goofy movie,"bill farmer, jason marsden, jim cummings, kellie martin, rob paulsen, wallace shawn",1995,81.0,min
ds716,a kid in king arthur's court,"thomas nicholas, joss ackland, art malik, paloma baeza, kate winslet, daniel craig",1995,90.0,min
ds717,a knight for a day,,1946,7.0,min
ds718,a ring of endless light,"mischa barton, ryan merriman, jared padalecki, scarlett pomers, soren fulton, chris kirby",2002,88.0,min
ds719,aladdin (1992),"scott weinger, robin williams, linda larkin, jonathan freeman, frank welker, gilbert gottfried",1992,94.0,min
ds720,aladdin and the king of thieves,"val bettin, jim cummings, gilbert gottfried, linda larkin, jerry orbach, john rhys-davies",1996,86.0,min
ds721,aladdin: the return of jafar,"jason alexander, jeff bennett, val bettin, liz callaway, dan castellaneta, jim cummings",1994,71.0,min
ds722,alice in wonderland,"ed wynn, richard haydn, sterling holloway, jerry colonna, verna felton, pat o'malley",1951,79.0,min
ds723,aliens of the deep,"dr. anatoly sagalevitch, genya chernaiev, victor nischeta, dr. pamela conrad, dr. arthur lane, dr. jim childress",2005,100.0,min
ds724,alley cats strike!,"kyle schmid, robert ri'chard, kaley cuoco, mimi paley, joey wilcots, philip williams",2000,87.0,min
ds725,almost angels,"vincent winter, sean scully, peter weck, hans holt, bruni löbel, fritz eckhardt",1962,90.0,min
ds726,america's heart & soul,"george woodard, charles jimmie sr., the brothers, frank pino, dave pino, john yacobellis",2004,88.0,min
ds727,amy,"jenny agutter, barry newman, kathleen nolan, chris robinson, lou fant, margaret o'brien",1981,100.0,min
ds728,an extremely goofy movie,"bill farmer, jason marsden, jeff bennett, jim cummings, brad garrett, vicki lewis",2000,81.0,min
ds729,andi mack,"peyton lee, joshua rush, sofia wylie, asher angel, lilan bowden, lauren tom",2016,3.0,season
ds730,annie,"kathy bates, alan cumming, audra mcdonald, kristin chenoweth, victor garber, vic polizos",1999,91.0,min
ds731,apollo: missions to the moon,"neil armstrong, buzz aldrin",2019,95.0,min
ds732,atlantis rising,"georgeos diaz-montexano, peter vincenti, richard freund, simcha jacobovici, charles pellegrino, félix rodrigues",2017,94.0,min
ds733,atlantis: milo's return,"james taylor, cree summer, john mahoney, jacqueline obradors, don novello, corey burton",2003,83.0,min
ds734,atlantis: the lost empire,"michael fox, james garner, cree summer, don novello, phil morris, claudia christian",2001,98.0,min
ds735,auntie edna,"brad bird, eli fucile, maeve andrews, nick bird, noelle zuber, craig nelson",2018,7.0,min
ds736,avatar,"sam worthington, zoë saldana, sigourney weaver, stephen lang, michelle rodriguez, giovanni ribisi",2009,162.0,min
ds737,babes in the woods,,1932,8.0,min
ds738,babes in toyland,"ray bolger, tommy sands, annette funicello, ed wynn, tommy kirk, kevin corcoran",1961,106.0,min
ds739,bambi,,1942,72.0,min
ds740,bambi ii,"patrick stewart, alexander gould, keith ferguson, brendon baerg, nicky jones, andrea bowen",2006,75.0,min
ds741,bao,,2018,8.0,min
ds742,beach picnic,,1939,9.0,min
ds743,bearly asleep,,1955,7.0,min
ds744,beauty and the beast: belle's magical world,"robby benson, paige o'hara, david stiers, jerry orbach, jeff bennett, jim cummings",1998,71.0,min
ds745,beauty and the beast: the enchanted christmas,"paige o'hara, robby benson, jerry orbach, david stiers, bernadette peters, tim curry",1997,73.0,min
ds746,beezy bear,,1955,7.0,min
ds747,before the flood,"leonardo dicaprio, john kerry, barack obama, bill clinton",2016,96.0,min
ds748,benji the hunted,"red steagall, frank inn, nancy francis, mike francis, joe camp, steve zanolini",1987,89.0,min
ds749,best friends whenever,"lauren taylor, shelby bender, gus kamp, ricky garcia, benjamin royer, matthew royer",2015,2.0,season
ds750,big city greens (shorts),,2017,1.0,season
ds751,big hero 6,"scott adsit, ryan potter, daniel henney, t. j. miller, jamie chung, damon wayans jr.",2014,105.0,min
ds752,big hero 6 the series (shorts),,2017,2.0,season
ds753,bizarre dinosaurs,peter cullen,2009,46.0,min
ds754,blank check,"brian bonsall, karen duffy, miguel ferrer, james rebhorn, tone lōc, jayne atkinson",1994,94.0,min
ds755,boat builders,,1938,8.0,min
ds756,bolt,"john travolta, miley cyrus, susie essman, mark walton, malcolm mcdowell, james lipton",2008,98.0,min
ds757,bone bandit,,1948,7.0,min
ds758,bonkers,"charlie adler, corey burton, jesse corti, jim cummings, frank welker, gregg berger",1993,1.0,season
ds759,boundin',bud luckey,2004,6.0,min
ds760,boy meets world,"ben savage, william daniels, betsy randle, will friedle, rider strong, lee norris",1993,7.0,season
ds761,brave,"kelly macdonald, billy connolly, emma thompson, julie walters, robbie coltrane, kevin mckidd",2012,94.0,min
ds762,brave little toaster to the rescue,"deanna oliver, tim stack, jon lovitz, thurl ravenscroft, phil hartman, jay mohr",1999,75.0,min
ds763,breaking2,"lelisa desisa, eliud kipchoge, zersenay tadese",2017,55.0,min
ds764,brink!,"erik von detten, sam horrigan, christina vidal, robin riker, geoffrey blake, patrick levis",1998,90.0,min
ds765,brother bear,"joaquin phoenix, jeremy suarez, jason raize, rick moranis, dave thomas, d.b. sweeney",2003,90.0,min
ds766,brother bear 2,"patrick dempsey, mandy moore, jeremy suarez, rick moranis, dave thomas, andrea martin",2006,78.0,min
ds767,buffalo dreams,"reiley mcclendon, simon baker, graham greene, tessa vonn, max van ville, chris hunter",2005,90.0,min
ds768,bug juice: my adventures at camp,,2017,1.0,season
ds769,burn-e,"angus maclane, tessa swigart",2008,8.0,min
ds770,cadet kelly,"hilary duff, christy romano, shawn ashmore, aimee garcia, linda kash, nigel hamer",2002,100.0,min
ds771,camp nowhere,"christopher lloyd, jonathan jackson, wendy makkena, tom wilson, andrew keegan, marne patterson",1994,96.0,min
ds772,camp rock,"demi lovato, joe jonas, meaghan martin, maria canals-barrera, alyson stoner, julie brown",2008,96.0,min
ds773,camp rock 2: the final jam,"demi lovato, joe jonas, nick jonas, kevin jonas, daniel fathers, daniel kash",2010,101.0,min
ds774,can of worms,"michael shulman, erika christensen, adam wylie, andrew ducote, lee garlington, brighton hertford",1999,84.0,min
ds775,candleshoe,"david niven, helen hayes, jodie foster, leo mckern, vivian pickles, veronica quilligan",1978,101.0,min
ds776,canine caddy,,1941,8.0,min
ds777,cars,"owen wilson, paul newman, bonnie hunt, larry the cable guy , cheech marin, tony shalhoub",2006,117.0,min
ds778,cars 2,"owen wilson, larry the cable guy , michael caine, emily mortimer, john turturro, eddie izzard",2011,107.0,min
ds779,cars 3,"owen wilson, cristela alonzo, chris cooper, nathan fillion, larry the cable guy , armie hammer",2017,103.0,min
ds780,cars toon: air mater,"larry the cable guy , keith ferguson, stacey keach, jonathan adams, jan rabson, lori alan",2011,5.0,min
ds781,cars toon: heavy metal mater,"larry the cable guy , keith ferguson",2010,5.0,min
ds782,cars toon: hiccups,"keith ferguson, larry the cable guy , michael wallis, tony shalhoub, lloyd sherr, bonnie hunt",2013,3.0,min
ds783,cars toon: mater private eye,"larry the cable guy , keith ferguson",2010,6.0,min
ds784,cars toon: mater the greater,"larry the cable guy , keith ferguson",2008,5.0,min
ds785,cars toon: monster truck mater,"larry the cable guy , keith ferguson",2010,6.0,min
ds786,cars toon: the radiator springs 500 1/2,"owen wilson, larry the cable guy , steve purcell, jess harnell, john cygan,  danny  mann",2014,6.0,min
