id,title,cast,release_year,duration_int,duration_type
ds1,duck the halls: a mickey mouse christmas special,"chris diamantopoulos, tony anselmo, tress macneille, bill farmer, russi taylor, corey burton",2016,23.0,min
ds2,ernest saves christmas,"jim varney, noelle parker, douglas seale",1988,91.0,min
ds3,ice age: a mammoth christmas,"raymond albert romano, john leguizamo, denis leary, queen latifah",2011,23.0,min
ds4,the queen family singalong,"darren criss, adam lambert, derek hough, alexander jean, fall out boy, jimmie allen",2021,41.0,min
ds5,the beatles: get back,"john lennon, paul mccartney, george harrison, ringo starr",2021,1.0,season
ds6,becoming cousteau,"jacques yves cousteau, vincent cassel",2021,94.0,min
ds7,hawkeye,"jeremy renner, hailee steinfeld, vera farmiga, fra fee, tony dalton, zahn mcclarnon",2021,1.0,season
ds8,port protection alaska,"gary muehlberger, mary miller, curly leach, sam carlson, stuart andrews, david squibb",2015,2.0,season
ds9,secrets of the zoo: tampa,"dr. ray ball, dr. lauren smith, chris massaro, tiffany burns, mike burns, melinda mendolusky",2019,2.0,season
ds10,a muppets christmas: letters to santa,"steve whitmire, dave goelz, bill barretta, eric jacobson",2008,45.0,min
ds11,adventure thru the walt disney archives,"don hahn, kathryn beaumont, pete docter, kevin feige, mark hamill, bob iger",2020,59.0,min
ds12,puppy for hanukkah,,2020,4.0,min
ds13,the pixar story,"stacy keach, john lasseter, brad bird, john musker, ron clements, frank thomas",2007,91.0,min
ds14,"dr. oakley, yukon vet","dr. michelle oakley, zachary fine",2013,10.0,season
ds15,america the beautiful,michael b. jordan,2021,2.0,min
ds16,baymax!,,2021,1.0,min
ds17,ciao alberto,"jack dylan grazer, marco barricelli",2021,8.0,min
ds18,disney fancy nancy,"mia jenness, alyson hannigan, rob riggle, spencer moss, dana heath",2018,3.0,season
ds19,disney intertwined,"carolina domenech, josé jiménez zapiola, kevsho, elena roger, clara alonso, emilia mernes",2021,1.0,season
ds20,enchanted,"amy adams, patrick dempsey, james marsden, timothy spall, idina menzel, susan sarandon",2007,110.0,min
ds21,feast,"stephen apostolina, kirk baily, ben bledsoe, david cowgill, terri douglas, fuschia!",2014,8.0,min
ds22,frozen fever,"kristen bell, idina menzel, jonathan groff, josh gad, santino fontana, chris williams",2015,11.0,min
ds23,get a horse!,"walt disney, marcellite garner, russi taylor, billy bletcher, will ryan, bob bergen",2013,7.0,min
ds24,home sweet home alone,"ellie kemper, rob delaney, archie yates, aisling bea, kenan thompson, tim simons",2021,95.0,min
ds25,jungle cruise,"dwayne johnson, emily blunt, edgar ramirez, jack whitehall, jesse plemons, paul giamatti",2021,129.0,min
ds26,limitless with chris hemsworth,chris hemsworth,2021,2.0,min
ds27,marvel studios’ 2021 disney+ day special,,2021,14.0,min
ds28,obi-wan kenobi,,2021,1.0,min
ds29,olaf presents,josh gad,2021,1.0,season
ds30,paperman,"john kahrs, kari wahlgren",2012,7.0,min
ds31,pixar 2021 disney+ day special,"pete docter, larry the cable guy, jack dylan grazer, domee shi, angus maclane",2021,5.0,min
ds32,shang-chi and the legend of the ten rings,"simu liu, awkwafina, tony leung, michelle yeoh, meng'er zhang, ben kingsley",2021,134.0,min
ds33,spin,"avantika, michael bishop, anna cathcart, jahbril cook, kerri medders, aryan simhadri",2021,94.0,min
ds34,tangled ever after,"mandy moore, zachary levi, alan dale, paul f. tompkins, kari wahlgren, mark allen stewart",2012,9.0,min
ds35,the ballad of nessie,billy connolly,2011,8.0,min
ds36,the little matchgirl,,2006,7.0,min
ds37,the making of happier than ever: a love letter to los angeles,"billie eilish, finneas, gustavo dudamel, patrick osborne, robert rodriguez",2021,30.0,min
ds38,the proud family: louder and prouder,"kyla pratt, tommy davidson, paula jai parker, jomarie payton, cedric the entertainer",2021,1.0,min
ds39,the simpsons in plusaversary,"dan castellaneta, nancy cartwright, yeardley smith, tress macneille, hank azaria",2021,6.0,min
ds40,tick tock tale,,2010,6.0,min
ds41,under the helmet: the legacy of boba fett,,2021,22.0,min
ds42,willow,,2021,3.0,min
ds43,alvin and the chipmunks: chipwrecked,"jason lee, david cross, jenny slate, justin long, matthew gray gubler, jesse mccartney",2011,87.0,min
ds44,jingle all the way,"arnold schwarzenegger, sinbad, phil hartman, rita wilson, robert conrad, martin mull",1996,90.0,min
ds45,jingle all the way 2,"larry the cable guy, brian stepanek, santino marella, kennedi clements, kirsten robek, rachel hayward",2014,91.0,min
ds46,prep & landing: operation secret santa,"betty white, dave foley, derek richardson, sarah chalke, w. morgan sheppard",2010,8.0,min
ds47,santa buddies: the legend of santa paws,"christopher lloyd, danny woodburn, craig anton, michael teigen, ben giroux, paul rae",2009,93.0,min
ds48,snow buddies,"dominic scott kay, john kapelos, lise simms, mike dopud, charles c. stevenson jr., dylan minnette",2008,91.0,min
ds49,space buddies,"f.t. anderson, diedrich bader, field cate, kendall cross, mike dopud, mark downey",2009,87.0,min
ds50,the search for santa paws,"resse alexander, diedrich bader, sahar biniaz, jan boss, ameko eks mass carroll, melody choi",2010,101.0,min
ds51,x-men: first class,"james mcavoy, michael fassbender, rose byrne, jennifer lawrence, january jones, nicholas hoult",2011,132.0,min
ds52,disney amphibia,"justin felbinger, amanda leighton, bill farmer, brenda song",2018,3.0,season
ds53,photo ark,joel sartore,2017,1.0,season
ds54,storm rising,,2021,1.0,season
ds55,bob ballard: an explorer's life,,2021,44.0,min
ds56,"mcfarland, usa","kevin costner, maria bello, morgan saylor, martha higareda, michael aguero, sergio avelar",2015,131.0,min
ds57,rookie of the year,"thomas ian nicholas, gary busey, albert hall, amy morton, dan hedaya, eddie bracken",1993,104.0,min
ds58,thumbelina,"gino conforti, barbara cook, jodi benson, will ryan, june foray, kenneth mars",1994,87.0,min
ds59,pj masks,"kyle breitkopf, jacob ursomarzo, addison holley",2015,5.0,season
ds60,the wild life of dr. ole,,2021,1.0,season
ds61,lost cities with albert lin: the great flood,dr. albert yu-min lin,2021,44.0,min
ds62,megacity of the maya warriors,albert lin,2021,44.0,min
ds63,apollo: back to the moon,"bill anders, jack clemons, fred haise, glynn lunney, jay barbree, brad vinikow",2019,1.0,season
ds64,just beyond,"mckenna grace, lexi underwood, cedric joe, tim heidecker, riki lindhome, nasim pedrad",2021,1.0,season
ds65,secrets of the zoo: down under,naomi watts,2020,2.0,season
ds66,secrets of the zoo: north carolina,,2020,1.0,season
ds67,the wizard of paws,,2021,1.0,season
ds68,zombies: addison's moonstone mystery,,2020,1.0,season
ds69,just roll with it: you decide live!,"tobie windham, suzi barrett, ramon reed, kaylin hayman, jc currais, raven-symoné",2019,52.0,min
ds70,mickey's tale of two witches,"bret iwan, kaitlyn robrock, bill farmer, daniel ross, tress macneille, jim cummings",2021,47.0,min
ds71,muppets haunted mansion,"dave goelz, bill barretta, will arnett, taraji p. henson, yvette nicole brown, darren criss",2021,53.0,min
ds72,the most magical story on earth: 50 years of walt disney world,"whoopi goldberg, christina aguilera, halle bailey, orlando philharmonic orchestra, anthony anderson, tom brady",2021,85.0,min
ds73,under wraps,"malachi barton, christian j. simon, sophia hammons, melanie brook, brent stait, jordana largy",2021,92.0,min
ds74,among the stars,chris cassidy,2021,1.0,season
ds75,black widow,"scarlett johansson, florence pugh, david harbour, o-t fagbenle, rachel weisz, ray winstone",2021,135.0,min
ds76,drain the oceans,russell boulter,2017,4.0,season
ds77,drain the oceans: the mississippi river & arctic war,kerry shale,2021,1.0,season
ds78,fauci,"dr. anthony fauci, bono, george w. bush, peter staley",2021,105.0,min
ds79,impact with gal gadot,gal gadot,2021,1.0,season
ds80,the ghost and molly mcgee,"ashly burch, dana snyder",2021,1.0,season
ds81,alvin and the chipmunks,"jason lee, david cross, cameron richardson, jane lynch, justin long, matthew gray gubler",2007,91.0,min
ds82,alvin and the chipmunks: the road chip,"jason lee, tony hale, kimberly williams-paisley, josh green, bella thorne, uzo aduba",2015,92.0,min
ds83,lego star wars terrifying tales,"jake green, raphael alejandro, dana snyder, tony hale, christian slater, trevor devall",2021,47.0,min
ds84,maleficent,"angelina jolie, sharlto copley, elle fanning, sam riley, imelda staunton, juno temple",2014,99.0,min
ds85,the scariest story ever: a mickey mouse halloween spooktacular,"chris diamantopoulos, tony anselmo, tress macneille, bill farmer, russi taylor",2017,22.0,min
ds86,disney vampirina,"isabella crovetti, lauren graham, james van der beek, jordan davis, wanda sykes, mitchell whitfield",2017,3.0,season
ds87,disney's magic bake-off,"issac ryan brown, dara reneé, graciela gomez",2021,1.0,season
ds88,great barrier reef,don halbert,2020,1.0,season
ds89,ready for preschool,,2019,2.0,season
ds90,rolie polie olie,"cole caplan, kristen bone, robert smith, catherine disher, adrian truss, len carlson",1998,5.0,season
ds91,star wars galaxy of sounds,,2021,1.0,season
ds92,the hatcher family dairy,,2021,1.0,season
ds93,the simpsons,"dan castellaneta, julie kavner, nancy cartwright, yeardley smith, hank azaria, pamela hayden",1989,32.0,season
ds94,a spark story,"apthon corbin, louis gonzales",2021,88.0,min
ds95,spooky buddies,"tucker albrizzi, diedrich bader, ameko eks mass carroll, max charles, tim conway, jennifer elise cox",2011,93.0,min
ds96,the fault in our stars,"shailene woodley, ansel elgort, laura dern, sam trammell, nat wolff, willem dafoe",2014,127.0,min
ds97,dog: impossible,matt beisner,2019,2.0,season
ds98,spidey and his amazing friends,"benjamin valic, lily sanfelippo, jakari fraser, dee bradley baker, melanie minichino",2021,1.0,season
ds99,star wars: visions,,2021,1.0,season
ds100,confessions of a shopaholic,"isla fisher, hugh dancy, joan cusack, john goodman, john lithgow, kristin scott thomas",2009,106.0,min
ds101,descendants: royal wedding,"dove cameron, sofia carson, booboo stewart, mitchell hope, sarah jeffery, melanie paxson",2021,22.0,min
ds102,disney's broadway hits at london's royal albert hall,"john barrowman, ashley brown, merle dandridge, trevor dion nicholas, jade ewen, alton fitzgerald white",2016,116.0,min
ds103,flooded tombs of the nile,devin e. haqq,2021,44.0,min
ds104,jade eyed leopard,jeremy irons,2020,44.0,min
ds105,nona,,2021,9.0,min
ds106,smoky mountain park rangers,peter jessop,2021,42.0,min
ds107,life below zero,"chip hailstone, agnes hailstone, sue aikens, andy bassich",2012,16.0,season
ds108,miraculous: tales of ladybug & cat noir,"cristina vee, bryce papenbrook, keith silverstein, mela lee, max mittelman, carrie keranen",2015,1.0,season
ds109,unknown waters with jeremy wade,jeremy wade,2021,1.0,season
ds110,far away from raven’s home,"raven-symoné, issac ryan brown, navia robinson, jason maybaum, sky katz, anneliese van der pol",2021,11.0,min
ds111,pirates of the caribbean: on stranger tides,"johnny depp, penélope cruz, ian mcshane, geoffrey rush, kevin r. mcnally, sam claflin",2011,140.0,min
ds112,twenty something,"kaylin price, ariana brown, aliyah taylor, janelle lasalle, napoleon highbrou",2021,11.0,min
ds113,"doogie kamealoha, m.d.","peyton elizabeth lee, emma meisel, matthew sato, wes tian, jeffrey bowyer-chapman, mapuana makia",2021,1.0,season
ds114,"mira, royal detective","leela ladnier, utkarsh ambudkar, roshni edwards, kal penn, kamran lucas",2020,2.0,season
ds115,pepper ann,"kathleen wilhoite, clea lewis, danny cooksey, pamela segall, april winchell, don adams",1997,3.0,season
ds116,the incredible dr. pol,"rick robles, dr. pol",2011,19.0,season
ds117,happier than ever: a love letter to los angeles,"billie eilish, finneas",2021,66.0,min
ds118,x-men: dark phoenix,"james mcavoy, michael fassbender, jennifer lawrence, nicholas hoult, sophie turner, tye sheridan",2019,115.0,min
ds119,alaska animal rescue,victoria vosburg,2019,2.0,season
ds120,dug days,"bob peterson, ed asner, jordan nagai",2021,1.0,season
ds121,cruella,"emma stone, emma thompson, joel fry, paul walter hauser, emily beecham, kirby howell-baptiste",2021,137.0,min
ds122,dan in real life,"steve carell, juliette binoche, dane cook, john mahoney, emily blunt, alison pill",2007,99.0,min
ds123,disney princess remixed - an ultimate princess celebration,"txunamy oriz, natalie peyser, dara reneé, frankie rodriguez, julia lester, ruth righi",2021,22.0,min
ds124,marvel one-shot: all hail the king,"ben kingsley, scoot mcnairy, lester speight, sam rockwell, matt gerald, allen maldonado",2014,14.0,min
ds125,underdog,"jason lee, amy adams, jim belushi, peter dinklage, patrick warburton, alex neuberger",2007,85.0,min
ds126,dr. k's exotic animal er,"dr. susan kelleher, art edmonds",2014,9.0,season
ds127,gigantosaurus,"dylan schombing, áine sunderland, nahanni mitchell, nicholas holmes",2018,2.0,season
ds128,life below zero: next generation,mocean melvin,2020,2.0,season
ds129,eragon,"ed speleers, jeremy irons, sienna guillory, robert carlyle, john malkovich, garrett hedlund",2006,104.0,min
ds130,growing up animal,tracee ellis ross,2021,1.0,season
ds131,fantastic four,"ioan gruffudd, jessica alba, chris evans, michael chiklis, julian mcmahon, kerry washington",2005,106.0,min
ds132,x-men,"patrick stewart, hugh jackman, ian mckellen, halle berry, famke janssen, james marsden",2000,105.0,min
ds133,america's funniest home videos: animal edition,alfonso ribeiro,2021,1.0,season
ds134,chicken squad,"ramone hamilton, gabriella graves, maxwell simkins, yvette nicole brown",2021,1.0,season
ds135,disney presents goofy in how to stay at home,"bill farmer, corey burton",2021,1.0,season
ds136,gabby duran and the unsittables,"kylie cantrall, maxwell donovan, callan farris, coco christo, valery ortiz, nathan lovejoy",2018,2.0,season
ds137,what if...?,,2021,1.0,season
ds138,beverly hills chihuahua 2,"george lopez, odette yustman, miguel ferrer, ernie hudson, loretta devine, jon huertas",2011,88.0,min
ds139,beverly hills chihuahua 3: viva la fiesta!,"george lopez, odette annable, ernie hudson, miguel ferrer, kay panabaker, tom kenny",2012,92.0,min
ds140,killer shark vs killer whale,edward marcoux,2021,44.0,min
ds141,mrs. doubtfire,"robin williams, sally field, pierce brosnan, harvey fierstein, polly holliday, lisa jakub",1993,126.0,min
ds142,cesar millan: better human better dog,dustin rubin,2021,1.0,season
ds143,walt disney animation studios: short circuit experimental films,,2020,2.0,season
ds144,built for mars: the perseverance rover,steven french,2021,88.0,min
ds145,garfield,"breckin meyer, jennifer love hewitt, stephen tobolowsky, bill murray, evan arnold, mark lawrence",2004,82.0,min
ds146,chip 'n' dale: park life,"matthew géczy, kaycie chase, bill farmer, sylvain caruso",2021,1.0,season
ds147,critter fixers: country vets,sullivan jones,2020,2.0,season
ds148,disney junior t.o.t.s.,"vanessa williams, megan hilty, jet jurgensmeyer, christian simon",2018,2.0,season
ds149,mickey mouse funhouse,"bret iwan, kaitlyn robrock, bill farmer, tony anselmo, tress macneille, harvey guillén",2021,1.0,season
ds150,minnie's bow-toons: party palace pals,"tress macneille, nika futterman, kaitlyn robrock",2021,1.0,season
ds151,turning the tables with robin roberts,robin roberts,2021,1.0,season
ds152,ice age: the meltdown,"ray romano, john leguizamo, denis leary, seann william scott, josh peck, queen latifah",2006,94.0,min
ds153,playing with sharks,"valerie taylor, dr. sylvia earle, jeremiah sullivan, wendy benchley, jean michel cousteau, michele hall",2021,91.0,min
ds154,shark vs. surfer,billy lloyd,2020,44.0,min
ds155,shark vs. whale,ted stewart,2020,44.0,min
ds156,stuntman,eddie braun,2021,87.0,min
ds157,walking with dinosaurs: the movie,"john leguizamo, justin long, tiya sircar, skyler stone, angourie rice, charlie rowe",2013,88.0,min
ds158,what the shark?,robert davi,2020,44.0,min
ds159,behind the attraction,paget brewster,2021,1.0,season
ds160,disney the owl house,"sarah-nicole robles, wendie malick, alex hirsch, tati gabrielle, issac brown, mae whitman",2020,2.0,season
ds161,meet spidey and his amazing friends (shorts),"ben valic, melanie minichino",2021,1.0,season
ds162,mission force one,"justin felbinger, fiona bishop, ivy bishop, issac ryan brown, sam lavagnino, dee bradley baker",2017,1.0,season
ds163,turner & hooch,"josh peck, carra patterson, lyndsy fonseca, vanessa lengies, brandon jay mclaren, anthony ruivivar",2021,1.0,season
ds164,most wanted sharks,,2020,44.0,min
ds165,secrets of the bull shark,keston john,2020,44.0,min
ds166,shark attack files,,2021,1.0,season
ds167,shark attack investigation: the paige winter story,,2021,44.0,min
ds168,sharkcano,dan nachtrab,2020,44.0,min
ds169,we bought a zoo,"matt damon, scarlett johansson, thomas haden church, patrick fugit, colin ford, elle fanning",2011,125.0,min
ds170,world's biggest bullshark,jason hildebrandt,2021,44.0,min
ds171,world's most dangerous shark?,brain cade,2021,44.0,min
ds172,so random!,"tiffany thornton, sterling knight, brandon mychal smith, doug brochu, allisyn ashley arm",2011,1.0,season
ds173,flicka,"alison lohman, tim mcgraw, maria bello, ryan kwanten, danny pino, dallas roberts",2006,95.0,min
ds174,"miraculous world: shanghai, the legend of ladydragon","cristina 'vee"" valenzuela, bryce papenbrook, keith silverstein, carrie keranen, todd haberkorn, max mittelman",2021,54.0,min
ds175,orca vs. great white,"kina scollay, ingrid visser, ray robertson",2021,44.0,min
ds176,rogue shark?,mocean melvin,2021,44.0,min
ds177,shark beach with chris hemsworth,chris hemsworth,2021,44.0,min
ds178,shark gangs,,2021,44.0,min
ds179,the croc that ate jaws,dan nachtrab,2021,44.0,min
ds180,when sharks attack,eric meyers,2013,7.0,season
ds181,breaking bobby bones,bobby bones,2021,1.0,season
ds182,mickey mouse mixed-up adventures,"bret iwan, russi taylor, bill farmer, daniel ross, tress macneile",2019,1.0,season
ds183,monsters at work,"billy crystal, john goodman, ben feldman, mindy kaling, henry winkler, lucas neff",2021,1.0,season
ds184,"the good, the bart, and the loki","dan castellaneta, nancy cartwright, yeardley smith",2021,6.0,min
ds185,disney raven's home,"raven-symoné , issac brown, navia robinson, jason maybaum, sky katz, anneliese van der pol",2016,4.0,season
ds186,the sandlot,"art la fleur, tom guiry, mike vitar, patrick renna, chauncey leopardi, marty york",1993,101.0,min
ds187,the sandlot 2,"max lloyd-jones, james willson, samantha burton, brett kelly, james earl jones, cole evan weiss",2005,98.0,min
ds188,adventures in babysitting,"elisabeth shue, maia brewton, keith coogan, anthony rapp, calvin levels, vincent phillip d'onofrio",1987,102.0,min
ds189,running wild with bear grylls,bear grylls,2019,2.0,season
ds190,the mysterious benedict society,"tony hale, kristen schaal, mystic inscho, seth carr, marta kessler, emmy deoliveira",2021,1.0,season
ds191,wolfgang,wolfgang puck,2021,80.0,min
ds192,dino ranch,"tyler nathan, jacob mazeral, ava ro, scott gorman, athena karkanis",2021,1.0,season
ds193,disney just roll with it,"ramon reed, kaylin hayman, suzi barrett, tobie windham",2018,2.0,season
ds194,"heartland docs, dvm","dr. erin schroeder, dr. ben schroeder",2019,3.0,season
ds195,luca,"jacob tremblay, jack dylan grazer, emma berman, maya rudolph, marco barricelli, jim gaffigan",2021,101.0,min
ds196,star wars vintage: droids,"anthony daniels, r2-d2, lesleh donaldson, andrew sabiston, don francks, dan hennessey",1985,2.0,season
ds197,puppy dog pals,"harland williams, isaac brown, jessica dicicco, sam lavagnino, leslie baker, tara strong",2016,4.0,season
ds198,strange magic,"alan cumming, evan rachel wood, elijah kelley, meredith anne bull, sam palladio, kristin chenoweth",2015,101.0,min
ds199,the happiest millionaire,"fred macmurray, tommy steele, greer garson, geraldine page, gladys cooper, hermione baddeley",1967,170.0,min
ds200,the pacifier,"vin diesel, lauren graham, faith ford, brittany snow, max thieriot, chris potter",2005,97.0,min
ds201,zenimation,,2020,2.0,season
ds202,loki,tom hiddleston,2021,1.0,season
ds203,gordon ramsay: uncharted,gordon ramsay,2018,3.0,season
ds204,muppet babies,"matt danner, melanie harrison, ben diskin, eric bauza, dee baker, jessica dicicco",2017,3.0,season
ds205,raya and the last dragon,"kelly marie tran, awkwafina , izaac wang, gemma chan, daniel dae kim, benedict wong",2021,112.0,min
ds206,red tails,"terrence howard, cuba gooding jr., nate parker, david oyelowo, tristan wilds, ne-yo",2012,126.0,min
ds207,us again,,2021,7.0,min
ds208,american eid,"shanessa khawaja, jenna qureshi, cash herrera, fazeelat aslam, maya bednarek, iris starlett perry",2021,21.0,min
ds209,bluey,"dave mccormack, melanie zanetti, brad elliot, hsiao-ling tang",2019,2.0,season
ds210,dinner is served,"qi sun, briana liu, ben wang, harry jarvis, ray wise, dejean brown",2021,21.0,min
ds211,disney sydney to the max,"ruth righi, ava kolker, jackson dollinger, christian simon, ian kesler, caroline rhea",2018,3.0,season
ds212,growing fangs,"keyla monterroso mejia, cristela alonzo, grace song, olivia sullivent, gilberto ortiz, sean burgos",2021,20.0,min
ds213,kingdom of the polar bears,dennis compayre,2021,1.0,season
ds214,let's be tigers,"otmara marrero, dash mccloud, greg worswick, mike millan",2021,15.0,min
ds215,the last of the chupacabras,"melba martinez ph.d, cici lau, seven true-divine purnell, william knight, amanda maddock, ronald binion",2021,14.0,min
ds216,the little prince(ss),"kalo moss, ching yin ryan hu, evan lai, brian yang, lynn chen, danni wang",2021,19.0,min
ds217,wicked tuna,mike rowe,2016,10.0,season
ds218,big city greens,"chris houghton, marieve herington, bob joles, artemis pebdani",2017,2.0,season
ds219,fury files,chi mcbride,2013,1.0,season
ds220,ice road rescue,"david wartnaby, bjørn lægreid, thord paulsen",2015,5.0,season
ds221,tinker bell and the legend of the neverbeast,"ginnifer goodwin, mae whitman, rosario dawson, lucy liu, raven-symoné , megan hilty",2014,79.0,min
ds222,schoolhouse rock!,"bob dorough, jack sheldon, lynn ahrens, grady tate, blossom dearie, essra mohawk",1973,6.0,season
ds223,disney special agent oso: three healthy steps (shorts),"sean astin, meghan strange, phill lewis, amber hood, brad garrett",2011,1.0,season
ds224,race to the center of the earth,chris payne gilbert,2021,1.0,season
ds225,special agent oso,"sean astin, meghan strange, gary anthony williams, amber hood, cam clarke, phill lewis",2009,2.0,season
ds226,x-men: the last stand,"hugh jackman, halle berry, ian mckellen, famke janssen, anna paquin, kelsey grammer",2006,105.0,min
ds227,the incredible hulk,"neal mcdonough, john vernon, luke perry, lou ferrigno, genie francis",1996,2.0,season
ds228,fantastic four: rise of the silver surfer,"ioan gruffudd, jessica alba, chris evans, michael chiklis, julian mcmahon, kerry washington",2007,93.0,min
ds229,wander over yonder,"jack mcbrayer, april winchell, keith ferguson, tom kenny",2013,2.0,season
ds230,wild hearts can't be broken,"gabrielle anwar, michael schoeffling, kathleen york, dylan kussman, cliff robertson, frank renzulli",1991,89.0,min
ds231,"maggie simpson in ""the force awakens from its nap""",,2021,4.0,min
ds232,star wars biomes,,2021,18.0,min
ds233,star wars vehicle flythroughs,,2021,1.0,season
ds234,the bad batch,dee bradley baker,2021,1.0,season
ds235,spider-man,"christopher daniel barnes, edward asner, linda gray, rodney saulsberry, liz georges, saratoga ballantine",1994,5.0,season
ds236,22 vs. earth,"tina fey, richard ayoade, alice braga",2021,9.0,min
ds237,adventures in wonderland,"patrick richwood, reece holland, john robert hoffman, wesley mann, harry waters jr., john lovelady",1996,1.0,season
ds238,disney my music story sukimaswitch,"takuya ohashi, shintaro tokita",2020,81.0,min
ds239,ducktales,"david tennant, danny pudi, ben schwartz, bobby moynihan, kate micucci, tony anselmo",2017,3.0,season
ds240,oklahoma!,"gordon macrae, gloria grahame, gene nelson",1956,148.0,min
ds241,baby's day out,"joe mantegna, lara flynn boyle, joe pantoliano, brian haley, cynthia nixon, fred dalton thompson",1994,99.0,min
ds242,being the queen,,2020,44.0,min
ds243,liv and maddie,"dove cameron, joey bragg, tenzing norgay trainor, kali rocha, benjamin king",2013,4.0,season
ds244,secrets of the whales,"sigourney weaver, james cameron, brian skerry",2021,1.0,season
ds245,big shot,"john stamos, jessalyn gilsig, yvette nicole brown, richard robichaux, sophia mitri schloss, nell verlaque",2021,1.0,season
ds246,earth moods,,2021,1.0,season
ds247,primal survivor,hazen audel,2014,5.0,season
ds248,rio,"anne hathaway, jesse eisenberg, will.i.am , jamie foxx, george lopez, tracy morgan",2011,99.0,min
ds249,the kid who would be king,"louis ashbourne serkis, tom taylor, rebecca ferguson, patrick stewart, denise gough, dean chaumoo",2019,121.0,min
ds250,treasure buddies,"richard riehle, mason cook, adam alexi-malle, lochlyn munro, mo gallini, christopher maleki",2012,96.0,min
ds251,white fang 2: myth of the white wolf,"scott bairstow, charmaine craig, alfred molina, geoffrey lewis, al harrington, anthony michael ruivivar",1994,106.0,min
ds252,cesar millan: the real story,cesar millan,2012,45.0,min
ds253,future-worm!,"andy milonakis, james adomian, corey burton, melanie lynskey, ryan quincy, neil degrasse tyson",2016,1.0,season
ds254,kick buttowski: suburban daredevil,"charlie schlatter, matt jones, danny cooksey",2010,2.0,season
ds255,man of the house,"chevy chase, farrah fawcett, jonathan taylor thomas, george wendt",1995,97.0,min
ds256,mark twain and me,"jason robards, talia shire, r.h. thomson, fiona reid, chris wiggins, amy stewart",1991,93.0,min
ds257,squanto: a warrior's tale,"adam beach, eric schweig, michael gambon, nathaniel parker, alex norton, sheldon peters wolfchild",1994,102.0,min
