id,title,cast,release_year,duration_int,duration_type
ds258,caravan of courage: an ewok adventure,"eric walker, warwick davis, fionnula flanagan, guy boyd, aubree miller, daniel frishman",1984,97.0,min
ds259,ewoks: the battle for endor,"wilford brimley, warwick davis, aubree miller, siân phillips, carel struycken, niki botelho",1985,97.0,min
ds260,higglytown heroes,"frankie ryan manriquez, taylor masamitsu, liliana mumy, rory thost, edie mcclurg",2004,2.0,season
ds261,island at the top of the world,"david hartman, donald sinden, jacques marin, mako , david gwillim, agneta eckemyr",1974,94.0,min
ds262,made in a day,craig whitney,2020,1.0,season
ds263,night at the museum,"ben stiller, carla gugino, dick van dyke, mickey rooney, bill cobbs, jake cherry",2006,109.0,min
ds264,secrets of the zoo,mocean melvin,2017,4.0,season
ds265,sharks of the bermuda triangle,mike new,2020,45.0,min
ds266,star wars vintage: clone wars 2d micro-series,"mat lucas, james arnold taylor, tom kane, grey delisle, corey burton, andré sogliuzzo",2021,1.0,season
ds267,star wars vintage: story of the faithful wookiee,,2021,9.0,min
ds268,star wars: ewoks,"jim henshaw, cree summer francks, jackie burroughs, george buza, doug chamberlain, paul chato",1985,2.0,season
ds269,the big year,"steve martin, jack black, owen wilson, brian dennehy, anjelica huston, rashida jones",2011,101.0,min
ds270,the last ice,,2020,82.0,min
ds271,third man on the mountain,"michael rennie, james macarthur, janet munro, james donald, herbert lom, laurence naismith",1959,107.0,min
ds272,walk the prank,"cody veith, bryce gheisar, brandon severs, jillian shea spaeder, tobie windham",2016,3.0,season
ds273,gnomeo & juliet,"james mcavoy, emily blunt, matt lucas, ashley jensen, michael caine, jim cummings",2011,86.0,min
ds274,pickle and peanut,"johnny pemberton, jon heder, dana snyder, joel trussell",2015,2.0,season
ds275,the mighty ducks: game changers,,2021,1.0,season
ds276,disney big hero 6 the series,"scott adsit, ryan potter, brooks wheelan, jamie chung, khary payton, genesis rodriguez",2017,3.0,season
ds277,disney my music story: perfume,"a-chan , kashiyuka , nocchi",2019,53.0,min
ds278,mexico untamed,juan monsalvez,2018,1.0,season
ds279,the falcon and the winter soldier,"anthony mackie, sebastian stan, daniel brühl, emily vancamp, wyatt russell",2021,1.0,season
ds280,doc mcstuffins: the doc is in,"laya deleon hayes, loretta devine, lara jill miller, robbie rist, anthony anderson, dr myiesha taylor,  md",2020,24.0,min
ds281,marvel studios assembled,,2021,1.0,season
ds282,miss peregrine's home for peculiar children,"eva green, asa butterfield, samuel l. jackson, judi dench, rupert everett, allison janney",2016,127.0,min
ds283,own the room,"alondra toledo, daniela blanco, henry onyango, jason hadzikostas, santosh pandey",2021,91.0,min
ds284,garfield: a tail of two kitties,"breckin meyer, jennifer love hewitt, billy connolly, bill murray",2006,79.0,min
ds285,american dragon: jake long,"dante basco, jeff bennett, amy bruckner, john dimaggio, charlie finn, kittie",2004,2.0,season
ds286,car sos,,2012,8.0,season
ds287,disney channel games 2008,,2008,1.0,season
ds288,disney roll it back (shorts),"ramon reed, kaylin hayman, suzi barrett, tobie windham, jc currais",2019,1.0,season
ds289,dog with a blog,"g hannelius, blake michael, francesca capaldi, stephen full, regan burns, beth littleford",2012,3.0,season
ds290,mickey go local,"azran bin ahmad, rozita binti mohamed hussain, shamsir bin mohd shahar, suzana binti ahmad",2019,1.0,season
ds291,myth: a frozen tale,evan rachel wood,2021,12.0,min
ds292,okavango: river of dreams,dereck joubert,2020,95.0,min
ds293,pair of kings,"mitchel musso, doc shaw, kelsey chow, ryan ochoa, geno segers",2010,3.0,season
ds294,secrets of sulphur springs,"preston oliver, kyliegh curran, elle graham, madeleine mcgraw, landon gordon, kelly frye",2021,1.0,season
ds295,shanghai disney resort grand opening gala,,2016,24.0,min
ds296,cheaper by the dozen,"steve martin, bonnie hunt, hilary duff, tom welling, piper perabo",2003,99.0,min
ds297,cheaper by the dozen 2,"steve martin, eugene levy, bonnie hunt, tom welling, piper perabo, carmen electra",2005,95.0,min
ds298,flora & ulysses,"matilda lawler, alyson hannigan, ben schwartz, anna deavere smith, danny pudi, benjamin evan ainsworth",2021,95.0,min
ds299,the book of life,"diego luna, zoe saldana, channing tatum, ron perlman, christina applegate, ice cube",2014,101.0,min
ds300,the muppet show,"jim henson, frank oz, dave goelz, richard hunt, eren ozker, john lovelady",1976,5.0,season
ds301,marvel battleworld: mystery of the thanostones,"giles panton, rebecca shoichet, jesse inocalla, brad swaile, deven mack, ian hanlin",2020,1.0,season
ds302,marvel's behind the mask,,2021,65.0,min
ds303,rodgers & hammerstein's cinderella,"brandy norwood, whitney houston, bernadette peters, paolo montalbán, whoopi goldberg, victor garber",1997,86.0,min
ds304,you again,"kristen bell, sigourney weaver, jamie lee curtis, odette yustman, kristin chenoweth, victor garber",2010,106.0,min
ds305,disney my music story: yoshiki,yoshiki,2019,48.0,min
ds306,expedition everest,tate donovan,2020,45.0,min
ds307,upside-down magic,"izabela rose, siena agudong, kyle howard, elie samouhi, alison fernandez, max torina",2020,97.0,min
ds308,wicked tuna: outer banks,bill ratner,2013,7.0,season
ds309,dinosaurs,,1991,4.0,season
ds310,texas storm squad,sam douglas,2020,44.0,min
ds311,pixar popcorn,"ellen degeneres, craig t. nelson, holly hunter, keegan-michael key, jordan peele",2021,1.0,season
ds312,wild uganda,russell boulter,2018,45.0,min
ds313,elena of avalor,"aimee carrero, jenna ortega, keith ferguson, jillian reed, carlos alazraqui, mikey kelley",2015,3.0,season
ds314,isle of dogs,"bryan cranston, koyu rankin, edward norton, bob balaban, jeff goldblum, bill murray",2018,102.0,min
ds315,mary poppins returns,"emily blunt, lin-manuel miranda, ben whishaw, emily mortimer, julie walters, pixie davies",2018,140.0,min
ds316,wandavision,"elizabeth olsen, paul bettany, teyonah parris, kathryn hahn, randall park, kat dennings",2021,1.0,season
ds317,disney fam jam,"phil wright, ariel martin, trevor tordjman",2020,1.0,season
ds318,ferdinand,"jack gore, jet jurgensmeyer, nile diaz, colin h. murphy, carlos saldanha, jeremy sisto",2017,111.0,min
ds319,marvel studios legends,,2021,1.0,season
ds320,toy story: that time forgot,"tom hanks, tim allen, kristen schaal, kevin mckidd, emily hahn, wallace shawn",2014,22.0,min
ds321,700 sharks,paul bandey,2018,45.0,min
ds322,big sharks rule,lance lewman,2018,45.0,min
ds323,dr. seuss' horton hears a who!,"jim carrey, steve carell, will arnett, seth rogen, isla fisher, amy poehler",2008,88.0,min
ds324,great shark chow down,dan nachtrab,2019,45.0,min
ds325,mega hammerhead,neil hammerschlag,2016,43.0,min
ds326,burrow,,2020,6.0,min
ds327,cosmos: possible worlds,neil degrasse tyson,2020,1.0,season
ds328,disney gallery / star wars: the mandalorian,"jon favreau, dave filoni, pedro pascal, bryce howard, taika waititi, carl weathers",2020,2.0,season
ds329,max keeble's big move,"alex d. linz, larry miller, jamie kennedy, zena grey, josh peck, nora dunn",2001,88.0,min
ds330,soul,"jamie foxx, tina fey, angela bassett, ahmir-khalib ""questlove"" thompson, phylicia rashad, daveed diggs",2020,107.0,min
ds331,arendelle castle yule log,,2020,180.0,min
ds332,buried truth of the maya,josh bernstein,2020,48.0,min
ds333,disney parks sunrise series,,2021,1.0,season
ds334,dory's reef cam,,2020,182.0,min
ds335,into the woods,"meryl streep, emily blunt, james corden, anna kendrick, chris pine, tracey ullman",2014,126.0,min
ds336,"miraculous world: new york, united heroez","cristina vee, bryce papenbrook, keith silverstein, carrie keranen, selah victor, sabrina weisz",2020,60.0,min
ds337,on pointe,,2020,1.0,season
ds338,wild nordic,dan nachtrab,2019,1.0,season
ds339,disney channel's epic holiday showdown,,2020,50.0,min
ds340,disney holiday magic quest,,2020,46.0,min
ds341,gender revolution: a journey with katie couric,katie couric,2017,93.0,min
ds342,high school musical: the musical: the holiday special,"olivia rodrigo, joshua bassett, sofia wylie, matt cornett, larry saperstein, julia lester",2020,46.0,min
ds343,ralph breaks the internet,"john c. reilly, sarah silverman, gal gadot, jane lynch, jack mcbrayer, alan tudyk",2018,116.0,min
ds344,safety,"jay reeves, thaddeus j. mixson, corinne foxx, matthew glave, james badge dale, hunter sansone",2020,123.0,min
ds345,anastasia,"meg ryan, john cusack, kelsey grammer, christopher lloyd, hank azaria, bernadette peters",1997,95.0,min
ds346,godmothered,"june squibb, jillian bell, jane curtin, carlease burke, sonia manzano, erica parks",2020,113.0,min
ds347,man vs. shark,"jeremiah sullivan, dave hoffman",2019,45.0,min
ds348,mulan,"yifei liu, donnie yen, gong li, jet li, jason lee, yoson an",2020,117.0,min
ds349,sky high,"kelly preston, lynda carter, michael angarano, danielle panabaker, mary elizabeth winstead, bruce campbell",2005,101.0,min
ds350,the disney holiday singalong,"ryan seacrest, andrea bocelli, bts , michael bublé, ciara , chloe x halle",2020,45.0,min
ds351,the nutcracker and the four realms,"keira knightley, mackenzie foy, eugenio derbez, jayden fowora-knight, matthew macfadyen, richard grant",2018,101.0,min
ds352,"alexander and the terrible, horrible, no good, very bad day","steve carell, jennifer garner, ed oxenbould, dylan minnette, kerris dorsey, jennifer coolidge",2014,83.0,min
ds353,black beauty,"mackenzie foy, kate winslet, iain glen, calam lynch, claire forlani, fern deacon",2020,111.0,min
ds354,from our family to yours,,2020,3.0,min
ds355,once upon a time in wonderland,"sophie lowe, michael socha, peter gadiot, emma rigby, naveen andrews, john lithgow",2013,1.0,season
ds356,party animals,,2016,1.0,season
ds357,folklore: the long pond studio sessions,"taylor swift, aaron dessner, jack antonoff, justin vernon",2020,107.0,min
ds358,bia,"isabela souza, giulia guerrini, julio peña, guido messina, andrea de alba, agustina palma",2019,1.0,season
ds359,marvel's 616,,2020,1.0,season
ds360,planes,"dane cook, stacy keach, brad garrett, teri hatcher, julia louis-dreyfus, priyanka chopra",2013,94.0,min
ds361,planes: fire & rescue,"dane cook, ed harris, julie bowen, curtis armstrong, john higgins, hal holbrook",2014,85.0,min
ds362,the real right stuff,,2020,90.0,min
ds363,the wonderful world of mickey mouse,"chris diamantopoulos, kaitlyn robrock, bill farmer, tony anselmo, tress macneille",2020,1.0,season
ds364,lego star wars holiday special,"helen sadler, omar miller, jake green, kelly marie tran, trevor devall, matt sloan",2020,48.0,min
ds365,home alone,"macaulay culkin, joe pesci, daniel stern, john heard, roberts blossom, catherine o'hara",1990,103.0,min
ds366,home alone 2: lost in new york,"macaulay culkin, joe pesci, daniel stern, john heard, devin ratray, catherine o'hara",1992,121.0,min
ds367,home alone 3,"alex d. linz, haviland morris, olek krupa",1997,103.0,min
ds368,inside pixar,,2020,1.0,season
ds369,petra: secrets of the ancient builders,bert morris,2019,45.0,min
ds370,ultimate viking sword,jay sanders,2019,45.0,min
ds371,disney's a christmas carol,"jim carrey, gary oldman, colin firth, bob hoskins, robin penn, cary elwes",2009,97.0,min
ds372,fancy nancy (shorts),"mia sinclair jenness, dana heath, spencer moss, alyson hannigan",2019,1.0,season
ds373,goldie & bear,"georgie kidder, justine huxley, natalie lander, jim cummings, david kaufman, david lodge",2015,2.0,season
ds374,mr. magoo,"leslie nielsen, kelly lynch, ernie hudson, stephen tobolowsky, nick chinlund, matt keeslar",1997,88.0,min
ds375,prep & landing,"dave foley, sarah chalke, mason cotton, lino disalvo, derek richardson, william sheppard",2009,23.0,min
ds376,prep & landing: naughty vs. nice,"dave foley, derek richardson, sarah chalke, rob riggle, chris parnell, w. sheppard",2011,23.0,min
ds377,disney channel halloween house party,"tobie windham, raphael alejandro, suzi barrett, isaac ryan brown, kylie cantrall, scarlett estevez",2020,23.0,min
ds378,the mandalorian,"pedro pascal, carl weathers, gina carano, omid abtahi, nick nolte",2019,2.0,season
ds379,the sorcerer's apprentice,"nicolas cage, jay baruchel, alfred molina, teresa palmer, monica bellucci, omar miller",2010,111.0,min
ds380,x-ray earth,,2020,1.0,season
ds381,gathering storm,tucker mcdougall,2020,1.0,season
ds382,india from above,dev patel,2019,1.0,season
ds383,marvel super hero adventures,,2017,4.0,season
ds384,once upon a snowman,"josh gad, idina menzel, kristen bell, jonathan groff, chris williams",2020,12.0,min
ds385,pompeii: secrets of the dead,maite jauregui,2019,45.0,min
ds386,toy story of terror!,"tom hanks, tim allen, joan cusack, carl weathers, stephen tobolowsky, timothy dalton",2013,22.0,min
ds387,beverly hills chihuahua,"piper perabo, manolo cardona, jamie curtis, jose yazpik, maury sterling, jesus ochoa",2008,95.0,min
ds388,clouds,"fin argus, sabrina carpenter, madison iseman, neve campbell, tom scott, lil rel howery",2020,122.0,min
ds389,lost on everest,tate donovan,2020,60.0,min
ds390,marvel's iron man & captain america: heroes united,"adrian pasdar, roger smith, fred tatasciore, david kaye, liam o'brien, clancy brown",2014,72.0,min
ds391,meet the chimps,jane lynch,2020,1.0,season
ds392,the rocketeer,"kitana turnbull, billy campbell, kathy najimy, callan farris, frank welker",2019,1.0,season
ds393,oil spill of the century,loïck peyron,2019,45.0,min
ds394,the chronicles of narnia: the voyage of the dawn treader,"georgie henley, skandar keynes, ben barnes, will poulter, tilda swinton",2010,113.0,min
ds395,the right stuff,"jake mcdorman, patrick adams, colin o’donoghue, eloise mumford, james lafferty, nora zehetner",2020,1.0,season
ds396,wild portugal,bart thomasson,2020,45.0,min
ds397,x2,"patrick stewart, hugh jackman, ian mckellen, halle berry, famke janssen, james marsden",2003,134.0,min
ds398,mr. holland's opus,"richard dreyfuss, glenne headly, jay thomas, w.h. macy, alicia witt, jean kelly",1996,143.0,min
ds399,disneynature oceans,"pierce brosnan, lancelot perrin",2010,84.0,min
ds400,hidden figures,"taraji henson, octavia spencer, janelle monáe, kevin costner, kirsten dunst, jim parsons",2016,128.0,min
ds401,magic of disney's animal kingdom,josh gad,2020,1.0,season
ds402,secret society of second-born royals,"peyton lee, niles fitch, isabella blake-thomas, olivia deeble, skylar astin, elodie yung",2020,99.0,min
ds403,the giant robber crab,colin solman,2019,44.0,min
ds404,wild central america,nigel marven,2020,1.0,season
ds405,ancient china from above,dr. allan maca,2020,1.0,season
ds406,becoming,,2020,1.0,season
ds407,coop & cami ask the world,"ruby turner, dakota lotus, olivia sanabia, albert tsai, paxton booth, rebecca metz",2018,2.0,season
ds408,europe from above,julian barratt,2019,1.0,season
ds409,ever after: a cinderella story,"drew barrymore, anjelica huston, dougray scott, patrick godfrey, megan dodds, melanie lynskey",1998,122.0,min
ds410,kingdom of the mummies,kerry shale,2020,1.0,season
ds411,morning light,patrick warburton,2008,99.0,min
ds412,notre dame: race against the inferno,paul bandey,2019,45.0,min
ds413,once upon a time,"ginnifer goodwin, jennifer morrison, robert carlyle, lana parrilla, jared gilmore, josh dallas",2011,7.0,season
ds414,soy luna,"karol sevilla, ruggero pasquarelli, valentina zenere, lucila gandolfo, michael ronda, carolina kopelioff",2015,3.0,season
ds415,violetta,"diego ramos, martina stoessel, pablo espinosa, jorge blanco, mercedes lambre, nicolás garnier",2011,3.0,season
ds416,christopher robin,"ewan mcgregor, hayley atwell, bronte carmichael, mark gatiss, oliver davies, ronke adekoluejo",2018,109.0,min
ds417,d2: the mighty ducks,"emilio estevez, michael tucker, jan rubeš, kathryn erbe, joshua jackson, elden ratliff",1994,107.0,min
ds418,d3: the mighty ducks,"emilio estevez, jeffrey nordling, david selby, heidi kling, joshua jackson, elden ratliff",1996,104.0,min
ds419,earth to ned,,2020,1.0,season
ds420,trick or treat,,1952,9.0,min
ds421,alice through the looking glass,"johnny depp, anne hathaway, mia wasikowska, matt lucas, rhys ifans, helena carter",2016,115.0,min
ds422,phineas and ferb the movie: candace against the universe,"ashley tisdale, vincent martella, ali wong, dan povenmire, alyson stoner, maulik pancholy",2020,86.0,min
ds423,back to the titanic,,2020,44.0,min
ds424,beauty and the beast,"emma watson, dan stevens, luke evans, kevin kline, josh gad, ewan mcgregor",2017,138.0,min
ds425,mars: one day on the red planet,nigel barber,2020,88.0,min
ds426,the one and only ivan,"sam rockwell, angelina jolie, danny devito, helen mirren, brooklynn prince, ramón rodríguez",2020,95.0,min
ds427,"weirdest, bestest, truest","charlie engelman, kirby engelman",2018,1.0,season
ds428,disney junior t.o.t.s.: calling all t.o.t.s. (shorts),"jet jurgensmeyer, christian simon, megan hilty",2020,1.0,season
ds429,disney zombies 2,"milo manheim, meg donnelly, trevor tordjman, kylee russell, carla jeffery, chandler kinney",2020,84.0,min
ds430,india's wild leopards,"sandesh kadur, priya singh",2020,45.0,min
ds431,jungle animal rescue,dan nachtrab,2019,1.0,season
ds432,magic camp,"adam devine, gillian jacobs, nathaniel mcintyre, jeffrey tambor, cole sand, isabella crovetti",2020,101.0,min
ds433,marvel studios' ant-man and the wasp,"paul rudd, evangeline lilly, michael peña, walton goggins, hannah john-kamen, david dastmalchian",2018,120.0,min
ds434,nature boom time,"charlie engelman, kirby engelman, patrick rahill",2016,1.0,season
ds435,sam's zookeeper challenge,sam peltz,2018,1.0,season
ds436,scuba sam's world,sam peltz,2018,1.0,season
ds437,spaced out,ben detour,2018,1.0,season
ds438,the greatest showman,"hugh jackman, zac efron, michelle williams, rebecca ferguson, zendaya , keala settle",2017,106.0,min
ds439,weird but true!,"charlie engelman, kirby engelman",2017,3.0,season
ds440,wild cats of india,james murray,2020,1.0,season
ds441,howard,howard ashman,2020,95.0,min
ds442,prince of persia: the sands of time,"jake gyllenhaal, ben kingsley, gemma arterton, alfred molina, richard coyle, toby kebbell",2010,117.0,min
ds443,star wars: galaxy's edge-adventure awaits,"neil harris, kaley cuoco, oscar isaac, sarah hyland, keegan-michael key, jay leno",2019,81.0,min
ds444,the hidden kingdoms of china,michelle yeoh,2020,88.0,min
ds445,the peanuts movie,"noah schnapp, alex garfin, hadley miller, mariel sheets, venus schultheis, noah johnston",2015,89.0,min
ds446,ufo europe: the untold stories,robert ashby,2012,1.0,season
ds447,animal showdown,brian peck,2018,1.0,season
ds448,best job ever,,2018,1.0,season
ds449,big cat games,boone smith,2015,44.0,min
ds450,black is king,beyoncé knowles-carter,2020,86.0,min
ds451,cradle of the gods,tim conrad,2012,45.0,min
ds452,destination world,rick robles,2018,1.0,season
ds453,fearless adventures with jack randall,jack randall,2018,1.0,season
ds454,hunt for the abominable snowman,stephen rashbrook,2011,45.0,min
ds455,incredibles 2,"craig nelson, holly hunter, sarah vowell, huckleberry milner, catherine keener, eli fucile",2018,118.0,min
ds456,king fishers,stephen mangan,2013,1.0,season
ds457,lost temple of the inca,dan nachtrab,2020,44.0,min
ds458,marvel funko shorts,,2016,2.0,season
ds459,muppets now,"dave goelz, matt vogel, david rudman, peter linz, bill barretta, eric jacobson",2020,1.0,season
ds460,surviving the mount st. helens disaster,bill ratner,2020,44.0,min
ds461,what sam sees,sam peltz,2018,1.0,season
ds462,pirates of the caribbean: dead men tell no tales,"johnny depp, javier bardem, brenton thwaites, kaya scodelario, kevin mcnally, golshifteh farahani",2017,129.0,min
ds463,pj masks (shorts),,2017,1.0,season
ds464,rogue trip,"bob woodruff, mack woodruff",2020,1.0,season
ds465,wild congo,corey johnson,2014,1.0,season
ds466,wild sri lanka,paul mcgann,2016,1.0,season
ds467,a pre-opening report from disneyland,"walt disney, winston hibler",1955,55.0,min
ds468,diary of a wimpy kid: the long haul,"jason drucker, alicia silverstone, tom scott, charlie wright, owen asztalos, dylan walters",2017,92.0,min
ds469,disney junior music lullabies,,2018,1.0,season
ds470,lost city of machu picchu,craig sechler,2019,44.0,min
ds471,super robot monkey team hyperforce go!,"greg cipes, kevin michael	richardson, tom kenny, kari wahlgren, clancy brown, corey feldman",2004,2.0,season
ds472,the mouseketeers at walt disney world,"jo worley, ronnie schell, dennis underwood, leslie norris, billy attmore, scott craig",1977,56.0,min
ds473,wild chile,peter venn,2017,1.0,season
ds474,x-men: apocalypse,"james mcavoy, michael fassbender, jennifer lawrence, oscar isaac, nicholas hoult, rose byrne",2016,144.0,min
ds475,cosmos: a spacetime odyssey,"neil tyson, stoney emshwiller",2013,1.0,season
ds476,hamilton: history has its eyes on you,"lin-manuel miranda, thomas kail, christopher jackson, leslie odom jr., phillipa soo, renee goldsberry",2020,47.0,min
ds477,solo: a star wars story,"alden ehrenreich, woody harrelson, emilia clarke, donald glover, thandie newton, phoebe waller-bridge",2018,135.0,min
ds478,x-men: days of future past,"hugh jackman, james mcavoy, michael fassbender, jennifer lawrence, halle berry, nicholas hoult",2014,132.0,min
ds479,the undefeated presents: hamilton in-depth,"lin-manuel miranda, thomas kail, renee goldsberry, leslie odom jr., daveed diggs, phillipa soo",2020,33.0,min
ds480,animal er,dr. brian beale,2016,2.0,season
ds481,diary of a wimpy kid: rodrick rules,"zachary gordon, devon bostick, rachael harris, robert capron, steve zahn",2011,100.0,min
ds482,hamilton,"daveed diggs, renée goldsberry, jonathan groff, christopher jackson, jasmine jones, lin-manuel miranda",2020,160.0,min
ds483,ice age: collision course,"ray romano, john leguizamo, denis leary, adam devine, jesse ferguson, max greenfield",2016,97.0,min
ds484,race to witch mountain,"dwayne johnson, annasophia robb, carla gugino, ciarán hinds, alexander ludwig, tom scott",2009,100.0,min
ds485,the big green,"steve guttenberg, olivia d'abo, jay sanders, john terry, chauncey leopardi, patrick renna",1995,100.0,min
ds486,the mighty ducks,"emilio estevez, joss ackland, lane smith, heidi kling, josef sommer, joshua jackson",1992,104.0,min
ds487,while you were sleeping,"sandra bullock, bill pullman, peter gallagher, peter boyle, glynis johns, micole mercurio",1995,104.0,min
ds488,disney a.n.t. farm,"china mcclain, sierra mccormick, jake short, stefanie scott, carlon jeffery",2011,3.0,season
ds489,into the unknown: making frozen 2,"kristen bell, idina menzel, josh gad, jonathan groff, jennifer lee, chris buck",2020,1.0,season
ds490,man in space,"walt disney, dick tufeld, ward kimball, willy ley, dr. heinz haber, dr. wernher von braun",1955,49.0,min
ds491,mars and beyond,"walt disney, paul frees, dr. ernst stuhlinger, dr. wernher von braun, dr. e.c. slipher",1957,53.0,min
ds492,marvel studios' avengers: infinity war,"robert downey jr., chris hemsworth, mark ruffalo, chris evans, scarlett johansson, don cheadle",2018,152.0,min
ds493,tarzan,"tony goldwyn, minnie driver, glenn close, alex linz, rosie o'donnell, brian blessed",1999,93.0,min
ds494,tarzan ii,"harrison chad, george carlin, brad garrett, ron perlman, estelle harris, glenn close",2005,75.0,min
ds495,101 dalmatians (series),"jeff bennett, christine cavanaugh, tara charendoff, jim cummings, tress macneille, charlotte rae",1997,1.0,season
ds496,big sur: wild california,hector elizondo,2010,47.0,min
ds497,disney junior muppet babies play date,,2018,1.0,season
ds498,egypt's treasure guardians,dominic frisby,2016,44.0,min
ds499,the jungle book,"bill murray, ben kingsley, idris elba, lupita nyong'o, scarlett johansson, giancarlo esposito",2016,108.0,min
ds500,the pirate fairy,"mae whitman, christina hendricks, tom hiddleston, lucy liu, raven-symoné , megan hilty",2014,78.0,min
ds501,trail mix-up,"charles fleischer, kathleen turner, april winchell, lou hirsch, corey burton, frank welker",1993,9.0,min
ds502,tummy trouble,"charles fleischer, april winchell, lou hirsch, corey burton, richard williams, kathleen turner",1989,8.0,min
ds503,artemis fowl,,2020,96.0,min
ds504,mighty med,"bradley perry, jake short, paris berelc, devan leos",2013,2.0,season
ds505,the liberty story,walt disney,1957,48.0,min
ds506,the story of the animated drawing,,1955,49.0,min
ds507,walt & el grupo,,2009,108.0,min
ds508,alaska's grizzly gauntlet,les stroud,2018,1.0,season
ds509,america's greatest animals,"bray poor, casey anderson, brady barr, andy casagrande, mireya mayor",2012,90.0,min
ds510,chasing the equinox,stefan frank,2019,45.0,min
ds511,howie mandel's animals doing things,howie mandel,2017,2.0,season
ds512,japan: between earth and sky,bray poor,2017,1.0,season
ds513,percy jackson & the olympians: the lightning thief,"logan lerman, brandon t. jackson, alexandra daddario, sean bean, pierce brosnan, steve coogan",2010,119.0,min
ds514,secrets of wild india,david attenborough,2012,1.0,season
ds515,the greeks,toby moore,2016,1.0,season
ds516,wild hawaii,jk simmons,2014,1.0,season
ds517,women of impact: changing the world,julianna margulies,2019,44.0,min
ds518,"maggie simpson in ""the longest daycare""",,2012,5.0,min
ds519,mickey and the seal,,1948,7.0,min
ds520,the evermoor chronicles,"naomi sequeira, finney cassidy, georgia lock, jordan loughran, george sear, georgie farmer",2015,2.0,season
ds521,the moon-spinners,"hayley mills, joan greenwood, michael davis, irene papas, paul stassino, eli wallach",1964,119.0,min
ds522,doc mcstuffins,"kiara muhammad, jaden betts, jess harnell, kimberly brooks, lara miller, loretta devine",2011,5.0,season
ds523,fantastic mr. fox,"george clooney, meryl streep, jason schwartzman, bill murray, wally wolodarsky, eric anderson",2009,88.0,min
ds524,"hello, dolly!","barbara streisand, walter matthau, michael crawford, marianne mcandrew, danny lockin, e.j. peaker",1969,147.0,min
