id,cast,release_year,duration_int,duration_type
ds1003,"matthew wood, yvette brown, nicolas cantu, carolyn hennesy, montse hernandez, vanessa lengies",2018,1.0,season
ds1004,"tom kane, anthony daniels, trevor devall, kirby morrow, sam vincent, michael donovan",2014,1.0,season
ds1005,,2015,1.0,season
ds1006,"matt sloan, trevor devall, greg baldwin, michael daingerfield, vanessa lengies, grey griffin",2015,2.0,season
ds1007,,2016,1.0,season
ds1008,"tom kane, anthony daniels, matt sloan, trevor devall, kirby morrow, sam vincent",2014,24.0,min
ds1009,"tom kane, anthony daniels, matt sloan, trevor devall, kirby morrow, sam vincent",2014,24.0,min
ds1010,"tom kane, anthony daniels, matt sloan, trevor devall, kirby morrow, sam vincent",2014,24.0,min
ds1011,"tom kane, anthony daniels, matt sloan, trevor devall, sam vincent, kelly metzger",2014,24.0,min
ds1012,"tom kane, anthony daniels, matt sloan, trevor devall, brian drummond, michael donovan",2014,24.0,min
ds1013,"bridgit mendler, adam hicks, hayley kiyoko, naomi scott, blake michael, nick roux",2011,110.0,min
ds1014,,1941,8.0,min
ds1015,"daveigh chase, chris sanders, david stiers, kevin mcdonald, tia carrere, kevin michael richardson",2006,76.0,min
ds1016,"tyler williams, coco jones, trevor jackson, brandon smith, dawnn lewis, alex désert",2012,103.0,min
ds1017,"kyle massey, kay panabaker, mitchel musso, carter jenkins, mark lawrence, judith moreland",2005,85.0,min
ds1018,"michael fox, nathan lane, cyndi lauper, david krumholtz, david huddleston, christina vidal",1993,92.0,min
ds1019,"tyra banks, francia raisa, gavin stenhouse, hank chen, alison fernandez, shanica knowles",2018,82.0,min
ds1020,,2006,5.0,min
ds1021,"daveigh chase, christopher sanders, tia carrere, david ogden stiers, kevin mcdonald, ving rhames",2002,86.0,min
ds1022,"christopher sanders, dakota fanning, tia carrere, david stiers, kevin mcdonald, kunewa mook",2005,70.0,min
ds1023,"hilary duff, lalaine , adam lamberg, jake thomas, hallie todd, robert carradine",2000,2.0,season
ds1024,,1937,9.0,min
ds1025,albert lin,2018,1.0,season
ds1026,,2017,7.0,min
ds1027,"paul kiernan, timothy omundson, ryan merriman, glenndon chatman, henry gibson, marita geraghty",2001,86.0,min
ds1028,,1986,2.0,min
ds1029,"pinto colvig, walt disney, clarence nash",1937,8.0,min
ds1030,,1947,7.0,min
ds1031,bob poole,2017,44.0,min
ds1032,,2018,47.0,min
ds1033,"cedric smith, catherine disher, alyson court, chris potter, george buza, iona morris",1992,5.0,season
ds1034,,2017,1.0,season
ds1035,"dee baker, chloe bennet, kathreen khavari, andrew kishino, meera kumbhani, kamil mcfadden",2018,80.0,min
ds1036,"jeff mcneil, meghan leon, jason hillhouse, robert downey jr., clark gregg, jon favreau",2014,43.0,min
ds1037,,2019,13.0,min
ds1038,"paul rudd, evangeline lilly, corey stoll, bobby cannavale, michael peña, tip harris",2015,119.0,min
ds1039,"robert downey jr., chris hemsworth, mark ruffalo, chris evans, scarlett johansson, jeremy renner",2015,143.0,min
ds1040,"robert downey jr., chris evans, mark ruffalo, chris hemsworth, scarlett johansson, jeremy renner",2019,183.0,min
ds1041,"chris evans, robert downey jr., scarlett johansson, sebastian stan, anthony mackie, don cheadle",2016,150.0,min
ds1042,"chris evans, tommy jones, hugo weaving, hayley atwell, sebastian stan, dominic cooper",2011,126.0,min
ds1043,"chris evans, scarlett johansson, sebastian stan, anthony mackie, cobie smulders, frank grillo",2014,138.0,min
ds1044,"brie larson, samuel jackson, ben mendelsohn, djimon hounsou, lee pace, lashana lynch",2019,126.0,min
ds1045,"benedict cumberbatch, chiwetel ejiofor, rachel mcadams, benedict wong, michael stuhlbarg, benjamin bratt",2016,116.0,min
ds1046,"chris pratt, zoë saldana, dave bautista, vin diesel, bradley cooper, lee pace",2014,122.0,min
ds1047,"chris pratt, bradley cooper, vin diesel, pom klementieff, zoë saldana, dave bautista",2017,137.0,min
ds1048,"robert downey jr., terrence howard, jeff bridges, gwyneth paltrow, leslie bibb, shaun toub",2008,127.0,min
ds1049,"robert downey jr., gwyneth paltrow, don cheadle, scarlett johansson, sam rockwell, clark gregg",2010,125.0,min
ds1050,"robert downey jr., gwyneth paltrow, don cheadle, guy pearce, rebecca hall, stephanie szostak",2013,132.0,min
ds1051,"robert downey jr., chris evans, mark ruffalo, chris hemsworth, scarlett johansson, jeremy renner",2012,145.0,min
ds1052,"chris hemsworth, natalie portman, tom hiddleston, anthony hopkins, stellan skarsgård, kat dennings",2011,116.0,min
ds1053,"chris hemsworth, natalie portman, tom hiddleston, anthony hopkins, rene russo, stellan skarsgård",2013,114.0,min
ds1054,"drake bell, chi mcbride, steven weber, j.k. simmons, tom kenny, clark gregg",2011,4.0,season
ds1055,"hayley atwell, james d'arcy, chad murray, enver gjokaj, shea whigham",2014,2.0,season
ds1056,,2016,1.0,season
ds1057,"adrian pasdar, fred tatasciore, roger smith, travis willingham, troy baker, bumper robinson",2012,5.0,season
ds1058,,2016,1.0,season
ds1059,"will friedle, trevor devall, kevin richardson, vanessa marshall, david sobolov",2015,3.0,season
ds1060,,2014,2.0,season
ds1061,,2019,1.0,season
ds1062,"anson mount, serinda swan, ken leung, eme ikwuakor, isabelle cornish, ellen woglom",2017,1.0,season
ds1063,,2016,1.0,season
ds1064,"cole howard, brian drummond",2016,1.0,season
ds1065,"julie andrews, dick van dyke, david tomlinson, glynis johns, hermione baddeley, karen dotrice",1964,142.0,min
ds1066,"larry the cable guy , owen wilson, michael wallis, bonnie hunt, paul newman, cheech marin",2006,8.0,min
ds1067,"paul walker, steve wormer, john ashton, a.j. langer, robert englund, megan cavanagh",1998,94.0,min
ds1068,"angela bassett, daniel hansen, jordan fry, matthew josten, john ford, dara mcgarry",2007,97.0,min
ds1069,"roy rogers, trigger , dennis day, the andrews sisters , fred waring and his pennsylvanians , freddy martin",1948,76.0,min
ds1070,,1948,7.0,min
ds1071,,2012,5.0,season
ds1072,,1955,1.0,season
ds1073,"wayne allwine, tony anselmo, bill farmer, russi taylor, tress macneille, jim cummings",2004,71.0,min
ds1074,"walt disney, thelma boardman, pinto colvig, clarence nash, florence gill",1942,9.0,min
ds1075,"alan young, wayne allwine, hal smith, will ryan, eddy carroll, patricia parris",1983,26.0,min
ds1076,,1947,7.0,min
ds1077,"kelsey grammer, wayne allwine, russi taylor, tony anselmo, diane michelle, tress macneille",1999,67.0,min
ds1078,"walt disney, marcelite garner, sonny dawson",1936,9.0,min
ds1079,"clarence nash, pinto colvig, walt disney",1938,8.0,min
ds1080,"wayne allwine, tony anselmo, jeff bennett, jim cummings, bill farmer, tress macneille",2004,70.0,min
ds1081,"bill paxton, charlize theron, rade šerbedžija, regina king, peter firth, naveen andrews",1998,116.0,min
ds1082,"billy crystal, john goodman",2002,5.0,min
ds1083,"jason dolley, luke benward, nicholas braun, chelsea staub, steven mcqueen, kara crane",2008,91.0,min
ds1084,"kurt russell, patricia clarkson, noah emmerich, sean mccann, kenneth welsh, eddie cahill",2004,137.0,min
ds1085,"sam waterston, mia farrow, justin whalin, patrick malahide, benedick blythe",1998,89.0,min
ds1086,"frankie muniz, rick rossovich, molly hagan, patrick levis, roger brown, tuc watkins",2000,90.0,min
ds1087,"todd boyce, miriam lucia, james mcgregor, nathan nolan, phillip wright",2014,44.0,min
ds1088,"henry goodman, jack baker",2018,44.0,min
ds1089,"auli'i cravalho, dwayne johnson, rachel house, temuera morrison, nicole scherzinger, jemaine clement",2016,108.0,min
ds1090,"matthew o'leary, laura vandervoort, myles jeffrey, caroline rhea, charles shaughnessy, robert carradine",2000,83.0,min
ds1091,"billy crystal, john goodman, steve buscemi, helen mirren, peter sohn, joel murray",2013,104.0,min
ds1092,"john goodman, billy crystal, mary gibbs, steve buscemi, james coburn, jennifer tilly",2001,93.0,min
ds1093,"alana austin, riley smith, mary-margaret humes, trever o'brien, timothy carhart, scott terra",2001,92.0,min
ds1094,"richard masur, mimi kennedy, benjamin gregory, david faustino, kristy swanson, howard witt",1986,46.0,min
ds1095,,1940,9.0,min
ds1096,,1940,8.0,min
ds1097,"ming-na wen, b.d. wong, mark moseley, lucy liu, harvey fierstein, sandra oh",2005,82.0,min
ds1098,,2014,1.0,season
ds1099,"tim curry, kevin bishop, billy connolly, jennifer saunders, dave goelz, steve whitmire",1996,101.0,min
ds1100,"ricky gervais, ty burrell, tina fey, steve whitmire, eric jacobson, dave goelz",2014,111.0,min
ds1101,"jeff daniels, christopher lloyd, elizabeth hurley, daryl hannah, wallace shawn, christine ebersole",1999,94.0,min
ds1102,jim cummings,2006,2.0,season
ds1103,"nicolas cage, jon voight, harvey keitel, ed harris, diane kruger, justin bartha",2007,125.0,min
ds1104,"christian bale, david moscow, bill pullman, gabriel damon, luke edwards, max casella",1992,122.0,min
ds1105,"jeremy jordan, kara lindsay, ben fankhauser, andrew keenan-bolger, steve blanchard, aisha de haas",2017,134.0,min
ds1106,"anna kendrick, bill hader, kingsley ben-adir, billy eichner, julie hagerty, shirley maclaine",2019,105.0,min
ds1107,"alyson michalka, johnny pacar, frank langella, brendan hill, chris olivero, gabriel sunday",2005,89.0,min
ds1108,"josh gad, idina menzel, kristen bell, jonathan groff, chris williams, john de lancie",2017,25.0,min
ds1109,"dorothy mcguire, fess parker, jeff york, chuck connors, beverly washburn, tommy kirk",1957,84.0,min
ds1110,"joey lawrence, billy joel, cheech marin, richard mulligan, roscoe browne, sheryl ralph",1988,76.0,min
ds1111,"carol burnett, tracey ullman, denis o'hare, zooey deschanel, michael boatman, edward hibbert",2005,88.0,min
ds1112,"mary steenburgen, gary basaraba, elizabeth harnois, arthur hill, wayne robson, jan rubes",1985,89.0,min
ds1113,,2006,5.0,min
ds1114,"danny glover, ray liotta, denis leary, doug doug, corin nemec, tcheky karyo",1995,109.0,min
ds1115,"mark monroe, jason silva",2016,1.0,season
ds1116,"vivian bayubay, tony james, jill schackner, aleisha allen, cece cortes, nicholas eng",1998,3.0,season
ds1117,rachel brosnahan,2018,77.0,min
ds1118,"tony fucile, lori richardson",2009,6.0,min
ds1119,"john goodman, billy crystal, dave foley, sean hayes, joel murray, charlie day",2014,7.0,min
ds1120,winston hibler,1957,75.0,min
ds1121,"bryce howard, oakes fegley, wes bentley, karl urban, oona laurence, isiah whitlock jr.",2016,106.0,min
ds1122,"bobby driscoll, kathryn beaumont, hans conried, bill thompson, heather angel, paul collins",1953,79.0,min
ds1123,"harriet owen, blayne weaver, corey burton, jeff bennett, kath soucie, andrew mcdonough",2002,77.0,min
ds1124,"taylor handley, corinne bohrer, caitlin wachs, jacob smith, rich hutchman, john novak",2000,89.0,min
ds1125,"ricky ullman, amy bruckner, craig anton, lise simms, alyson michalka",2003,2.0,season
ds1126,"vincent martella, ashley tisdale, thomas sangster, caroline rhea, alyson stoner, mitchel musso",2007,4.0,season
ds1127,"vincent martella, ashley tisdale, thomas brodie-sangster, caroline rhea, richard o'brien, dan povenmire",2011,79.0,min
ds1128,"vincent martella, ashley tisdale, thomas brodie-sangster, caroline rhea, richard o'brien, dan povenmire",2013,46.0,min
ds1129,"john fiedler, jim cummings, andre stojka, kath soucie, nikita hopkins, peter cullen",2003,78.0,min
ds1130,"dickie jones, christian rub, cliff edwards, evelyn venable, walter catlett, charles judels",1940,90.0,min
ds1131,,2016,6.0,min
ds1132,"johnny depp, orlando bloom, keira knightley, stellan skarsgård, bill nighy, chow yun-fat",2007,169.0,min
ds1133,"johnny depp, orlando bloom, keira knightley, stellan skarsgård, bill nighy, jack davenport",2006,152.0,min
ds1134,"johnny depp, geoffrey rush, orlando bloom, keira knightley, jack davenport, kevin mcnally",2003,144.0,min
ds1135,,2019,1.0,season
ds1136,"ricky ullman, leah pipes, spencer redford, chris williams, tania gunadi, porscha coleman",2004,90.0,min
ds1137,rodd houston,2018,45.0,min
ds1138,,1950,7.0,min
ds1139,"jimmy macdonald, pinto colvig, clarence nash, ruth clifford, dessie miller",1952,7.0,min
ds1140,,1949,7.0,min
ds1141,,1949,7.0,min
ds1142,"irene bedard, judy kuhn, mel gibson, david ogden stiers, john kassir, russell means",1995,85.0,min
ds1143,"irene bedard, jim cummings, donal gibson, finola hughes, linda hunt, judy kuhn",1998,77.0,min
ds1144,"jane wyman, richard egan, karl malden, nancy olson, adolphe menjou, donald crisp",1960,135.0,min
ds1145,"jim cummings, john fiedler, ken sansom, andre stojka, peter cullen, brady bluhm",1997,78.0,min
ds1146,"jim cummings, john fiedler, nikita hopkins, kath soucie, ken sansom, peter cullen",2005,73.0,min
ds1147,,2008,5.0,min
ds1148,"demi lovato, selena gomez, nicholas braun, molly hagan, johnny rodriguez, jamie chung",2009,90.0,min
ds1149,"bret parker, emily davis, kelsey mann, austin madison, erik langley, michael daley",2019,12.0,min
ds1150,"tony anselmo, james avery, brian cummings, e.g. daily, jeannie elias, pamela segall",1996,1.0,season
ds1151,"david oyelowo, lupita nyong'o, madina nalwanga, martin kabanza, taryn kyaze, esther tebandeke",2016,125.0,min
ds1152,"kimberly brown, daniel roebuck, elizabeth morehead, shadia simmons, jake epstein, vince corazza",2000,83.0,min
ds1153,"patton oswalt, ian holm, lou romano, brian dennehy, peter sohn, peter o'toole",2007,111.0,min
ds1154,"kay panabaker, jason dolley, robin riker, tom virtue, alexandra krosney, danielle panabaker",2006,85.0,min
ds1155,"krissy perez, jason dohring, lillian hurst, jon brazier, nestor serrano, theresa saldana",2000,89.0,min
ds1156,"rickey collins, jason davis, ashley johnson, myles jeffrey, andrew lawrence, ross malinger",2003,61.0,min
ds1157,"rickey collins, jason davis, ashely johnson, andy lawrence, courtland mead, pam segall",2001,87.0,min
ds1158,"rickey collins, jason davis, myles jeffrey, ashley johnson, courtland mead, pamela adlon",2003,63.0,min
ds1159,,1987,4.0,min
ds1160,"denzel washington, will patton, donald faison, wood harris, ryan hurst, ethan suplee",2000,114.0,min
ds1161,,1947,7.0,min
ds1162,"bette davis, christopher lee, kim richards, ike eisenmann, jack soo, anthony james",1978,94.0,min
ds1163,"sara paxton, judith hoag, lucas grabeel, j. zimmerman, kristy wu, keone young",2006,89.0,min
ds1164,"nicol williamson, jean marsh, piper laurie, matt clark, fairuza balk, michael sundin",1985,110.0,min
ds1165,"david gallagher, eugene levy, keene curtis, jake richardson, martin mull, lesley warren",1998,85.0,min
ds1166,"beverley mitchell, brie larson, marcus toji, jodi russell, jon lindstrom, ruby o'neil",2003,88.0,min
ds1167,"lori alan, carlos alazraqui, lewis black, josh cooley, ben cox, kaitlyn dias",2015,8.0,min
ds1168,"camilla belle, dwier brown, stacie hess, brian stark, jeanne mori, lauren sinclair",2000,87.0,min
ds1169,"roger miller, peter ustinov, terry-thomas , brian bedford, monica evans, phil harris",1973,85.0,min
ds1170,chopper bernet,2018,1.0,season
ds1171,"felicity jones, diego luna, ben mendelsohn, donnie yen, mads mikkelsen, alan tudyk",2016,134.0,min
ds1172,"paul newman, steve squyres, rob manning, dr. elachi, wayne lee",2006,41.0,min
ds1173,"penelope miller, kevin pollak, michael beach, jean kelly, peter james, patrika darbo",1998,90.0,min
ds1174,"robert redford, arapata mckay, tsaan ciqae, mae tui, cy peck jr., mutang urud",2004,47.0,min
ds1175,fred shields,1943,42.0,min
ds1176,"jack carson, robert culp, patricia barry, elisabeth fraser, michael mcgreevey, billy mummy",1962,43.0,min
ds1177,"brenton schraff, sunny attar, arun rao, jaquelynn herrera",2015,7.0,min
ds1178,"cheryl ladd, george newbern, pat finn, danny woodburn, obba babatunde, paul rae",2012,92.0,min
ds1179,,1932,7.0,min
ds1180,"emma thompson, tom hanks, colin farrell, paul giamatti, jason schwartzman, bradley whitford",2013,129.0,min
ds1181,"anjali chadha, ryan folz, harsha paladugu, abraham riedel-mishaan, kashfia rahman, ivo zell",2018,91.0,min
ds1182,max kennedy,2017,47.0,min
ds1183,"mae whitman, lucy hale, timothy dalton, jeff bennett, lucy liu, raven-symoné",2012,79.0,min
ds1184,"diane lane, john malkovich, dylan walsh, james cromwell, kevin connolly, nelsan ellis",2010,124.0,min
ds1185,,2017,47.0,min
ds1186,winston hibler,1956,70.0,min
ds1187,andre braugher,2012,47.0,min
ds1188,"bella thorne, zendaya , davis cleveland, roshon fegan, adam irigoyen, kenton duty",2010,3.0,season
ds1189,chris mclinden,2013,45.0,min
ds1190,"ashley tisdale, austin butler, cameron goodman, bradley perry, alec mapa, jack plotnick",2011,92.0,min
ds1191,"stian smestad, trond peter munch, louisa haigh, gabriel byrne, bjørn sundquist, eva von hanno",1991,93.0,min
ds1192,"paul essiembre, james blendick, robert bockstael, jennifer daley, colin fox",1997,1.0,season
ds1193,"dan castellaneta, julie kavner, nancy cartwright, yeardley smith, harry shearer, hank azaria",2007,88.0,min
ds1194,"whoopi goldberg, maggie smith, harvey keitel, bill nunn, mary wickes, kathy najimy",1992,101.0,min
ds1195,"whoopi goldberg, kathy najimy, barnard hughes, mary wickes, james coburn, michael jeter",1993,108.0,min
ds1196,"kelly blatz, joey pollari, conrad coates, jacqueline wood, nathan stephenson, kerry laifatt",2009,93.0,min
ds1197,"mary costa, eleanor audley, barbara luddy, taylor holmes, bill shirley, verna felton",1959,77.0,min
ds1198,"ryan merriman, kevin kilner, jessica steen, katie volding, katey sagal, emilio borelli",1999,82.0,min
ds1199,,2019,8.0,min
ds1200,"adriana caselotti, harry stockwell, lucille laverne, moroni olsen, billy gilbert, pinto colvig",1937,84.0,min
ds1201,"dean jones, nancy olson, harry morgan, keenan wynn, johnny whitaker, michael mcgreevy",1972,94.0,min
ds1202,"christina milian, erin karpluk, hilda doherty, jason schombing, james kot, andrew krivanek",2007,90.0,min
ds1203,"cara delizia, patrick levis, erik von detten, belinda metz, dave ward, mackenzie phillips",1999,3.0,season
ds1204,"pinto colvig, walt disney",1939,9.0,min
ds1205,,2016,1.0,season
ds1206,"hans conried, jerry dexter, george dicenzo, alan dinehart, walker edminston, michael evans",1982,1.0,season
ds1207,"rino romano, kathleen barr, jim byrnes, garry chalk, paul dobson",1999,1.0,season
ds1208,"joan ark, bruce miller, bryan scott, lou krugman, dick tufeld",1979,1.0,season
ds1209,"ashley eckstein, matt lanter, c1-10p a.k.a. ""chopper"" , john boyega, vanessa marshall, felicity jones",2016,2.0,season
ds1210,"taylor gray, vanessa marshall, freddie prinze jr., tiya sircar, steve blum, c1-10p a.k.a. ""chopper""",2014,4.0,season
ds1211,,2014,1.0,season
ds1212,"mark hamill, harrison ford, carrie fisher, peter cushing, alec guinness, anthony daniels",1977,125.0,min
ds1213,"ewan mcgregor, natalie portman, hayden christensen, frank oz, ian mcdiarmid, pernilla august",2002,143.0,min
ds1214,,2019,1.0,season
ds1215,"mark hamill, harrison ford, carrie fisher, billy williams, anthony daniels, peter mayhew",1983,135.0,min
ds1216,"ewan mcgregor, natalie portman, hayden christensen, ian mcdiarmid, frank oz, jimmy smits",2005,140.0,min
ds1217,"mark hamill, harrison ford, carrie fisher, billy williams, anthony daniels, david prowse",1980,127.0,min
ds1218,"harrison ford, mark hamill, carrie fisher, adam driver, daisy ridley, john boyega",2015,139.0,min
ds1219,"liam neeson, ewan mcgregor, natalie portman, jake lloyd, pernilla august, frank oz",1999,136.0,min
ds1220,"sterling knight, danielle campbell, maggie castle, brandon smith, chelsea staub, beth littleford",2010,81.0,min
ds1221,walt disney,1928,8.0,min
ds1222,"courtnee draper, tamara hope, lance guest, khrystyne haje, vanessa chester, myles jeffrey",2000,86.0,min
ds1223,"daveigh chase, chris sanders, tia carrere, david stiers, kevin mcdonald, ving rhames",2003,62.0,min
ds1224,craig sechler,2008,44.0,min
ds1225,"danielle panabaker, brenda song, amanda shaw, cici hedgepeth, jennie garland, ryan belleville",2004,79.0,min
ds1226,"timothy hutton, ken swofford, bruce glover, ned romero, richard paul, pat delany",1980,47.0,min
ds1227,"jeremy shinder, tenzing trainor, ty panitz, g. hannelius, cooper roth, colin hanks",2013,83.0,min
ds1228,"thomas mitchell, edna best, freddie bartholomew, terry kilburn, tim holt, baby quillan",1940,94.0,min
ds1229,"charlie adler, jim cummings, ed gilbert, chuck mccann, alan roberts, sally struthers",1990,1.0,season
ds1230,"scott glenn, oliver platt, nick stahl, stephen lang, roger brown, jared harris",1995,97.0,min
ds1231,"mandy moore, zachary levi, donna murphy, ron perlman, m.c. gainey, jeffrey tambor",2010,101.0,min
ds1232,"zachary levi, mandy moore, eden espinosa, clancy brown, julie bowen, laura benanti",2017,58.0,min
ds1233,"michael weiss, olivia d'abo, rene auberjonois, jeff bennett, jim cummings, grey delisle",2002,78.0,min
ds1234,"nathan lane, kelsey grammer, shaun fleming, debra rupp, david stiers, jerry stiller",2004,75.0,min
ds1235,"ross lynch, maia mitchell, grace phipps, garrett clayton, john deluca, chrissie fit",2015,106.0,min
ds1236,"ross lynch, maia mitchell, grace phipps, garrett clayton, john deluca, chrissie fit",2013,97.0,min
ds1237,"cassie scerbo, lindsey shaw, chris zylka, tim gunn, carissa capobianco, gabriela lopez",2011,82.0,min
ds1238,"christina ricci, doug doug, george dzundza, peter boyle, michael mckean, bess armstrong",1997,90.0,min
ds1239,"hayley mills, dean jones, dorothy provine, roddy mcdowall, neville brand, elsa lanchester",1965,116.0,min
ds1240,"fred macmurray, nancy olson, keenan wynn, tommy kirk, leon ames, elliott reid",1961,96.0,min
ds1241,,1984,2.0,min
ds1242,"roddy mcdowall, suzanne pleshette, karl malden, harry guardino, richard haydn, hermione baddeley",1967,111.0,min
ds1243,"elijah wood, courtney vance, robbie coltrane, jason robards, ron perlman, dana ivey",1993,108.0,min
ds1244,"bing crosby, basil rathbone, eric blore, pat o'malley, john ployardt, colin campbell",1949,69.0,min
ds1245,"david stollery, tim considine",1955,1.0,season
ds1246,winston hibler,1955,72.0,min
ds1247,"bill bixby, susan clark, don knotts, tim conway, david wayne, slim pickens",1975,100.0,min
ds1248,"tim conway, don knotts, tim matheson, kenneth mars, elyssa davalos, jack elam",1979,89.0,min
ds1249,"phil harris, eva gabor, sterling holloway, scatman crothers, paul winchell, lord tim hudson",1970,81.0,min
ds1250,john mcleish,1941,8.0,min
ds1251,"eric loomis, bumper robinson, dawn olivera, phil lamarr, alex desert, kari wuhrer",2010,2.0,season
ds1252,"martin roach, rod wilson, lenore zann, ron rubin, hamish mcewan, lynda ballantyne",1999,1.0,season
ds1253,clarence nash,1935,10.0,min
ds1254,"patrick wayne, chief george, andrew duggan, michael ansara, robert pine, val devargas",1974,83.0,min
ds1255,,1934,9.0,min
ds1256,"earl holliman, patricia crowley, lew ayres, godfrey cambridge, beah richards, clifton james",1972,93.0,min
ds1257,"grant bardsley, susan sheridan, freddie jones, nigel hawthorne, arthur malet, john byner",1985,82.0,min
ds1258,"maximilian schell, anthony perkins, robert forster, joseph bottoms, yvette mimieux, ernest borgnine",1979,98.0,min
ds1259,sarah jaffe,2013,7.0,min
ds1260,kate mulvany,2014,4.0,season
ds1261,"jim cummings, paul tiesler, jeff bennett, peter cullen, stephanie d’abruzzo, john fiedler",2000,2.0,season
ds1262,"deanna oliver, tim stack, roger kabler, thurl ravenscroft, eric lloyd, farrah fawcett",1998,73.0,min
ds1263,"james garner, vera miles, robert culp, eric shea, elizabeth smith, manu tupou",1974,91.0,min
ds1264,"raven , adrienne bailon, kiely williams, sabrina bryan, juan chioran, lori alter",2003,94.0,min
ds1265,"raven-symoné , adrienne bailon, sabrina bryan, kiely williams, belinda peregrin, lori alter",2006,98.0,min
ds1266,"adrienne bailon, sabrina bryan, kiely williams, roshan seth, michael steger, kunal sharma",2008,85.0,min
ds1267,"edward asner, rené auberjonois, jim metzler, susan tyrrell, karen landry, alan north",1986,94.0,min
ds1268,"georgie henley, skandar keynes, william moseley, anna popplewell, ben barnes, peter dinklage",2008,154.0,min
ds1269,"georgie henley, skandar keynes, william moseley, anna popplewell, tilda swinton, james mcavoy",2005,147.0,min
ds1270,"carl lumbly, penny johnson, shadia simmons, anthony burnett, travis davis, lindsey haun",2000,83.0,min
ds1271,"kurt russell, cesar romero, joe flynn, william schallert, alan hewitt, richard bakalyan",1969,90.0,min
ds1272,"christopher walken, stephen tobolowsky, daryl mitchell, m.c. gainey, diedrich bader, alex rocco",2002,91.0,min
ds1273,"david spade, john goodman, eartha kitt, patrick warburton, wendie malick, eli linnetz",2000,82.0,min
ds1274,"shia labeouf, christy romano, tom virtue, nick spano, steven lawrence, a.j. trauth",2003,94.0,min
ds1275,angela bassett,2018,93.0,min
ds1276,"mickey rooney, kurt russell, pearl bailey, jack albertson, sandy duncan, jeanette nolan",1981,85.0,min
ds1277,"reba mcentire, patrick swayze, jonah bobo, harrison fahn, jeff foxworthy, vicki lawrence",2006,73.0,min
ds1278,"dwayne johnson, kyra sedgwick, morris chestnut, roselyn sanchez, madison pettis, gordon clapp",2007,112.0,min
ds1279,"dick o'neill, victor french, louise latham, rad daly, monte markham, ruta lee",1980,93.0,min
ds1280,,1934,10.0,min
ds1281,,1935,11.0,min
ds1282,"jeffrey wright, frances mcdormand, maleah padilla, ryan teeple, jack mcgraw, marcus scribner",2015,94.0,min
ds1283,"jim henson, frank oz, dave goelz, jerry nelson, richard hunt, charles grodin",1981,98.0,min
ds1284,"shia labeouf, stephen dillane, peter firth, elias koteas, stephen marcus, josh flitter",2005,122.0,min
ds1285,"eddie murphy, terence stamp, nathaniel parker, marsha thomason, jennifer tilly, wallace shawn",2003,89.0,min
ds1286,,1939,9.0,min
ds1287,"tom hulce, demi moore, tony jay, kevin kline, paul kandel, jason alexander",1996,96.0,min
ds1288,"jason alexander, jennifer hewitt, tom hulce, paul kandel, charles kimbrough, kevin kline",2002,69.0,min
ds1289,,2019,1.0,season
ds1290,"émile genest, john drainie, tommy tweed, sandra scott, syme jago, marion finlayson",1963,80.0,min
ds1291,"craig nelson, holly hunter, samuel jackson, jason lee, dominique louis, teddy newton",2004,116.0,min
