id,cast,release_year,duration_int,duration_type
ds695,"dee baker, chloe bennet, dove cameron, robbie daymond, kathreen khavari, daisy lightfoot",2019,46.0,min
ds696,"olivia munn, cullen mccarthy, fiona bishop, dee baker, tom kenny",2014,2.0,season
ds697,"mandy moore, lucas grabeel",2011,2.0,season
ds698,dom joly,2016,2.0,season
ds699,"ari rubin, dr. pol",2016,42.0,min
ds700,"anthony gonzalez, gael bernal, benjamin bratt, alanna ubach, renée victor, jaime camil",2017,105.0,min
ds701,"anthony gonzalez, gael garcía bernal, benjamin bratt, alanna ubach, renée victor, jaime camil",2017,105.0,min
ds702,"tony hale, wallace shawn, alan oppenheimer, bob peterson",2019,6.0,min
ds703,"auli'i cravalho, queen latifah, shaggy , john stamos, graham phillips, amber riley",2019,84.0,min
ds704,"tony hale, robin downes, bob peterson",2019,7.0,min
ds705,"bret iwan, russi taylor, bill farmer, daniel ross, tress macneille",2017,2.0,season
ds706,,2019,2.0,min
ds707,"tony hale, john ratzenberger, bob peterson",2019,6.0,min
ds708,"heath ledger, julia stiles, joseph gordon-levitt, larisa oleynik, david krumholtz, andrew keegan",1999,98.0,min
ds709,"rod taylor, j. pat o'malley, betty gerson, cate bauer, ben wright, fred worlock",1961,81.0,min
ds710,"barry bostwick, jason alexander, martin short, bobby lockwood, susanne blakeslee, samuel west",2003,77.0,min
ds711,"glenn close, ioan gruffudd, alice evans, tim mcinnerny, ian richardson, gérard depardieu",2000,104.0,min
ds712,"amy smart, mark-paul gosselaar, peter macneil, mary long, jayne eastwood, laura miyata",2011,88.0,min
ds713,"kirk douglas, james mason, paul lukas, peter lorre, robert wilke, ted de corsia",1954,127.0,min
ds714,"dave foley, kevin spacey, julia louis-dreyfus, hayden panettiere, phyllis diller, richard kind",1998,98.0,min
ds715,"bill farmer, jason marsden, jim cummings, kellie martin, rob paulsen, wallace shawn",1995,81.0,min
ds716,"thomas nicholas, joss ackland, art malik, paloma baeza, kate winslet, daniel craig",1995,90.0,min
ds717,,1946,7.0,min
ds718,"mischa barton, ryan merriman, jared padalecki, scarlett pomers, soren fulton, chris kirby",2002,88.0,min
ds719,"scott weinger, robin williams, linda larkin, jonathan freeman, frank welker, gilbert gottfried",1992,94.0,min
ds720,"val bettin, jim cummings, gilbert gottfried, linda larkin, jerry orbach, john rhys-davies",1996,86.0,min
ds721,"jason alexander, jeff bennett, val bettin, liz callaway, dan castellaneta, jim cummings",1994,71.0,min
ds722,"ed wynn, richard haydn, sterling holloway, jerry colonna, verna felton, pat o'malley",1951,79.0,min
ds723,"dr. anatoly sagalevitch, genya chernaiev, victor nischeta, dr. pamela conrad, dr. arthur lane, dr. jim childress",2005,100.0,min
ds724,"kyle schmid, robert ri'chard, kaley cuoco, mimi paley, joey wilcots, philip williams",2000,87.0,min
ds725,"vincent winter, sean scully, peter weck, hans holt, bruni löbel, fritz eckhardt",1962,90.0,min
ds726,"george woodard, charles jimmie sr., the brothers, frank pino, dave pino, john yacobellis",2004,88.0,min
ds727,"jenny agutter, barry newman, kathleen nolan, chris robinson, lou fant, margaret o'brien",1981,100.0,min
ds728,"bill farmer, jason marsden, jeff bennett, jim cummings, brad garrett, vicki lewis",2000,81.0,min
ds729,"peyton lee, joshua rush, sofia wylie, asher angel, lilan bowden, lauren tom",2016,3.0,season
ds730,"kathy bates, alan cumming, audra mcdonald, kristin chenoweth, victor garber, vic polizos",1999,91.0,min
ds731,"neil armstrong, buzz aldrin",2019,95.0,min
ds732,"georgeos diaz-montexano, peter vincenti, richard freund, simcha jacobovici, charles pellegrino, félix rodrigues",2017,94.0,min
ds733,"james taylor, cree summer, john mahoney, jacqueline obradors, don novello, corey burton",2003,83.0,min
ds734,"michael fox, james garner, cree summer, don novello, phil morris, claudia christian",2001,98.0,min
ds735,"brad bird, eli fucile, maeve andrews, nick bird, noelle zuber, craig nelson",2018,7.0,min
ds736,"sam worthington, zoë saldana, sigourney weaver, stephen lang, michelle rodriguez, giovanni ribisi",2009,162.0,min
ds737,,1932,8.0,min
ds738,"ray bolger, tommy sands, annette funicello, ed wynn, tommy kirk, kevin corcoran",1961,106.0,min
ds739,,1942,72.0,min
ds740,"patrick stewart, alexander gould, keith ferguson, brendon baerg, nicky jones, andrea bowen",2006,75.0,min
ds741,,2018,8.0,min
ds742,,1939,9.0,min
ds743,,1955,7.0,min
ds744,"robby benson, paige o'hara, david stiers, jerry orbach, jeff bennett, jim cummings",1998,71.0,min
ds745,"paige o'hara, robby benson, jerry orbach, david stiers, bernadette peters, tim curry",1997,73.0,min
ds746,,1955,7.0,min
ds747,"leonardo dicaprio, john kerry, barack obama, bill clinton",2016,96.0,min
ds748,"red steagall, frank inn, nancy francis, mike francis, joe camp, steve zanolini",1987,89.0,min
ds749,"lauren taylor, shelby bender, gus kamp, ricky garcia, benjamin royer, matthew royer",2015,2.0,season
ds750,,2017,1.0,season
ds751,"scott adsit, ryan potter, daniel henney, t. j. miller, jamie chung, damon wayans jr.",2014,105.0,min
ds752,,2017,2.0,season
ds753,peter cullen,2009,46.0,min
ds754,"brian bonsall, karen duffy, miguel ferrer, james rebhorn, tone lōc, jayne atkinson",1994,94.0,min
ds755,,1938,8.0,min
ds756,"john travolta, miley cyrus, susie essman, mark walton, malcolm mcdowell, james lipton",2008,98.0,min
ds757,,1948,7.0,min
ds758,"charlie adler, corey burton, jesse corti, jim cummings, frank welker, gregg berger",1993,1.0,season
ds759,bud luckey,2004,6.0,min
ds760,"ben savage, william daniels, betsy randle, will friedle, rider strong, lee norris",1993,7.0,season
ds761,"kelly macdonald, billy connolly, emma thompson, julie walters, robbie coltrane, kevin mckidd",2012,94.0,min
ds762,"deanna oliver, tim stack, jon lovitz, thurl ravenscroft, phil hartman, jay mohr",1999,75.0,min
ds763,"lelisa desisa, eliud kipchoge, zersenay tadese",2017,55.0,min
ds764,"erik von detten, sam horrigan, christina vidal, robin riker, geoffrey blake, patrick levis",1998,90.0,min
ds765,"joaquin phoenix, jeremy suarez, jason raize, rick moranis, dave thomas, d.b. sweeney",2003,90.0,min
ds766,"patrick dempsey, mandy moore, jeremy suarez, rick moranis, dave thomas, andrea martin",2006,78.0,min
ds767,"reiley mcclendon, simon baker, graham greene, tessa vonn, max van ville, chris hunter",2005,90.0,min
ds768,,2017,1.0,season
ds769,"angus maclane, tessa swigart",2008,8.0,min
ds770,"hilary duff, christy romano, shawn ashmore, aimee garcia, linda kash, nigel hamer",2002,100.0,min
ds771,"christopher lloyd, jonathan jackson, wendy makkena, tom wilson, andrew keegan, marne patterson",1994,96.0,min
ds772,"demi lovato, joe jonas, meaghan martin, maria canals-barrera, alyson stoner, julie brown",2008,96.0,min
ds773,"demi lovato, joe jonas, nick jonas, kevin jonas, daniel fathers, daniel kash",2010,101.0,min
ds774,"michael shulman, erika christensen, adam wylie, andrew ducote, lee garlington, brighton hertford",1999,84.0,min
ds775,"david niven, helen hayes, jodie foster, leo mckern, vivian pickles, veronica quilligan",1978,101.0,min
ds776,,1941,8.0,min
ds777,"owen wilson, paul newman, bonnie hunt, larry the cable guy , cheech marin, tony shalhoub",2006,117.0,min
ds778,"owen wilson, larry the cable guy , michael caine, emily mortimer, john turturro, eddie izzard",2011,107.0,min
ds779,"owen wilson, cristela alonzo, chris cooper, nathan fillion, larry the cable guy , armie hammer",2017,103.0,min
ds780,"larry the cable guy , keith ferguson, stacey keach, jonathan adams, jan rabson, lori alan",2011,5.0,min
ds781,"larry the cable guy , keith ferguson",2010,5.0,min
ds782,"keith ferguson, larry the cable guy , michael wallis, tony shalhoub, lloyd sherr, bonnie hunt",2013,3.0,min
ds783,"larry the cable guy , keith ferguson",2010,6.0,min
ds784,"larry the cable guy , keith ferguson",2008,5.0,min
ds785,"larry the cable guy , keith ferguson",2010,6.0,min
ds786,"owen wilson, larry the cable guy , steve purcell, jess harnell, john cygan,  danny  mann",2014,6.0,min
ds787,"pat hingle, noah hathaway, virginya keehne, gary riley, ebbe smith, sharon barr",1986,46.0,min
ds788,"keith coogan, lucy deakins, timothy landfield, breon gorman, collin mothupi, ka vundla",1989,84.0,min
ds789,,1941,8.0,min
ds790,"zach braff, garry marshall, don knotts, patrick stewart, amy sedaris, steve zahn",2005,84.0,min
ds791,"corey burton, peter cullen, jim cummings, tress macneille",1989,1.0,season
ds792,,1947,7.0,min
ds793,"ilene woods, eleanor audley, verna felton, rhoda williams, james macdonald, luis van rooten",1950,77.0,min
ds794,"jennifer hale, rob paulsen, corey burton, andre stojka, russi taylor, susanne blakeslee",2002,77.0,min
ds795,"jennifer hale, c.d. barnes, susanne blakeslee, tress macneille, russi taylor, andre stojka",2007,79.0,min
ds796,,1937,9.0,min
ds797,"luke benward, dove cameron, mike manning, kiersey clemons, amy farrington, patrick fabian",2014,89.0,min
ds798,"martin lawrence, raven-symoné , donny osmond, brenda song, will sasso, eshaya draper",2008,84.0,min
ds799,"lindsay lohan, adam garcia, glenne headly, alison pill, eli marienthal, megan fox",2004,91.0,min
ds800,,2018,1.0,season
ds801,,1951,7.0,min
ds802,"amanda michalka, alyson michalka, sheila mccarthy, michael trevino, christian serratos, ron gabriel",2006,91.0,min
ds803,"cole jensen, tim lagasse, landry bender, oana gregory, aaron landon",2012,2.0,season
ds804,"emily osment, david henrie, jason earles, jonathan keltz, moises arias, denzel whitaker",2009,85.0,min
ds805,"albert sharpe, janet munro, sean connery, jimmy o'dea, kieron moore, estelle winwood",1959,91.0,min
ds806,"jim cummings, christine cavanaugh, terry mcgovern, frank welker",1991,2.0,season
ds807,"fess parker, buddy ebsen, jeff york, kenneth tobey, clem bevans, irvin ashkenazy",1956,81.0,min
ds808,"fess parker, buddy ebsen, basil ruysdael, hans conried, pat hogan, ken tobey",1955,93.0,min
ds809,,2010,8.0,min
ds810,"whoopi goldberg, sofia carson, jordan fisher",2017,42.0,min
ds811,pierce brosnan,2005,91.0,min
ds812,"dove cameron, cameron boyce, sofia carson, booboo stewart, mitchell hope, brenna d'amico",2017,114.0,min
ds813,"zachary gordon, robert capron, rachel harris, steve zahn, connor fielding, owen fielding",2010,93.0,min
ds814,"d.b. sweeney, alfre woodard, ossie davis, max casella, hayden panettiere, samuel wright",2000,84.0,min
ds815,"sabrina carpenter, sofia carson, nikki hahn, mallory mahoney, max gecowets, jet jurgensmeyer",2016,95.0,min
ds816,"britt robertson, gregg sulkin, joey pollari, devon graye, molly quinn, don lake",2010,91.0,min
ds817,"laura marano, leigh-allyn baker, christian campbell, alain goulem, christian paul, kiana madeira",2015,93.0,min
ds818,"madison hu, olivia rodrigo, jake paul, devore ledridge, ethan wacker",2015,3.0,season
ds819,"hutch dano, g. hannelius, maurice godin, david lambert, kelsy chow, debra mooney",2010,90.0,min
ds820,"dove cameron, cameron boyce, booboo stewart, sofia carson, mitchell hope, melanie paxson",2015,114.0,min
ds821,,2015,2.0,season
ds822,,2016,1.0,season
ds823,"naomi sequeira, jordan loughran, belinda stewart-wilson, dan fredenburgh, george sear, georgie farmer",2017,1.0,season
ds824,,2019,1.0,season
ds825,"sophie pollono, sofia rosinsky, brandon rossel, winslow fegley",2018,1.0,season
ds826,"olivia holt, kerris dorsey, brendan meyer, katherine mcnamara, adam chambers, tracy dawson",2012,90.0,min
ds827,"kristen schaal, jason morgan, alex hirsch",2011,2.0,season
ds828,,2012,1.0,season
ds829,"madison pettis, colin ford, jonathan heit, david arquette, corey burton",2010,4.0,season
ds830,"kevin jonas, joe jonas, nick jonas, chelsea staub, nicole anderson, john ducey",2008,2.0,season
ds831,,2017,2.0,season
ds832,"zendaya , veronica dunne, kamil mcfadden, tammy townsend, kadeem hardison",2014,3.0,season
ds833,"william brent, bradley perry, jake short, paris berelc, kelli berglund",2015,1.0,season
ds834,"tony anselmo, jaime camil, eric bauza, grey griffin, wayne knight, kevin richardson",2017,1.0,season
ds835,"wayne allwine, jim cummings, russi taylor, tony anselmo, bill farmer, tress macneille",2005,5.0,season
ds836,"al yankovic, sabrina carpenter, mekai curtis",2016,2.0,season
ds837,,2011,3.0,season
ds838,"jenna ortega, ronni hawk, isaak presley, ariana greenblatt, kayla maisonet, nicolas bechtel",2015,3.0,season
ds839,,2010,1.0,season
ds840,,2016,1.0,season
ds841,,2018,10.0,min
ds842,"bill scott, christian jacobs, brett johnson, david faustino, paul winchell, jason marsden",1985,6.0,season
ds843,"connie shulman, doug preis, alice playten, chris phillips, fred newman, thomas mchugh",1996,3.0,season
ds844,"ben higgins, lauren bushnell",2017,64.0,min
ds845,"stephen boss, allison holker",2017,42.0,min
ds846,"tate donovan, sandra bernhard, robert costanzo, matt frewer, bobcat goldthwait, french stewart",1998,1.0,season
ds847,"christy romano, will friedle, nancy cartwright, tahj mowry",2001,4.0,season
ds848,"erica huang, aiden pompey, jesse schwartz, natalia wojcik",2005,2.0,season
ds849,"james belushi, brad garrett, jeff bennett, jennifer hale, clancy brown, tony jay",1996,1.0,season
ds850,"rickey collins, jason davis, ashley johnson, ross malinger, courtland mead, pamela segall",1997,3.0,season
ds851,"shane baumel, jessica dicicco, wendie malick, fred tatasciore, jeff bennett, jessie flower",2005,2.0,season
ds852,"bruce willis, spencer breslin, emily mortimer, lily tomlin, chi mcbride, jean smart",2000,105.0,min
ds853,"jodi benson, samuel wright, ken mars, edan gross",1992,3.0,season
ds854,walt disney,1966,51.0,min
ds855,samuel jackson,2011,90.0,min
ds856,john reilly,2014,78.0,min
ds857,john krasinski,2017,81.0,min
ds858,tim allen,2012,79.0,min
ds859,mariella frostrup,2008,78.0,min
ds860,tina fey,2015,82.0,min
ds861,meryl streep,2011,81.0,min
ds862,cesar millan,2004,6.0,season
ds863,"erin chambers, eric hodges ii, eric hodges, robin riker, steve valentine, jake sakson",1999,93.0,min
ds864,,1938,8.0,min
ds865,,1943,8.0,min
ds866,"poppi monroe, annie mcelwain, teal redmann, nick searcy, tanya goott, joey miyashima",2002,93.0,min
ds867,"thomas mchugh, fred newman, chris phillips, constance shulman, frank welker, doug preis",1999,80.0,min
ds868,dr. lauren thielen,2019,1.0,season
ds869,"alan young, terence mcgovern, russi taylor, richard libertini, christopher lloyd, june foray",1990,75.0,min
ds870,"bob peterson, delroy lindo, jerome ranft",2009,6.0,min
ds871,"colin farrell, michael keaton, danny devito, eva green, alan arkin, nico parker",2019,117.0,min
ds872,,1941,9.0,min
ds873,"jane lynch, phil keoghan, chris packham",2017,94.0,min
ds874,peter demeo,2018,45.0,min
ds875,"taylor ball, orlando brown, reiley mcclendon, mark taylor, rose mciver, kylie leydon",2003,86.0,min
ds876,"paul walker, bruce greenwood, moon bloodgood, wendy crewson, gerard plunkett, august schellenberg",2006,122.0,min
ds877,"aimee carrero, jenna ortega, maximus riegel, gia lopez, desmond gerber, mick wingert",2017,2.0,season
ds878,"walter slezak, roger mobley, heinz schubert, peter ehrlich, cindy cassell, elsa wagner",1964,98.0,min
ds879,"robert clotworthy, walter cronkite, anthony daniels, warwick davis, carrie fisher, harrison ford",2004,151.0,min
ds880,"kristen bell, roger love, susan egan, ali stroker, stephen schwartz",2019,1.0,season
ds881,"eddie albert, ray milland, donald pleasence, kim richards, ike eisenmann, walter barnes",1975,98.0,min
ds882,"shia labeouf, christy romano, nick spano, tom virtue, donna pescow",2000,3.0,season
ds883,bray poor,2019,88.0,min
ds884,"deems taylor, walt disney, leopold stokowski",1940,126.0,min
ds885,"steve martin, itzhak perlman, quincy jones, bette midler, james jones, penn teller",2000,76.0,min
ds886,"beau weaver, lori alan, chuck mccann, brian green, stan lee, pauline lomas",1994,1.0,season
ds887,"christopher jacot, hiro kanagawa, lara gilchrist, brian dobson",2007,1.0,season
ds888,,1938,8.0,min
ds889,"ellen degeneres, albert brooks, ed o'neill, kaitlin olson, hayden rolence, ty burrell",2016,98.0,min
ds890,"albert brooks, ellen degeneres, alexander gould, willem dafoe, brad garrett, allison janney",2003,103.0,min
ds891,"sinbad , robert guillaume, timothy busfield, brock pierce, james naughton, art fleur",1996,102.0,min
ds892,"joey cramer, veronica cartwright, cliff de young, sarah parker, matt adler, howard hesseman",1986,90.0,min
ds893,"eli fucile, bobby rubio, luna watson, mika kubo",2019,10.0,min
ds894,,1932,8.0,min
ds895,"robin williams, marcia harden, christopher mcdonald, raymond barry, clancy brown, ted levine",1997,96.0,min
ds896,,1950,7.0,min
ds897,,2001,4.0,min
ds898,"tony hale, john ratzenberger, bob peterson",2019,6.0,min
ds899,"frank thomas, ollie johnston, sylvia roemer, john canemaker, john culhane, marie johnston",1995,89.0,min
ds900,"shelley duvall, daniel stern, barret oliver",1984,27.0,min
ds901,"jamie curtis, lindsay lohan, harold gould, chad murray, stephen tobolowsky, christina vidal",2003,98.0,min
ds902,"alex honnold, tommy caldwell",2018,101.0,min
ds903,"zendaya , bella thorne, mary mouser, nick robinson, stefanie scott, connor price",2012,88.0,min
ds904,"kristen bell, idina menzel, jonathan groff, josh gad, santino fontana, alan tudyk",2013,105.0,min
ds905,"alex linz, r.h. thomson, sean marquette, jase blankfort, erik knudsen, david sazant",2003,95.0,min
ds906,"edgar bergen, dinah shore, luana patten, clarence nash, mickey mouse, cliff edwards",1947,74.0,min
ds907,"chris hebert, phil fondacaro, joe regalbuto, wendy phillips, robyn lively, john vernon",1986,46.0,min
ds908,"thom hernandez, edward asner, jeff bennett, keith david, bill fagerbakke, jonathan frakes",1994,3.0,season
ds909,"sarah hyland, matt prokop, sasha pieterse, jordan nichols, vanessa morgan, lili simmons",2011,99.0,min
ds910,"trevor morgan, emmy rossum, yannick bisson, peter keleghan, philip granger, charles fleischer",1999,86.0,min
ds911,"jason topolski, a.j. riebli  iii, steve purcell, peter sohn, bob peterson, kim donovan",2009,4.0,min
ds912,bob peterson,1997,5.0,min
ds913,"lindsay lohan, bug hall, ian gomez, brenda song, ali mukadam, dan lett",2002,84.0,min
ds914,bill graves,2018,45.0,min
ds915,"rowan blanchard, ben savage, sabrina carpenter, peyton meyer, august maturo, danielle fishel",2013,3.0,season
ds916,"jordan hinson, whitney sloan, cristine rose",2005,89.0,min
ds917,"andrew lawrence, khleo thomas, alessandra toreson, billy brown, brenda strong, brian wimmer",2004,92.0,min
ds918,"bridgit mendler, leigh-allyn baker, bradley perry, mia talerico, eric kramer, jason dolley",2009,4.0,season
ds919,"bridgit mendler, leigh-allyn baker, bradley perry, mia talerico, debra monk, michael kagan",2011,82.0,min
ds920,"nancy cartwright, jim cummings, dana hill, rob paulson, corey burton, bill farmer",1992,1.0,season
ds921,"camille guaty, america ferrera, jhoanna flores, suilma rodriguez, sabrina wiener, miguel sandoval",2002,85.0,min
ds922,,1954,7.0,min
ds923,,1934,8.0,min
ds924,alec baldwin,2010,1.0,season
ds925,"donald crisp, laurence naismith, alex mackenzie, duncan macrae, andrew cruickshank, gordon jackson",1961,91.0,min
ds926,"edward asner, don knotts, gary grimes, tim conway, liberty williams, dick van patten",1976,97.0,min
ds927,"debbie reynolds, judith hoag, kimberly brown, joey zimmerman, phillip van dyke, emily roeske",1998,84.0,min
ds928,"kimberly brown, judith hoag, joey zimmerman, emily roeske, clifton davis, finn wittrock",2004,83.0,min
ds929,"kimberly brown, judith hoag, daniel kountz, joseph zimmerman, emily roeske, phillip van dyke",2001,81.0,min
ds930,"wilmer valderrama, carlos alazraqui, dee baker, nika futterman, tom kenny, kath soucie",2006,3.0,season
ds931,"miley cyrus, emily osment, mitchel musso, jason earles, billy cyrus",2005,4.0,season
ds932,"miley cyrus, joe jonas, kevin jonas, nick jonas, kenny ortega, billy cyrus",2008,83.0,min
ds933,"miley cyrus, emily osment, margo martindale, jason earles, peter gunn, melora hardin",2009,105.0,min
ds934,"jason dolley, mitchel musso, tiffany thornton, josie loren, sean o'bryan, amy farrington",2009,90.0,min
ds935,"walt disney, marcellite garner, clarence nash, pinto colvig",1937,9.0,min
ds936,"tom mcgowan, aaron schwartz, shaun weiss, tom hodges, leah lail, paul feig",1995,98.0,min
ds937,"cloris leachman, charles smith, john vernon, stephen burns, elyssa davalos, joaquin garay  iii",1980,93.0,min
ds938,"dean jones, don knotts, julie sommars, jacques marin, roy kinnear, bernard fox",1977,105.0,min
ds939,"helen hayes, ken berry, stefanie powers, john mcintire, keenan wynn, huntz hall",1974,89.0,min
ds940,"tate donovan, joshua keaton, roger bart, danny devito, james woods, susan egan",1997,98.0,min
ds941,"zac efron, vanessa hudgens, ashley tisdale, lucas grabeel, alyson reed, corbin bleu",2006,100.0,min
ds942,"zac efron, vanessa hudgens, ashley tisdale, lucas grabeel, corbin bleu, monique coleman",2007,114.0,min
ds943,"zac efron, vanessa hudgens, ashley tisdale, lucas grabeel, corbin bleu, monique coleman",2008,121.0,min
ds944,"olivia rodrigo, joshua bassett, matt cornett, sofia wylie, larry saperstein",2019,2.0,season
ds945,"bette midler, sarah parker, kathy najimy, omri katz, thora birch, vinessa shaw",1993,96.0,min
ds946,"roseanne barr, judi dench, jennifer tilly, steve buscemi, g.w. bailey, cuba gooding jr.",2004,82.0,min
ds947,"rick moranis, marcia strassman, lloyd bridges, robert oliveri, john shea, keri russell",1992,90.0,min
ds948,"rick moranis, matt frewer, marcia strassman, kristine sutherland, thomas brown, jared rushton",1989,94.0,min
ds949,"rick moranis, eve gordon, robin bartlett, allison mack, jake richardson, stuart pankin",1997,76.0,min
ds950,"joey lawrence, andy lawrence, susan walters, m.c. gainey, leann hunley, robin thomas",1999,92.0,min
ds951,bear grylls,2019,1.0,season
ds952,"tahj mowry, shia labeouf, craig kirkwood, steven bendik, sara paxton, rachelle carson",2001,92.0,min
ds953,jake robards,2016,44.0,min
ds954,"ashley argota, roger bart, kelli berglund, noah centineo, china mcclain, matt shively",2014,94.0,min
ds955,john mcleish,1942,7.0,min
ds956,,1942,8.0,min
ds957,"fred tatasciore, clancy brown, seth green, eliza dushku, ben diskin",2012,2.0,season
ds958,"jonathan thomas, jessica biel, adam lavorgna, gary cole, eve gordon, lauren maltby",1998,87.0,min
ds959,"raymond albert romano, john leguizamo, denis leary, queen latifah",2016,26.0,min
ds960,"joan cusack, kim cattrall, michelle trachtenberg, hayden panettiere, trevor blumas, connie ray",2005,99.0,min
ds961,"este haim, tucker gilmore, raymond persi, terri douglas",2016,6.0,min
ds962,"amy poehler, phyllis smith, richard kind, bill hader, lewis black, mindy kaling",2015,95.0,min
ds963,"matthew broderick, rupert everett, joely fisher, michelle trachtenberg, michael hagerty, andy dick",1999,80.0,min
ds964,"french stewart, elaine hendrix, caitlin wachs, tony martin, john batchelor, mark mitchell",2003,90.0,min
ds965,,2019,82.0,min
ds966,"steve boyes, dr. steve boyes, chris boyes, tumeletso setlabosha, gobonamang kgetho, adjany costa",2018,94.0,min
ds967,"mark wahlberg, greg kinnear, elizabeth banks, michael rispoli, kevin conway, kirk acevedo",2006,105.0,min
ds968,"rowan blanchard, paris berelc, karan brar, rachel crow, alex désert, will meyers",2015,79.0,min
ds969,"robert hays, james avery, ed gilbert, jim cummings, tony steedman, james warwick",1994,1.0,season
ds970,"adrian petriw, daniel bacon, anna cummer, mackenzie gray, vincent tong",2008,2.0,season
ds971,"mackenzie astin, kevin spacey, david ogden stiers, august schellenberg, brian cox, george gerdes",1994,109.0,min
ds972,"robin williams, diane lane, brian kerwin, jennifer lopez, bill cosby, fran drescher",1996,113.0,min
ds973,"bret parker, bud luckey, eli fucile, jason lee",2005,6.0,min
ds974,"miriam margolyes, joanna lumley, pete postlethwaite, paul terry, simon callow, richard dreyfuss",1996,81.0,min
ds975,jane goodall,2017,90.0,min
ds976,"debby ryan, peyton list, cameron boyce, karan brar, skai jackson, kevin chamberlin",2011,4.0,season
ds977,dr. pol,2013,45.0,min
ds978,"brandon baker, robyn lively, mary keller, yuji okumoto, jonathan mcdaniel, andrew allen",2007,93.0,min
ds979,"cary-hiroyuki tagawa, brandon baker, yuji okumoto, mary keller, lee young, kirsten storms",1999,92.0,min
ds980,"kevin jonas, joe jonas, nick jonas, demi lovato, taylor swift, ""big feggans",2009,89.0,min
ds981,salvatore vecchio,2010,47.0,min
ds982,"pat boone, james mason, arlene dahl, diane baker, thayer david, peter ronson",1959,130.0,min
ds983,"corbin bleu, david reivers, shanica knowles, laivan greene, kylee russell, patrick johnson jr.",2007,86.0,min
ds984,"joey lawrence, matthew lawrence, andrew lawrence, susan walters, stephen burleigh, anthony wong",2001,93.0,min
ds985,"tim allen, martin short, lolita davidovich, david stiers, jobeth williams, sam huntington",1997,105.0,min
ds986,winston hibler,1960,70.0,min
ds987,"shaquille o'neal, francis capra, ally walker, james acheson, john costelloe, marshall manesh",1996,94.0,min
ds988,"leo howard, dylan snyder, mateo arias, olivia holt, alex jones, jason earles",2010,4.0,season
ds989,"sadie stanley, sean giambrone, ciara wilson, taylor ortega, connie ray, issac brown",2019,88.0,min
ds990,"christy romano, will friedle, nancy cartwright, tahj mowry, raven , gary cole",2005,70.0,min
ds991,dan nachtrab,2017,44.0,min
ds992,tom selleck,2009,94.0,min
ds993,jenny jules,2019,1.0,season
ds994,,2019,9.0,min
ds995,,2003,4.0,min
ds996,"patrick warburton, tracey ullman, eartha kitt, david spade, john goodman, wendie malick",2005,78.0,min
ds997,"tony fucile, krista sheffler, phil sheridan",2012,7.0,min
ds998,"billy unger, spencer boldman, kelli berglund, tyrel williams, hal sparks",2011,4.0,season
ds999,"tessa thompson, justin theroux, sam elliott, ashley jensen, janelle monáe, kiersey clemons",2019,111.0,min
ds1000,"kuana kahele, napua greig",2015,9.0,min
ds1001,,2016,1.0,season
ds1002,"jasmin brown, josh peck, zeno robinson, max mittelman, matthew wood",2018,1.0,season
