id,title,cast,release_year,duration_int,duration_type
ds1035,marvel rising: secret warriors,"dee baker, chloe bennet, kathreen khavari, andrew kishino, meera kumbhani, kamil mcfadden",2018,80.0,min
ds1036,marvel studios: assembling a universe,"jeff mcneil, meghan leon, jason hillhouse, robert downey jr., clark gregg, jon favreau",2014,43.0,min
ds1037,marvel studios: expanding the universe,,2019,13.0,min
ds1038,marvel studios' ant-man,"paul rudd, evangeline lilly, corey stoll, bobby cannavale, michael peña, tip harris",2015,119.0,min
ds1039,marvel studios' avengers: age of ultron,"robert downey jr., chris hemsworth, mark ruffalo, chris evans, scarlett johansson, jeremy renner",2015,143.0,min
ds1040,marvel studios' avengers: endgame,"robert downey jr., chris evans, mark ruffalo, chris hemsworth, scarlett johansson, jeremy renner",2019,183.0,min
ds1041,marvel studios' captain america: civil war,"chris evans, robert downey jr., scarlett johansson, sebastian stan, anthony mackie, don cheadle",2016,150.0,min
ds1042,marvel studios' captain america: the first avenger,"chris evans, tommy jones, hugo weaving, hayley atwell, sebastian stan, dominic cooper",2011,126.0,min
ds1043,marvel studios' captain america: the winter soldier,"chris evans, scarlett johansson, sebastian stan, anthony mackie, cobie smulders, frank grillo",2014,138.0,min
ds1044,marvel studios' captain marvel,"brie larson, samuel jackson, ben mendelsohn, djimon hounsou, lee pace, lashana lynch",2019,126.0,min
ds1045,marvel studios' doctor strange,"benedict cumberbatch, chiwetel ejiofor, rachel mcadams, benedict wong, michael stuhlbarg, benjamin bratt",2016,116.0,min
ds1046,marvel studios' guardians of the galaxy,"chris pratt, zoë saldana, dave bautista, vin diesel, bradley cooper, lee pace",2014,122.0,min
ds1047,marvel studios' guardians of the galaxy vol. 2,"chris pratt, bradley cooper, vin diesel, pom klementieff, zoë saldana, dave bautista",2017,137.0,min
ds1048,marvel studios' iron man,"robert downey jr., terrence howard, jeff bridges, gwyneth paltrow, leslie bibb, shaun toub",2008,127.0,min
ds1049,marvel studios' iron man 2,"robert downey jr., gwyneth paltrow, don cheadle, scarlett johansson, sam rockwell, clark gregg",2010,125.0,min
ds1050,marvel studios' iron man 3,"robert downey jr., gwyneth paltrow, don cheadle, guy pearce, rebecca hall, stephanie szostak",2013,132.0,min
ds1051,marvel studios' the avengers,"robert downey jr., chris evans, mark ruffalo, chris hemsworth, scarlett johansson, jeremy renner",2012,145.0,min
ds1052,marvel studios' thor,"chris hemsworth, natalie portman, tom hiddleston, anthony hopkins, stellan skarsgård, kat dennings",2011,116.0,min
ds1053,marvel studios' thor: the dark world,"chris hemsworth, natalie portman, tom hiddleston, anthony hopkins, rene russo, stellan skarsgård",2013,114.0,min
ds1054,marvel ultimate spider-man,"drake bell, chi mcbride, steven weber, j.k. simmons, tom kenny, clark gregg",2011,4.0,season
ds1055,marvel's agent carter,"hayley atwell, james d'arcy, chad murray, enver gjokaj, shea whigham",2014,2.0,season
ds1056,marvel's ant-man (shorts),,2016,1.0,season
ds1057,marvel's avengers assemble,"adrian pasdar, fred tatasciore, roger smith, travis willingham, troy baker, bumper robinson",2012,5.0,season
ds1058,marvel's avengers: secret wars (shorts),,2016,1.0,season
ds1059,marvel's guardians of the galaxy (series),"will friedle, trevor devall, kevin richardson, vanessa marshall, david sobolov",2015,3.0,season
ds1060,marvel's guardians of the galaxy (shorts),,2014,2.0,season
ds1061,marvel's hero project,,2019,1.0,season
ds1062,marvel's inhumans,"anson mount, serinda swan, ken leung, eme ikwuakor, isabelle cornish, ellen woglom",2017,1.0,season
ds1063,marvel's rocket & groot (shorts),,2016,1.0,season
ds1064,marvel's ultimate comics,"cole howard, brian drummond",2016,1.0,season
ds1065,mary poppins,"julie andrews, dick van dyke, david tomlinson, glynis johns, hermione baddeley, karen dotrice",1964,142.0,min
ds1066,mater and the ghostlight,"larry the cable guy , owen wilson, michael wallis, bonnie hunt, paul newman, cheech marin",2006,8.0,min
ds1067,meet the deedles,"paul walker, steve wormer, john ashton, a.j. langer, robert englund, megan cavanagh",1998,94.0,min
ds1068,meet the robinsons,"angela bassett, daniel hansen, jordan fry, matthew josten, john ford, dara mcgarry",2007,97.0,min
ds1069,melody time,"roy rogers, trigger , dennis day, the andrews sisters , fred waring and his pennsylvanians , freddy martin",1948,76.0,min
ds1070,mickey down under,,1948,7.0,min
ds1071,mickey mouse (shorts),,2012,5.0,season
ds1072,mickey mouse club (1955-59),,1955,1.0,season
ds1073,"mickey, donald, goofy: the three musketeers","wayne allwine, tony anselmo, bill farmer, russi taylor, tress macneille, jim cummings",2004,71.0,min
ds1074,mickey's birthday party,"walt disney, thelma boardman, pinto colvig, clarence nash, florence gill",1942,9.0,min
ds1075,mickey's christmas carol,"alan young, wayne allwine, hal smith, will ryan, eddy carroll, patricia parris",1983,26.0,min
ds1076,mickey's delayed date,,1947,7.0,min
ds1077,mickey's once upon a christmas,"kelsey grammer, wayne allwine, russi taylor, tony anselmo, diane michelle, tress macneille",1999,67.0,min
ds1078,mickey's rival,"walt disney, marcelite garner, sonny dawson",1936,9.0,min
ds1079,mickey's trailer,"clarence nash, pinto colvig, walt disney",1938,8.0,min
ds1080,mickey's twice upon a christmas,"wayne allwine, tony anselmo, jeff bennett, jim cummings, bill farmer, tress macneille",2004,70.0,min
ds1081,mighty joe young,"bill paxton, charlize theron, rade šerbedžija, regina king, peter firth, naveen andrews",1998,116.0,min
ds1082,mike's new car,"billy crystal, john goodman",2002,5.0,min
ds1083,minutemen,"jason dolley, luke benward, nicholas braun, chelsea staub, steven mcqueen, kara crane",2008,91.0,min
ds1084,miracle,"kurt russell, patricia clarkson, noah emmerich, sean mccann, kenneth welsh, eddie cahill",2004,137.0,min
ds1085,miracle at midnight,"sam waterston, mia farrow, justin whalin, patrick malahide, benedick blythe",1998,89.0,min
ds1086,miracle in lane 2,"frankie muniz, rick rossovich, molly hagan, patrick levis, roger brown, tuc watkins",2000,90.0,min
ds1087,miracle landing on the hudson,"todd boyce, miriam lucia, james mcgregor, nathan nolan, phillip wright",2014,44.0,min
ds1088,mission to the sun,"henry goodman, jack baker",2018,44.0,min
ds1089,moana,"auli'i cravalho, dwayne johnson, rachel house, temuera morrison, nicole scherzinger, jemaine clement",2016,108.0,min
ds1090,mom's got a date with a vampire,"matthew o'leary, laura vandervoort, myles jeffrey, caroline rhea, charles shaughnessy, robert carradine",2000,83.0,min
ds1091,monsters university,"billy crystal, john goodman, steve buscemi, helen mirren, peter sohn, joel murray",2013,104.0,min
ds1092,"monsters, inc.","john goodman, billy crystal, mary gibbs, steve buscemi, james coburn, jennifer tilly",2001,93.0,min
ds1093,motocrossed,"alana austin, riley smith, mary-margaret humes, trever o'brien, timothy carhart, scott terra",2001,92.0,min
ds1094,mr. boogedy,"richard masur, mimi kennedy, benjamin gregory, david faustino, kristy swanson, howard witt",1986,46.0,min
ds1095,mr. duck steps out,,1940,9.0,min
ds1096,mr. mouse takes a trip,,1940,8.0,min
ds1097,mulan ii,"ming-na wen, b.d. wong, mark moseley, lucy liu, harvey fierstein, sandra oh",2005,82.0,min
ds1098,muppet moments (shorts),,2014,1.0,season
ds1099,muppet treasure island,"tim curry, kevin bishop, billy connolly, jennifer saunders, dave goelz, steve whitmire",1996,101.0,min
ds1100,muppets most wanted,"ricky gervais, ty burrell, tina fey, steve whitmire, eric jacobson, dave goelz",2014,111.0,min
ds1101,my favorite martian,"jeff daniels, christopher lloyd, elizabeth hurley, daryl hannah, wallace shawn, christine ebersole",1999,94.0,min
ds1102,my friends tigger & pooh,jim cummings,2006,2.0,season
ds1103,national treasure: book of secrets,"nicolas cage, jon voight, harvey keitel, ed harris, diane kruger, justin bartha",2007,125.0,min
ds1104,newsies,"christian bale, david moscow, bill pullman, gabriel damon, luke edwards, max casella",1992,122.0,min
ds1105,newsies: the broadway musical,"jeremy jordan, kara lindsay, ben fankhauser, andrew keenan-bolger, steve blanchard, aisha de haas",2017,134.0,min
ds1106,noelle,"anna kendrick, bill hader, kingsley ben-adir, billy eichner, julie hagerty, shirley maclaine",2019,105.0,min
ds1107,now you see it,"alyson michalka, johnny pacar, frank langella, brendan hill, chris olivero, gabriel sunday",2005,89.0,min
ds1108,olaf's frozen adventure,"josh gad, idina menzel, kristen bell, jonathan groff, chris williams, john de lancie",2017,25.0,min
ds1109,old yeller,"dorothy mcguire, fess parker, jeff york, chuck connors, beverly washburn, tommy kirk",1957,84.0,min
ds1110,oliver & company,"joey lawrence, billy joel, cheech marin, richard mulligan, roscoe browne, sheryl ralph",1988,76.0,min
ds1111,once upon a mattress,"carol burnett, tracey ullman, denis o'hare, zooey deschanel, michael boatman, edward hibbert",2005,88.0,min
ds1112,one magic christmas,"mary steenburgen, gary basaraba, elizabeth harnois, arthur hill, wayne robson, jan rubes",1985,89.0,min
ds1113,one man band,,2006,5.0,min
ds1114,operation dumbo drop,"danny glover, ray liotta, denis leary, doug doug, corin nemec, tcheky karyo",1995,109.0,min
ds1115,origins: the journey of humankind,"mark monroe, jason silva",2016,1.0,season
ds1116,out of the box,"vivian bayubay, tony james, jill schackner, aleisha allen, cece cortes, nicholas eng",1998,3.0,season
ds1117,paris to pittsburgh,rachel brosnahan,2018,77.0,min
ds1118,partly cloudy,"tony fucile, lori richardson",2009,6.0,min
ds1119,party central,"john goodman, billy crystal, dave foley, sean hayes, joel murray, charlie day",2014,7.0,min
ds1120,perri,winston hibler,1957,75.0,min
ds1121,pete's dragon,"bryce howard, oakes fegley, wes bentley, karl urban, oona laurence, isiah whitlock jr.",2016,106.0,min
ds1122,peter pan,"bobby driscoll, kathryn beaumont, hans conried, bill thompson, heather angel, paul collins",1953,79.0,min
ds1123,peter pan: return to never land,"harriet owen, blayne weaver, corey burton, jeff bennett, kath soucie, andrew mcdonough",2002,77.0,min
ds1124,phantom of the megaplex,"taylor handley, corinne bohrer, caitlin wachs, jacob smith, rich hutchman, john novak",2000,89.0,min
ds1125,phil of the future,"ricky ullman, amy bruckner, craig anton, lise simms, alyson michalka",2003,2.0,season
ds1126,phineas and ferb,"vincent martella, ashley tisdale, thomas sangster, caroline rhea, alyson stoner, mitchel musso",2007,4.0,season
ds1127,phineas and ferb the movie: across the 2nd dimension,"vincent martella, ashley tisdale, thomas brodie-sangster, caroline rhea, richard o'brien, dan povenmire",2011,79.0,min
ds1128,phineas and ferb: mission marvel,"vincent martella, ashley tisdale, thomas brodie-sangster, caroline rhea, richard o'brien, dan povenmire",2013,46.0,min
ds1129,piglet's big movie,"john fiedler, jim cummings, andre stojka, kath soucie, nikita hopkins, peter cullen",2003,78.0,min
ds1130,pinocchio,"dickie jones, christian rub, cliff edwards, evelyn venable, walter catlett, charles judels",1940,90.0,min
ds1131,piper,,2016,6.0,min
ds1132,pirates of the caribbean: at world's end,"johnny depp, orlando bloom, keira knightley, stellan skarsgård, bill nighy, chow yun-fat",2007,169.0,min
ds1133,pirates of the caribbean: dead man's chest,"johnny depp, orlando bloom, keira knightley, stellan skarsgård, bill nighy, jack davenport",2006,152.0,min
ds1134,pirates of the caribbean: the curse of the black pearl,"johnny depp, geoffrey rush, orlando bloom, keira knightley, jack davenport, kevin mcnally",2003,144.0,min
ds1135,pixar in real life,,2019,1.0,season
ds1136,pixel perfect,"ricky ullman, leah pipes, spencer redford, chris williams, tania gunadi, porscha coleman",2004,90.0,min
ds1137,planet of the birds,rodd houston,2018,45.0,min
ds1138,pluto and the gopher,,1950,7.0,min
ds1139,pluto's christmas tree,"jimmy macdonald, pinto colvig, clarence nash, ruth clifford, dessie miller",1952,7.0,min
ds1140,pluto's surprise package,,1949,7.0,min
ds1141,pluto's sweater,,1949,7.0,min
ds1142,pocahontas,"irene bedard, judy kuhn, mel gibson, david ogden stiers, john kassir, russell means",1995,85.0,min
ds1143,pocahontas ii: journey to a new world,"irene bedard, jim cummings, donal gibson, finola hughes, linda hunt, judy kuhn",1998,77.0,min
ds1144,pollyanna,"jane wyman, richard egan, karl malden, nancy olson, adolphe menjou, donald crisp",1960,135.0,min
ds1145,pooh's grand adventure: the search for christopher robin,"jim cummings, john fiedler, ken sansom, andre stojka, peter cullen, brady bluhm",1997,78.0,min
ds1146,pooh's heffalump movie,"jim cummings, john fiedler, nikita hopkins, kath soucie, ken sansom, peter cullen",2005,73.0,min
ds1147,presto,,2008,5.0,min
ds1148,princess protection program,"demi lovato, selena gomez, nicholas braun, molly hagan, johnny rodriguez, jamie chung",2009,90.0,min
ds1149,purl,"bret parker, emily davis, kelsey mann, austin madison, erik langley, michael daley",2019,12.0,min
ds1150,quack pack,"tony anselmo, james avery, brian cummings, e.g. daily, jeannie elias, pamela segall",1996,1.0,season
ds1151,queen of katwe,"david oyelowo, lupita nyong'o, madina nalwanga, martin kabanza, taryn kyaze, esther tebandeke",2016,125.0,min
ds1152,quints,"kimberly brown, daniel roebuck, elizabeth morehead, shadia simmons, jake epstein, vince corazza",2000,83.0,min
ds1153,ratatouille,"patton oswalt, ian holm, lou romano, brian dennehy, peter sohn, peter o'toole",2007,111.0,min
ds1154,read it and weep,"kay panabaker, jason dolley, robin riker, tom virtue, alexandra krosney, danielle panabaker",2006,85.0,min
ds1155,ready to run,"krissy perez, jason dohring, lillian hurst, jon brazier, nestor serrano, theresa saldana",2000,89.0,min
ds1156,recess: all growed down,"rickey collins, jason davis, ashley johnson, myles jeffrey, andrew lawrence, ross malinger",2003,61.0,min
ds1157,recess: school's out,"rickey collins, jason davis, ashely johnson, andy lawrence, courtland mead, pam segall",2001,87.0,min
ds1158,recess: taking the 5th grade,"rickey collins, jason davis, myles jeffrey, ashley johnson, courtland mead, pamela adlon",2003,63.0,min
ds1159,red's dream,,1987,4.0,min
ds1160,remember the titans,"denzel washington, will patton, donald faison, wood harris, ryan hurst, ethan suplee",2000,114.0,min
ds1161,rescue dog,,1947,7.0,min
ds1162,return from witch mountain,"bette davis, christopher lee, kim richards, ike eisenmann, jack soo, anthony james",1978,94.0,min
ds1163,return to halloweentown,"sara paxton, judith hoag, lucas grabeel, j. zimmerman, kristy wu, keone young",2006,89.0,min
ds1164,return to oz,"nicol williamson, jean marsh, piper laurie, matt clark, fairuza balk, michael sundin",1985,110.0,min
ds1165,richie rich's christmas wish,"david gallagher, eugene levy, keene curtis, jake richardson, martin mull, lesley warren",1998,85.0,min
ds1166,right on track,"beverley mitchell, brie larson, marcus toji, jodi russell, jon lindstrom, ruby o'neil",2003,88.0,min
ds1167,riley’s first date?,"lori alan, carlos alazraqui, lewis black, josh cooley, ben cox, kaitlyn dias",2015,8.0,min
ds1168,rip girls,"camilla belle, dwier brown, stacie hess, brian stark, jeanne mori, lauren sinclair",2000,87.0,min
ds1169,robin hood,"roger miller, peter ustinov, terry-thomas , brian bedford, monica evans, phil harris",1973,85.0,min
ds1170,rocky mountain animal rescue,chopper bernet,2018,1.0,season
ds1171,rogue one: a star wars story,"felicity jones, diego luna, ben mendelsohn, donnie yen, mads mikkelsen, alan tudyk",2016,134.0,min
ds1172,roving mars,"paul newman, steve squyres, rob manning, dr. elachi, wayne lee",2006,41.0,min
ds1173,ruby bridges,"penelope miller, kevin pollak, michael beach, jean kelly, peter james, patrika darbo",1998,90.0,min
ds1174,sacred planet,"robert redford, arapata mckay, tsaan ciqae, mae tui, cy peck jr., mutang urud",2004,47.0,min
ds1175,saludos amigos,fred shields,1943,42.0,min
ds1176,"sammy, the way-out seal","jack carson, robert culp, patricia barry, elisabeth fraser, michael mcgreevey, billy mummy",1962,43.0,min
ds1177,sanjay's super team,"brenton schraff, sunny attar, arun rao, jaquelynn herrera",2015,7.0,min
ds1178,santa paws 2: the santa pups,"cheryl ladd, george newbern, pat finn, danny woodburn, obba babatunde, paul rae",2012,92.0,min
ds1179,santa's workshop,,1932,7.0,min
ds1180,saving mr. banks,"emma thompson, tom hanks, colin farrell, paul giamatti, jason schwartzman, bradley whitford",2013,129.0,min
ds1181,science fair,"anjali chadha, ryan folz, harsha paladugu, abraham riedel-mishaan, kashfia rahman, ivo zell",2018,91.0,min
ds1182,sea of hope: america's underwater treasures,max kennedy,2017,47.0,min
ds1183,secret of the wings,"mae whitman, lucy hale, timothy dalton, jeff bennett, lucy liu, raven-symoné",2012,79.0,min
ds1184,secretariat,"diane lane, john malkovich, dylan walsh, james cromwell, kevin connolly, nelsan ellis",2010,124.0,min
ds1185,secrets of christ's tomb: explorer special,,2017,47.0,min
ds1186,secrets of life,winston hibler,1956,70.0,min
ds1187,secrets of the king cobra,andre braugher,2012,47.0,min
ds1188,shake it up,"bella thorne, zendaya , davis cleveland, roshon fegan, adam irigoyen, kenton duty",2010,3.0,season
ds1189,sharks of lost island,chris mclinden,2013,45.0,min
ds1190,sharpay's fabulous adventure,"ashley tisdale, austin butler, cameron goodman, bradley perry, alec mapa, jack plotnick",2011,92.0,min
ds1191,shipwrecked,"stian smestad, trond peter munch, louisa haigh, gabriel byrne, bjørn sundquist, eva von hanno",1991,93.0,min
ds1192,silver surfer,"paul essiembre, james blendick, robert bockstael, jennifer daley, colin fox",1997,1.0,season
ds1193,simpsons movie,"dan castellaneta, julie kavner, nancy cartwright, yeardley smith, harry shearer, hank azaria",2007,88.0,min
ds1194,sister act,"whoopi goldberg, maggie smith, harvey keitel, bill nunn, mary wickes, kathy najimy",1992,101.0,min
ds1195,sister act 2: back in the habit,"whoopi goldberg, kathy najimy, barnard hughes, mary wickes, james coburn, michael jeter",1993,108.0,min
ds1196,skyrunners,"kelly blatz, joey pollari, conrad coates, jacqueline wood, nathan stephenson, kerry laifatt",2009,93.0,min
ds1197,sleeping beauty,"mary costa, eleanor audley, barbara luddy, taylor holmes, bill shirley, verna felton",1959,77.0,min
ds1198,smart house,"ryan merriman, kevin kilner, jessica steen, katie volding, katey sagal, emilio borelli",1999,82.0,min
ds1199,smash and grab,,2019,8.0,min
ds1200,snow white and the seven dwarfs,"adriana caselotti, harry stockwell, lucille laverne, moroni olsen, billy gilbert, pinto colvig",1937,84.0,min
ds1201,snowball express,"dean jones, nancy olson, harry morgan, keenan wynn, johnny whitaker, michael mcgreevy",1972,94.0,min
ds1202,snowglobe,"christina milian, erin karpluk, hilda doherty, jason schombing, james kot, andrew krivanek",2007,90.0,min
ds1203,so weird,"cara delizia, patrick levis, erik von detten, belinda metz, dave ward, mackenzie phillips",1999,3.0,season
ds1204,society dog show,"pinto colvig, walt disney",1939,9.0,min
ds1205,spider-man (shorts),,2016,1.0,season
ds1206,spider-man and his amazing friends,"hans conried, jerry dexter, george dicenzo, alan dinehart, walker edminston, michael evans",1982,1.0,season
ds1207,spider-man unlimited,"rino romano, kathleen barr, jim byrnes, garry chalk, paul dobson",1999,1.0,season
ds1208,spider-woman,"joan ark, bruce miller, bryan scott, lou krugman, dick tufeld",1979,1.0,season
ds1209,star wars forces of destiny (shorts),"ashley eckstein, matt lanter, c1-10p a.k.a. ""chopper"" , john boyega, vanessa marshall, felicity jones",2016,2.0,season
ds1210,star wars rebels,"taylor gray, vanessa marshall, freddie prinze jr., tiya sircar, steve blum, c1-10p a.k.a. ""chopper""",2014,4.0,season
ds1211,star wars rebels (shorts),,2014,1.0,season
ds1212,star wars: a new hope (episode iv),"mark hamill, harrison ford, carrie fisher, peter cushing, alec guinness, anthony daniels",1977,125.0,min
ds1213,star wars: attack of the clones (episode ii),"ewan mcgregor, natalie portman, hayden christensen, frank oz, ian mcdiarmid, pernilla august",2002,143.0,min
ds1214,star wars: blips,,2019,1.0,season
ds1215,star wars: return of the jedi (episode vi),"mark hamill, harrison ford, carrie fisher, billy williams, anthony daniels, peter mayhew",1983,135.0,min
ds1216,star wars: revenge of the sith (episode iii),"ewan mcgregor, natalie portman, hayden christensen, ian mcdiarmid, frank oz, jimmy smits",2005,140.0,min
ds1217,star wars: the empire strikes back (episode v),"mark hamill, harrison ford, carrie fisher, billy williams, anthony daniels, david prowse",1980,127.0,min
ds1218,star wars: the force awakens (episode vii),"harrison ford, mark hamill, carrie fisher, adam driver, daisy ridley, john boyega",2015,139.0,min
ds1219,star wars: the phantom menace (episode i),"liam neeson, ewan mcgregor, natalie portman, jake lloyd, pernilla august, frank oz",1999,136.0,min
ds1220,starstruck,"sterling knight, danielle campbell, maggie castle, brandon smith, chelsea staub, beth littleford",2010,81.0,min
ds1221,steamboat willie,walt disney,1928,8.0,min
ds1222,stepsister from planet weird,"courtnee draper, tamara hope, lance guest, khrystyne haje, vanessa chester, myles jeffrey",2000,86.0,min
ds1223,stitch! the movie,"daveigh chase, chris sanders, tia carrere, david stiers, kevin mcdonald, ving rhames",2003,62.0,min
ds1224,stonehenge decoded: secrets revealed,craig sechler,2008,44.0,min
ds1225,stuck in the suburbs,"danielle panabaker, brenda song, amanda shaw, cici hedgepeth, jennie garland, ryan belleville",2004,79.0,min
ds1226,sultan and the rock star,"timothy hutton, ken swofford, bruce glover, ned romero, richard paul, pat delany",1980,47.0,min
ds1227,super buddies,"jeremy shinder, tenzing trainor, ty panitz, g. hannelius, cooper roth, colin hanks",2013,83.0,min
ds1228,swiss family robinson,"thomas mitchell, edna best, freddie bartholomew, terry kilburn, tim holt, baby quillan",1940,94.0,min
ds1229,talespin,"charlie adler, jim cummings, ed gilbert, chuck mccann, alan roberts, sally struthers",1990,1.0,season
ds1230,tall tale,"scott glenn, oliver platt, nick stahl, stephen lang, roger brown, jared harris",1995,97.0,min
ds1231,tangled,"mandy moore, zachary levi, donna murphy, ron perlman, m.c. gainey, jeffrey tambor",2010,101.0,min
ds1232,tangled before ever after,"zachary levi, mandy moore, eden espinosa, clancy brown, julie bowen, laura benanti",2017,58.0,min
ds1233,tarzan & jane,"michael weiss, olivia d'abo, rene auberjonois, jeff bennett, jim cummings, grey delisle",2002,78.0,min
ds1234,teacher's pet,"nathan lane, kelsey grammer, shaun fleming, debra rupp, david stiers, jerry stiller",2004,75.0,min
ds1235,teen beach 2,"ross lynch, maia mitchell, grace phipps, garrett clayton, john deluca, chrissie fit",2015,106.0,min
ds1236,teen beach movie,"ross lynch, maia mitchell, grace phipps, garrett clayton, john deluca, chrissie fit",2013,97.0,min
ds1237,teen spirit,"cassie scerbo, lindsey shaw, chris zylka, tim gunn, carissa capobianco, gabriela lopez",2011,82.0,min
ds1238,that darn cat,"christina ricci, doug doug, george dzundza, peter boyle, michael mckean, bess armstrong",1997,90.0,min
ds1239,that darn cat!,"hayley mills, dean jones, dorothy provine, roddy mcdowall, neville brand, elsa lanchester",1965,116.0,min
ds1240,the absent-minded professor,"fred macmurray, nancy olson, keenan wynn, tommy kirk, leon ames, elliott reid",1961,96.0,min
ds1241,the adventures of andré & wally b.,,1984,2.0,min
ds1242,the adventures of bullwhip griffin,"roddy mcdowall, suzanne pleshette, karl malden, harry guardino, richard haydn, hermione baddeley",1967,111.0,min
ds1243,the adventures of huck finn,"elijah wood, courtney vance, robbie coltrane, jason robards, ron perlman, dana ivey",1993,108.0,min
ds1244,the adventures of ichabod and mr. toad,"bing crosby, basil rathbone, eric blore, pat o'malley, john ployardt, colin campbell",1949,69.0,min
ds1245,the adventures of spin and marty,"david stollery, tim considine",1955,1.0,season
ds1246,the african lion,winston hibler,1955,72.0,min
ds1247,the apple dumpling gang,"bill bixby, susan clark, don knotts, tim conway, david wayne, slim pickens",1975,100.0,min
ds1248,the apple dumpling gang rides again,"tim conway, don knotts, tim matheson, kenneth mars, elyssa davalos, jack elam",1979,89.0,min
ds1249,the aristocats,"phil harris, eva gabor, sterling holloway, scatman crothers, paul winchell, lord tim hudson",1970,81.0,min
ds1250,the art of skiing,john mcleish,1941,8.0,min
ds1251,the avengers: earth's mightiest heroes,"eric loomis, bumper robinson, dawn olivera, phil lamarr, alex desert, kari wuhrer",2010,2.0,season
ds1252,the avengers: united they stand,"martin roach, rod wilson, lenore zann, ron rubin, hamish mcewan, lynda ballantyne",1999,1.0,season
ds1253,the band concert,clarence nash,1935,10.0,min
ds1254,the bears and i,"patrick wayne, chief george, andrew duggan, michael ansara, robert pine, val devargas",1974,83.0,min
ds1255,the big bad wolf,,1934,9.0,min
ds1256,the biscuit eater,"earl holliman, patricia crowley, lew ayres, godfrey cambridge, beah richards, clifton james",1972,93.0,min
ds1257,the black cauldron,"grant bardsley, susan sheridan, freddie jones, nigel hawthorne, arthur malet, john byner",1985,82.0,min
ds1258,the black hole,"maximilian schell, anthony perkins, robert forster, joseph bottoms, yvette mimieux, ernest borgnine",1979,98.0,min
ds1259,the blue umbrella,sarah jaffe,2013,7.0,min
ds1260,the book of once upon a time,kate mulvany,2014,4.0,season
ds1261,the book of pooh,"jim cummings, paul tiesler, jeff bennett, peter cullen, stephanie d’abruzzo, john fiedler",2000,2.0,season
ds1262,the brave little toaster goes to mars,"deanna oliver, tim stack, roger kabler, thurl ravenscroft, eric lloyd, farrah fawcett",1998,73.0,min
